vendor,product,iot,kev,1d,1d_uniq_ip,7d,30d,90d,history,cve,total,last_seen
Fortinet,"FortiOS, FortiProxy, and FortiSwitchManager",True,True,12588,35.0,3524,6293,4424,"{'05/12/2025': {'connections': 12588, 'uniq_ips': 35}}",CVE-2022-40684,1519558,2025-12-05 12:56:12.894232
TBK,TBK DVR-4104/DVR-4216,True,True,7186,6.0,1616,1596,1150,"{'05/12/2025': {'connections': 7186, 'uniq_ips': 6}}",CVE-2024-3721,297357,2025-12-05 12:56:12.959886
LB-LINK,"LB-LINK BL-AC1900_2.0, LB-LINK BL-WR9000, LB-LINK BL-X26, LB-LINK BL-LTE300",True,True,6359,7.0,3513,2224,1285,"{'05/12/2025': {'connections': 6359, 'uniq_ips': 7}}",CVE-2023-26801,1457976,2025-12-05 12:56:12.907536
Cisco,Cisco IOS XE,True,True,3366,293.0,3778,4422,3175,"{'05/12/2025': {'connections': 3366, 'uniq_ips': 293}}",CVE-2023-20198,1904885,2025-12-05 12:56:12.876492
Huawei,Huawei Home Gateway HG532,True,True,2572,457.0,2556,3296,3397,"{'04/12/2025': {'connections': 2572, 'uniq_ips': 457}}",CVE-2017-17215,7347195,2025-12-04 12:59:17.635959
Apache,Struts,True,True,2277,1.0,2277,2277,2277,"{'21/12/2024': {'connections': 2277, 'uniq_ips': 1}}",CVE-2024-53677,2277,2024-12-21 12:39:56.606715
PHPUnit - Sebastian Bergmann,PHPUnit,True,True,1936,154.0,1366,2858,1767,"{'05/12/2025': {'connections': 1936, 'uniq_ips': 154}}",CVE-2017-9841,6044328,2025-12-05 12:56:12.821805
Ivanti,"Endpoint Manager Mobile (EPMM), formerly MobileIron Core",True,True,1794,35.0,258,548,393,"{'05/12/2025': {'connections': 1794, 'uniq_ips': 35}}",CVE-2023-35081,86572,2025-12-05 12:56:12.872470
Ivanti,"Endpoint Manager Mobile (EPMM), formerly MobileIron Core",True,True,1709,1.0,589,816,657,"{'05/12/2025': {'connections': 1709, 'uniq_ips': 1}}",CVE-2025-4427,294420,2025-12-05 12:56:12.961963
Zyxel,Eir D1000,True,True,1687,299.0,952,486,418,"{'05/12/2025': {'connections': 1687, 'uniq_ips': 299}}",CVE-2016-10372,150034,2025-12-05 12:56:12.865065
Citrix,Application Delivery Controller,True,True,1687,2.0,2716,4098,3091,"{'05/12/2025': {'connections': 1687, 'uniq_ips': 2}}",CVE-2019-19781,873298,2025-12-05 12:56:12.894911
Geoserver,Geoserver,True,True,1640,2.0,1190,1965,1795,"{'05/12/2025': {'connections': 1640, 'uniq_ips': 2}}",CVE-2024-36401,912738,2025-12-05 12:56:12.952140
Oracle,Oracle Weblogic Server,True,True,1406,4.0,881,1295,610,"{'05/12/2025': {'connections': 1406, 'uniq_ips': 4}}",CVE-2017-10271,103988,2025-12-05 12:56:12.866932
ASUS,GT-AC2900,True,True,1322,5.0,1184,1107,862,"{'05/12/2025': {'connections': 1322, 'uniq_ips': 5}}",CVE-2021-32030,633681,2025-12-05 12:56:12.915048
Spring,Spring Cloud Function,True,True,1254,1.0,1254,281,235,"{'29/11/2025': {'connections': 1254, 'uniq_ips': 1}}",CVE-2022-22963,1785,2025-11-29 12:51:06.026739
QNAP,QNAP Music Station,True,True,1157,4.0,1051,802,802,"{'01/12/2025': {'connections': 1157, 'uniq_ips': 4}}",CVE-2023-45038,16691,2025-12-01 12:57:36.209737
Fortra,GoAnywhere MFT,True,True,971,5.0,166,55,37,"{'28/11/2025': {'connections': 971, 'uniq_ips': 5}}",CVE-2024-0204,30097,2025-11-28 12:54:30.393315
D-Link,"D-Link DIR-615, DIR-655C, DIR-825, DIR-835, DIR-855L, DIR-866L, DIR-652, DIR-862L, DHP-1565, DAP-1533",True,True,933,4.0,287,347,466,"{'05/12/2025': {'connections': 933, 'uniq_ips': 4}}",CVE-2019-16920,127506,2025-12-05 12:56:12.963845
XWiki,XWiki Platform,True,True,922,1.0,418,255,152,"{'05/12/2025': {'connections': 922, 'uniq_ips': 1}}",CVE-2025-24893,11909,2025-12-05 12:56:12.948302
Linksys,Linksys E Series,True,True,919,1.0,580,528,656,"{'05/12/2025': {'connections': 919, 'uniq_ips': 1}}",CVE-2013-2678,29019,2025-12-05 12:56:12.961349
Four-Faith,Four-Faith F3x24 and F3x36,True,True,919,1.0,444,258,505,"{'05/12/2025': {'connections': 919, 'uniq_ips': 1}}",CVE-2024-12856,36275,2025-12-05 12:56:12.811932
Apache,Apache HTTP Server,True,True,894,158.0,866,1053,741,"{'05/12/2025': {'connections': 894, 'uniq_ips': 158}}",CVE-2021-42013,369051,2025-12-05 12:56:12.925742
Realtek,Realtek SDK,True,True,844,310.0,465,452,502,"{'05/12/2025': {'connections': 844, 'uniq_ips': 310}}",CVE-2014-8361,798078,2025-12-05 12:56:12.782457
Dasan,Dasan GPON Home Router,True,True,839,322.0,1190,738,603,"{'05/12/2025': {'connections': 839, 'uniq_ips': 322}}",CVE-2018-10562,287250,2025-12-05 12:56:12.826567
Fortinet,Fortinet FortiWeb,True,True,838,10.0,403,298,298,"{'05/12/2025': {'connections': 838, 'uniq_ips': 10}}",CVE-2025-64446,4782,2025-12-05 12:56:12.967039
Tuoshi/Dionlink,Tuoshi/Dionlink LT15D 4G Wi-Fi,True,True,826,1.0,826,826,826,"{'13/11/2025': {'connections': 826, 'uniq_ips': 1}}",CVE-2024-53944,2467,2025-11-13 12:56:32.883169
Microsoft,Exchange,True,True,747,182.0,649,682,624,"{'05/12/2025': {'connections': 747, 'uniq_ips': 182}}",CVE-2022-41082,165823,2025-12-05 12:56:12.903750
Schneider Electric,Schneider Electric U.Motion Builder,True,True,714,1.0,714,714,714,{},CVE-2018-7841,714,2025-11-25 12:56:15.378919
QNAP,QNAP QTS and QuTS Hero,True,True,600,3.0,600,2184,2184,"{'21/11/2025': {'connections': 600, 'uniq_ips': 3}}",CVE-2023-50358,15985,2025-11-21 12:53:31.505010
VMware,Workspace ONE Access and Identity Manager,True,True,595,2.0,393,305,404,"{'05/12/2025': {'connections': 595, 'uniq_ips': 2}}",CVE-2022-22954,30185,2025-12-05 12:56:12.826115
Metabase,Metabase,True,True,592,132.0,523,624,533,"{'05/12/2025': {'connections': 592, 'uniq_ips': 132}}",CVE-2023-38646,352427,2025-12-05 12:56:12.772906
Samsung,Samsung magicINFO 9,True,True,552,1.0,454,207,161,"{'05/12/2025': {'connections': 552, 'uniq_ips': 1}}",CVE-2024-7399,14164,2025-12-05 12:56:12.941027
Zyxel/Billion,"ZyXEL P660HN-T1A v1, ZyXEL P660HN-T1A v2, Billion 5200W-T",True,True,549,29.0,600,855,657,"{'05/12/2025': {'connections': 549, 'uniq_ips': 29}}",CVE-2017-18368,224077,2025-12-05 12:56:12.844159
Microsoft,Exchange,True,True,531,16.0,264,498,510,"{'05/12/2025': {'connections': 531, 'uniq_ips': 16}}",CVE-2021-26855,198080,2025-12-05 12:56:12.950321
Drupal,Drupal,True,True,494,7.0,150,525,261,"{'05/12/2025': {'connections': 494, 'uniq_ips': 7}}",CVE-2018-7600,62348,2025-12-05 12:56:12.905411
NETGEAR,"WN604, WN802Tv2, WNAP210v2, WNAP320, WNDAP350, WNDAP360, and WNDAP660",True,True,488,4.0,146,524,650,"{'05/12/2025': {'connections': 488, 'uniq_ips': 4}}",CVE-2016-1555,114553,2025-12-05 12:56:12.929179
Totolink,TOTOLINK Realtek SDK based routers,True,True,487,4.0,150,130,162,"{'05/12/2025': {'connections': 487, 'uniq_ips': 4}}",CVE-2019-19824,62216,2025-12-05 12:56:12.856187
D-Link,"D-Link DNS-320, DNS-320LW, DNS-325 and DNS-340L",True,True,483,1.0,204,201,252,"{'05/12/2025': {'connections': 483, 'uniq_ips': 1}}",CVE-2024-10914,40677,2025-12-05 12:56:12.882844
BYTEVALUE,BYTEVALUE Intelligent Flow Control Router,True,True,482,1.0,335,280,298,"{'05/12/2025': {'connections': 482, 'uniq_ips': 1}}",CVE-2023-7311,5978,2025-12-05 12:56:12.781594
DigiEver,DigiEver DS-2105 Pro,True,True,482,1.0,334,561,385,"{'05/12/2025': {'connections': 482, 'uniq_ips': 1}}",CVE-2023-52163,27863,2025-12-05 12:56:12.885993
Genexis,Genexis PLATINUM 4410,True,True,481,1.0,282,282,282,"{'05/12/2025': {'connections': 481, 'uniq_ips': 1}}",CVE-2021-29003,845,2025-12-05 12:56:12.791856
GeoVision,GeoVision embedded devices,True,True,480,1.0,334,281,299,"{'05/12/2025': {'connections': 480, 'uniq_ips': 1}}",CVE-2018-25118,5999,2025-12-05 12:56:12.855067
Zivif,Zivif PR115-204-P-RS,True,True,480,1.0,335,280,302,"{'05/12/2025': {'connections': 480, 'uniq_ips': 1}}",CVE-2017-17105,7319,2025-12-05 12:56:12.834442
LILIN,LILIN DVR,True,True,479,1.0,333,213,279,"{'05/12/2025': {'connections': 479, 'uniq_ips': 1}}",CVE-2021-30168,23328,2025-12-05 12:56:12.873131
frangoteam,FUXA,True,True,463,3.0,577,741,358,"{'05/12/2025': {'connections': 463, 'uniq_ips': 3}}",CVE-2023-33831,35939,2025-12-05 12:56:12.880091
SaltStack,Salt,True,True,457,4.0,579,830,382,"{'05/12/2025': {'connections': 457, 'uniq_ips': 4}}",CVE-2020-16846,113020,2025-12-05 12:56:12.943752
D-Link,D-Link DIR-859,True,True,455,1.0,394,394,173,"{'05/12/2025': {'connections': 455, 'uniq_ips': 1}}",CVE-2019-17621,13427,2025-12-05 12:56:12.916165
Apache,Spark,True,True,440,1.0,216,163,83,"{'05/12/2025': {'connections': 440, 'uniq_ips': 1}}",CVE-2022-33891,7196,2025-12-05 12:56:12.943966
Tenda,Tenda 03V2,True,True,439,1.0,329,278,300,"{'05/12/2025': {'connections': 439, 'uniq_ips': 1}}",CVE-2025-7414,11966,2025-12-05 12:56:12.789121
Apache,Log4j,True,True,397,36.0,303,7504,9442,"{'05/12/2025': {'connections': 397, 'uniq_ips': 36}}",CVE-2021-44228,2312316,2025-12-05 12:56:12.934183
Dahua,Dahua DVR/NVR/IPC,True,True,352,6.0,132,39,45,"{'05/12/2025': {'connections': 352, 'uniq_ips': 6}}",CVE-2017-7927,27408,2025-12-05 12:56:12.865312
NextGen Healthcare,Mirth Connect,True,True,348,1.0,74,72,122,"{'05/12/2025': {'connections': 348, 'uniq_ips': 1}}",CVE-2023-43208,85338,2025-12-05 12:56:12.829031
SonicWall,SonicOS,True,True,336,69.0,828,938,1104,"{'05/12/2025': {'connections': 336, 'uniq_ips': 69}}",CVE-2022-22274,833155,2025-12-05 12:56:12.862314
Amcrest,Amcrest IPM-721S,True,True,333,1.0,157,66,43,"{'05/12/2025': {'connections': 333, 'uniq_ips': 1}}",CVE-2017-8226,19137,2025-12-05 12:56:12.918527
SAP,NetWeaver,True,True,330,2.0,209,141,97,"{'05/12/2025': {'connections': 330, 'uniq_ips': 2}}",CVE-2025-31324,16066,2025-12-05 12:56:12.832860
SonicWall,SonicOS,True,True,324,69.0,821,921,1077,"{'05/12/2025': {'connections': 324, 'uniq_ips': 69}}",CVE-2023-0656,393247,2025-12-05 12:56:12.965604
Microsoft,Windows Server Update Service,True,True,318,11.0,115,93,78,"{'05/12/2025': {'connections': 318, 'uniq_ips': 11}}",CVE-2025-59287,2179,2025-12-05 12:56:12.886886
Totolink,Totolink N150RT,True,True,315,1.0,315,315,315,"{'20/10/2025': {'connections': 315, 'uniq_ips': 1}}",CVE-2025-3987,315,2025-10-20 12:54:08.035732
Atlassian,Confluence,True,True,284,4.0,141,639,680,"{'05/12/2025': {'connections': 284, 'uniq_ips': 4}}",CVE-2021-26084,1824010,2025-12-05 12:56:12.818101
Microsoft,SharePoint,True,True,280,1.0,152,106,219,"{'05/12/2025': {'connections': 280, 'uniq_ips': 1}}",CVE-2025-53770,19065,2025-12-05 12:56:12.962581
Atlassian,Confluence,True,True,274,4.0,1505,3082,10196,"{'05/12/2025': {'connections': 274, 'uniq_ips': 4}}",CVE-2022-26134,13110602,2025-12-05 12:56:12.852627
AirLink101,AirLink101 SkyIPCam1620W,True,True,253,1.0,253,253,253,"{'20/10/2025': {'connections': 253, 'uniq_ips': 1}}",CVE-2015-2280,253,2025-10-20 12:54:07.947659
Atlassian,Confluence,True,True,248,4.0,116,1120,1035,"{'05/12/2025': {'connections': 248, 'uniq_ips': 4}}",CVE-2023-22515,1080670,2025-12-05 12:56:12.880551
Tenda,Tenda G103,True,True,232,1.0,232,232,232,"{'20/10/2025': {'connections': 232, 'uniq_ips': 1}}",CVE-2023-27076,232,2025-10-20 12:54:08.070101
SugarCRM,SugarCRM,True,True,217,1.0,1350,1488,1301,"{'05/12/2025': {'connections': 217, 'uniq_ips': 1}}",CVE-2025-25034,27320,2025-12-05 12:56:12.789571
F5,BIG-IP,True,True,217,3.0,115,126,135,"{'05/12/2025': {'connections': 217, 'uniq_ips': 3}}",CVE-2022-1388,72395,2025-12-05 12:56:12.920569
TP-Link,TP-Link Archer AX21,True,True,213,8.0,372,528,262,"{'05/12/2025': {'connections': 213, 'uniq_ips': 8}}",CVE-2023-1389,1114006,2025-12-05 12:56:12.821590
CrushFTP,CrushFTP,True,True,207,1.0,124,240,206,"{'05/12/2025': {'connections': 207, 'uniq_ips': 1}}",CVE-2025-2825,245180,2025-12-05 12:56:12.811285
GitLab,GitLab CE/EE,True,True,170,10.0,170,170,170,"{'31/08/2024': {'connections': 170, 'uniq_ips': 10}, '01/09/2024': {'connections': 170, 'uniq_ips': 10}}",CVE-2021-22205,174,2024-09-01 12:01:11.434075
Microsoft,Exchange,True,True,170,2.0,124,487,375,"{'05/12/2025': {'connections': 170, 'uniq_ips': 2}}",CVE-2021-34473,62360,2025-12-05 12:56:12.938765
D-Link,"D-Link DIR-645, DAP-1522 revB, DAP-1650 revB, DIR-880L, DIR-865L, DIR-860L revA, DIR-860L revB DIR-815 revB, DIR-300 revB, DIR-600 revB, DIR-645, TEW-751DR, TEW-733GR",True,True,146,142.0,144,144,196,"{'04/12/2025': {'connections': 146, 'uniq_ips': 142}}",CVE-2015-2051,96026,2025-12-04 12:59:17.561009
Palo Alto Networks,PAN-OS,True,True,128,1.0,124,147,151,"{'04/12/2025': {'connections': 128, 'uniq_ips': 1}}",CVE-2024-9474,101699,2025-12-04 12:59:17.438527
CrushFTP,CrushFTP,True,True,125,1.0,100,505,315,"{'05/12/2025': {'connections': 125, 'uniq_ips': 1}}",CVE-2025-54309,8798,2025-12-05 12:56:12.894443
Ivanti,Sentry,True,True,124,23.0,124,42,42,{},CVE-2023-38035,2749,2025-11-18 12:55:38.739194
Hikvision,Hikvision Web Server,True,True,120,4.0,78,122,115,"{'05/12/2025': {'connections': 120, 'uniq_ips': 4}}",CVE-2021-36260,264342,2025-12-05 12:56:12.907089
Netgear,NETGEAR R/D Series Routers,True,True,109,107.0,91,89,80,"{'05/12/2025': {'connections': 109, 'uniq_ips': 107}}",CVE-2016-6277,19094,2025-12-05 12:56:12.862079
Langflow,Langflow,True,True,107,2.0,107,101,63,"{'05/12/2025': {'connections': 107, 'uniq_ips': 2}}",CVE-2025-3248,25544,2025-12-05 12:56:12.899239
Grafana,Grafana,True,True,103,1.0,103,32,20,"{'01/12/2025': {'connections': 103, 'uniq_ips': 1}}",CVE-2020-13379,11858,2025-12-01 12:57:36.179988
Cybele Software,Thinfinity VirtualUI,True,True,95,1.0,48,27,16,"{'01/12/2025': {'connections': 95, 'uniq_ips': 1}}",CVE-2021-45092,4798,2025-12-01 12:57:36.245070
ForgeRock,ForgeRock Access Manager,True,True,94,1.0,33,45,22,"{'01/12/2025': {'connections': 94, 'uniq_ips': 1}}",CVE-2021-35464,12209,2025-12-01 12:57:36.255758
Ignite Realtime,Openfire,True,True,93,1.0,33,30,22,"{'02/12/2025': {'connections': 93, 'uniq_ips': 1}}",CVE-2019-18393,3258,2025-12-02 12:58:40.119472
SpectoLabs,HoverFly,True,True,93,1.0,93,83,83,"{'30/11/2025': {'connections': 93, 'uniq_ips': 1}}",CVE-2025-54123,747,2025-11-30 12:50:46.605119
Canvas,Canvas LMS,True,True,93,1.0,93,38,26,"{'01/12/2025': {'connections': 93, 'uniq_ips': 1}}",CVE-2020-5775,10187,2025-12-01 12:57:36.270316
Apache,OFBiz,True,True,91,28.0,15,169,190,"{'05/12/2025': {'connections': 91, 'uniq_ips': 28}}",CVE-2021-26295,85438,2025-12-05 12:56:12.895365
Citrix,Citrix ADC and Citrix Gateway,True,True,90,11.0,235,498,186,"{'05/12/2025': {'connections': 90, 'uniq_ips': 11}}",CVE-2023-4966,349092,2025-12-05 12:56:12.916821
BigAnt Software,BigAnt Server,True,True,88,1.0,45,20,17,"{'01/12/2025': {'connections': 88, 'uniq_ips': 1}}",CVE-2022-23347,5412,2025-12-01 12:57:36.248219
CuppaCMS,CuppaCMS,True,True,85,3.0,56,41,33,"{'28/11/2025': {'connections': 85, 'uniq_ips': 3}}",CVE-2022-25486,9911,2025-11-28 12:54:30.387260
Sitecore,"Sitecore Experience Manager (XM), Experience Platform (XP), Experience Commerce (XC)",True,True,84,1.0,55,42,42,"{'22/11/2025': {'connections': 84, 'uniq_ips': 1}}",CVE-2025-34509,165,2025-11-22 12:47:24.354724
Ruijie Networks,Ruijie RG-UAC Application Management Gateway,True,True,83,2.0,72,48,48,"{'05/12/2025': {'connections': 83, 'uniq_ips': 2}}",CVE-2023-7304,854,2025-12-05 12:56:12.916399
CuppaCMS,CuppaCMS,True,True,83,3.0,55,41,35,"{'28/11/2025': {'connections': 83, 'uniq_ips': 3}}",CVE-2022-25485,9983,2025-11-28 12:54:30.364598
Progress,MOVEit Transfer,True,True,83,1.0,83,83,83,"{'24/10/2025': {'connections': 83, 'uniq_ips': 1}}",CVE-2024-5806,1012,2025-10-24 12:54:46.674460
Cisco,"Cisco RV340, RV340W, RV345, and RV345P Dual WAN Gigabit VPN Routers",True,True,81,2.0,32,33,26,"{'29/11/2025': {'connections': 81, 'uniq_ips': 2}}",CVE-2023-20073,17722,2025-11-29 12:51:05.975549
D-Link,D-Link DIR-816/DIR-816A2,True,True,81,1.0,81,81,81,"{'10/10/2024': {'connections': 81, 'uniq_ips': 1}}",CVE-2021-39509,81,2024-10-10 12:43:46.553857
Cisco,Cisco RV320/RV325,True,True,77,45.0,51,70,85,"{'04/12/2025': {'connections': 77, 'uniq_ips': 45}}",CVE-2019-1653,24781,2025-12-04 12:59:17.573895
Artica,Pandora FMS,True,True,76,1.0,39,23,17,"{'04/12/2025': {'connections': 76, 'uniq_ips': 1}}",CVE-2018-11222,5414,2025-12-04 12:59:17.453596
Belkin,Wemo,True,True,73,63.0,520,570,547,"{'05/12/2025': {'connections': 73, 'uniq_ips': 63}}",CVE-2019-12780,310772,2025-12-05 12:56:12.940413
Securden,Securden Unified PAM,True,True,73,2.0,140,107,107,{},CVE-2025-53118,1173,2025-11-23 12:47:09.116573
IBM,Aspera Faspex,True,True,72,2.0,26,73,37,"{'29/11/2025': {'connections': 72, 'uniq_ips': 2}}",CVE-2022-47986,12953,2025-11-29 12:51:06.054643
CONTEC,SolarView Compact ver.6.00,True,True,69,3.0,57,75,42,"{'28/11/2025': {'connections': 69, 'uniq_ips': 3}}",CVE-2022-29303,15519,2025-11-28 12:54:30.303883
Wordpress,Wordpress Elfinder plugin,True,True,67,3.0,65,54,37,"{'28/11/2025': {'connections': 67, 'uniq_ips': 3}}",CVE-2020-35235,12824,2025-11-28 12:54:30.370725
Citrix,Citrix NetScaler,True,True,67,7.0,22,340,502,"{'05/12/2025': {'connections': 67, 'uniq_ips': 7}}",CVE-2025-5777,132238,2025-12-05 12:56:12.958113
Fortinet,FortiOS,True,True,63,18.0,3061,4734,4276,"{'05/12/2025': {'connections': 63, 'uniq_ips': 18}}",CVE-2018-13379,2090025,2025-12-05 12:56:12.841724
Apache,APISIX,True,True,62,2.0,54,158,86,"{'28/11/2025': {'connections': 62, 'uniq_ips': 2}}",CVE-2022-24112,20815,2025-11-28 12:54:30.416130
Spring,Spring Cloud Gateway,True,True,59,1.0,411,248,70,"{'05/12/2025': {'connections': 59, 'uniq_ips': 1}}",CVE-2022-22947,11612,2025-12-05 12:56:12.881449
Byzoro,Byzoro Smart S85F Management Platform,True,True,56,1.0,56,56,56,{},CVE-2023-5683,56,2025-07-23 02:21:28.153396
Tongda,Tongda OA,True,True,55,1.0,55,55,55,{},CVE-2023-5285,55,2025-07-23 02:21:28.089562
Roxy-WI,Roxy-WI,True,True,55,2.0,59,78,45,"{'28/11/2025': {'connections': 55, 'uniq_ips': 2}}",CVE-2022-31126,15217,2025-11-28 12:54:30.377634
PrestaShop,Posthemes - Static Footer module for PrestaShop,True,True,55,1.0,55,55,55,{},CVE-2023-30194,55,2025-07-23 02:21:28.198357
Mida Solutions,Mida eFramework,True,True,54,1.0,28,53,28,"{'01/12/2025': {'connections': 54, 'uniq_ips': 1}}",CVE-2020-15920,6854,2025-12-01 12:57:36.309205
TRENDnet,TRENDnet TEW-652BRP,True,True,51,1.0,51,51,51,"{'13/10/2024': {'connections': 51, 'uniq_ips': 1}}",CVE-2023-0611,51,2024-10-13 12:40:14.968297
ipTIME,ipTIME A2004,True,True,50,1.0,33,23,21,"{'22/11/2025': {'connections': 50, 'uniq_ips': 1}}",CVE-2024-54764,510,2025-11-22 12:47:24.424007
Synacor,Zimbra Collaboration Suite,True,True,48,3.0,92,227,708,"{'30/11/2025': {'connections': 48, 'uniq_ips': 3}}",CVE-2019-9670,418373,2025-11-30 12:50:46.560611
Wordpress,Wordpress WooCommerce Ultimate Gift Card plugin,True,True,46,1.0,14,27,27,"{'02/12/2025': {'connections': 46, 'uniq_ips': 1}}",CVE-2024-8425,241,2025-12-02 12:58:40.146817
FlowiseAI,Flowise,True,True,46,1.0,16,53,24,"{'02/12/2025': {'connections': 46, 'uniq_ips': 1}}",CVE-2025-26319,1950,2025-12-02 12:58:40.233028
ASUS,ASUSWRT,True,True,44,1.0,44,44,44,"{'16/05/2025': {'connections': 44, 'uniq_ips': 1}}",CVE-2018-20334,95,2025-05-16 12:51:53.679090
Terramaster,TOS,True,True,43,1.0,43,43,43,{},CVE-2018-13350,43,2025-07-23 02:21:28.216865
Wifi-soft,Wifi-soft Unibox,True,True,41,1.0,41,41,41,{},CVE-2019-3495,41,2025-07-23 02:21:28.254409
Cisco,Cisco RV320/RV325,True,True,41,1.0,41,41,41,"{'13/10/2024': {'connections': 41, 'uniq_ips': 1}}",CVE-2019-1652,41,2024-10-13 12:40:14.946179
Draytek,"Draytek Vigor3900, Vigor2960, Vigor300B",True,True,41,1.0,41,41,41,"{'13/10/2024': {'connections': 41, 'uniq_ips': 1}}",CVE-2020-10826,41,2024-10-13 12:40:14.988179
Shenzhen Sixun Software,Sixun Shanghui 7 Group Business Management System 7,True,True,40,1.0,40,40,40,{},CVE-2025-4281,40,2025-07-23 02:21:28.193212
Totolink,Totolink N600R,True,True,40,1.0,40,40,40,{},CVE-2022-28908,40,2025-07-23 02:21:28.105047
Totolink,Totolink A810R,True,True,38,1.0,38,38,38,{},CVE-2025-28137,38,2025-07-23 02:21:28.133222
Atlassian,Confluence,True,True,37,13.0,71,226,216,"{'04/12/2025': {'connections': 37, 'uniq_ips': 13}}",CVE-2023-22527,322359,2025-12-04 12:59:17.476594
Keysight Technologies,Sensor Management Server,True,True,37,1.0,16,17,13,"{'30/11/2025': {'connections': 37, 'uniq_ips': 1}}",CVE-2022-38130,752,2025-11-30 12:50:46.548358
kw199711,smanga,True,True,36,1.0,36,36,36,{},CVE-2024-34193,36,2025-07-23 02:21:28.158616
Cisco,Cisco ASA and Cisco Firepower Threat Defense,True,True,35,1.0,28,15,12,"{'22/11/2025': {'connections': 35, 'uniq_ips': 1}}",CVE-2025-20362,139,2025-11-22 12:47:24.315186
WSO2,WSO2 multiple products,True,True,35,3.0,53,94,54,"{'28/11/2025': {'connections': 35, 'uniq_ips': 3}}",CVE-2022-29464,17827,2025-11-28 12:54:30.293031
QNAP,QNAP NAS devices running Photo Station,True,True,35,6.0,23,210,235,"{'04/12/2025': {'connections': 35, 'uniq_ips': 6}}",CVE-2019-7192,160158,2025-12-04 12:59:17.480145
Jenkins,Jenkins,True,True,32,1.0,28,17,17,{},CVE-2025-59474,149,2025-11-23 12:47:09.215249
Oracle,Oracle Weblogic Server,True,True,31,4.0,13,158,113,"{'05/12/2025': {'connections': 31, 'uniq_ips': 4}}",CVE-2019-2725,132046,2025-12-05 12:56:12.842417
The Digital Craft,AtomCMS,True,True,29,2.0,24,86,94,"{'29/11/2025': {'connections': 29, 'uniq_ips': 2}}",CVE-2022-25487,18941,2025-11-29 12:51:06.107774
Barco/AWIND,Barco/AWIND OEM,True,True,28,3.0,20,74,55,"{'30/11/2025': {'connections': 28, 'uniq_ips': 3}}",CVE-2019-3929,33573,2025-11-30 12:50:46.635442
RAISECOM,"RAISECOM MSG1200, MSG2100E, MSG2200 and MSG2300",True,True,28,1.0,28,38,24,"{'30/11/2025': {'connections': 28, 'uniq_ips': 1}}",CVE-2024-7120,13363,2025-11-30 12:50:46.470162
Boa,Boa,True,True,27,1.0,16,18,18,"{'04/12/2025': {'connections': 27, 'uniq_ips': 1}}",CVE-2017-9833,5040,2025-12-04 12:59:17.482622
Rocket.Chat,Rocket.Chat,True,True,27,3.0,6,58,45,"{'04/12/2025': {'connections': 27, 'uniq_ips': 3}}",CVE-2021-22911,27439,2025-12-04 12:59:17.608633
Daylight Studio,FUEL CMS,True,True,27,3.0,6,65,52,"{'04/12/2025': {'connections': 27, 'uniq_ips': 3}}",CVE-2018-16763,39424,2025-12-04 12:59:17.464601
Apache,ColdFusion,True,True,26,3.0,6,85,60,"{'04/12/2025': {'connections': 26, 'uniq_ips': 3}}",CVE-2018-15961,50847,2025-12-04 12:59:17.520553
Metabase,Metabase,True,True,26,1.0,15,35,25,"{'04/12/2025': {'connections': 26, 'uniq_ips': 1}}",CVE-2021-41277,31021,2025-12-04 12:59:17.594550
VMware,vRealize Operations Manager API,True,True,26,3.0,11,36,39,"{'04/12/2025': {'connections': 26, 'uniq_ips': 3}}",CVE-2021-21975,30727,2025-12-04 12:59:17.596473
YouPHPTube,YouPHPTube Encoder,True,True,26,3.0,12,145,119,"{'04/12/2025': {'connections': 26, 'uniq_ips': 3}}",CVE-2019-5128,79262,2025-12-04 12:59:17.484681
Qianxin,TianQing Management Center,True,True,26,1.0,26,26,9,{},CVE-2024-13984,27,2025-11-25 12:56:15.403264
Wordpress,Wordpress Perfect Survey plugin,True,True,26,3.0,6,52,41,"{'04/12/2025': {'connections': 26, 'uniq_ips': 3}}",CVE-2021-24762,23820,2025-12-04 12:59:17.579991
Barcode,Barcode (GLPI plugin),True,True,26,1.0,16,16,18,"{'04/12/2025': {'connections': 26, 'uniq_ips': 1}}",CVE-2021-43778,5241,2025-12-04 12:59:17.510067
DedeCMS,DedeCMS,True,True,26,1.0,15,8,19,"{'04/12/2025': {'connections': 26, 'uniq_ips': 1}}",CVE-2018-7700,7095,2025-12-04 12:59:17.537399
Intellian,Intellian Aptus Web,True,True,25,3.0,6,58,53,"{'04/12/2025': {'connections': 25, 'uniq_ips': 3}}",CVE-2020-7980,40208,2025-12-04 12:59:17.482844
Emby,Emby Server,True,True,25,1.0,15,41,41,"{'04/12/2025': {'connections': 25, 'uniq_ips': 1}}",CVE-2020-26948,203,2025-12-04 12:59:17.609676
Zoho,"ManageEngine OpManager OpManager Plus, OpManager MSP, Network Configuration Manager, NetFlow Analyzer, Firewall Analyzer, and OpUtils",True,True,25,1.0,14,14,15,"{'04/12/2025': {'connections': 25, 'uniq_ips': 1}}",CVE-2022-36923,813,2025-12-04 12:59:17.642093
OpenDreamBox,Plugin WebAdmin,True,True,25,6.0,10,215,158,"{'05/12/2025': {'connections': 25, 'uniq_ips': 6}}",CVE-2017-14135,303072,2025-12-05 12:56:12.852315
Wordpress,Wordpress FormCraft plugin,True,True,25,1.0,14,14,13,"{'04/12/2025': {'connections': 25, 'uniq_ips': 1}}",CVE-2022-0591,962,2025-12-04 12:59:17.595171
Franklin Fueling Systems,Colibri Controller Module,True,True,25,1.0,15,21,20,"{'04/12/2025': {'connections': 25, 'uniq_ips': 1}}",CVE-2021-46417,5293,2025-12-04 12:59:17.444507
Atlassian,Confluence,True,True,25,3.0,5,101,121,"{'04/12/2025': {'connections': 25, 'uniq_ips': 3}}",CVE-2022-26138,60070,2025-12-04 12:59:17.603257
rConfig,rConfig,True,True,25,1.0,15,18,20,"{'04/12/2025': {'connections': 25, 'uniq_ips': 1}}",CVE-2020-10548,5856,2025-12-04 12:59:17.615012
Penta Security,WAPPLES,True,True,25,3.0,6,55,48,"{'04/12/2025': {'connections': 25, 'uniq_ips': 3}}",CVE-2022-35413,18946,2025-12-04 12:59:17.617124
TBK,DVR4104/DVR4216 and multiple re-branded versions,True,True,25,1.0,6,8,15,"{'04/12/2025': {'connections': 25, 'uniq_ips': 1}}",CVE-2018-9995,91533,2025-12-04 12:59:17.586669
Four-Faith,Four-Faith F3x36,True,True,24,2.0,24,24,363,"{'30/11/2025': {'connections': 24, 'uniq_ips': 2}}",CVE-2024-9644,10129,2025-11-30 12:50:46.573027
ttimot24,HorizontCMS,True,True,24,1.0,24,24,24,"{'14/07/2025': {'connections': 24, 'uniq_ips': 1}}",CVE-2020-27387,24,2025-07-14 12:56:16.340971
GLPI,GLPI,True,True,24,1.0,14,20,19,"{'04/12/2025': {'connections': 24, 'uniq_ips': 1}}",CVE-2021-39211,6523,2025-12-04 12:59:17.638939
Telesquare,Telesquare SDT-CW3B1,True,True,24,1.0,8,193,104,"{'04/12/2025': {'connections': 24, 'uniq_ips': 1}}",CVE-2021-46422,41640,2025-12-04 12:59:17.471452
Hitachi Ventara,Pentaho Business Analytics,True,True,24,1.0,41,25,23,"{'04/12/2025': {'connections': 24, 'uniq_ips': 1}}",CVE-2021-31602,11895,2025-12-04 12:59:17.615937
NETGEAR,NETGEAR (multiple routers),True,True,24,1.0,14,23,28,"{'04/12/2025': {'connections': 24, 'uniq_ips': 1}}",CVE-2017-5521,2916,2025-12-04 12:59:17.550379
Wordpress,Wordpress Welcart eCommerce plugin,True,True,24,1.0,10,12,17,"{'04/12/2025': {'connections': 24, 'uniq_ips': 1}}",CVE-2022-41840,4483,2025-12-04 12:59:17.636585
TerraMaster,TOS,True,True,24,3.0,9,78,76,"{'04/12/2025': {'connections': 24, 'uniq_ips': 3}}",CVE-2020-15568,58287,2025-12-04 12:59:17.603884
WAVLINK,WAVLINK WN579X3,True,True,23,1.0,14,16,17,"{'04/12/2025': {'connections': 23, 'uniq_ips': 1}}",CVE-2022-31847,11649,2025-12-04 12:59:17.629791
D-Link,D-Link DIR-825 G1,True,True,23,1.0,13,9,13,"{'04/12/2025': {'connections': 23, 'uniq_ips': 1}}",CVE-2021-46442,801,2025-12-04 12:59:17.474478
C-DATA,C-DATA Web Management System,True,True,23,1.0,12,12,15,"{'04/12/2025': {'connections': 23, 'uniq_ips': 1}}",CVE-2022-4257,1570,2025-12-04 12:59:17.543373
Node-RED,Node-RED-Dashboard,True,True,23,1.0,14,15,22,"{'04/12/2025': {'connections': 23, 'uniq_ips': 1}}",CVE-2021-3223,11992,2025-12-04 12:59:17.504922
Sonatype,Nexus Repository Manager,True,True,23,1.0,13,9,15,"{'04/12/2025': {'connections': 23, 'uniq_ips': 1}}",CVE-2020-10199,2431,2025-12-04 12:59:17.591836
Changsha SPON Communication Technology,SPON IP Network Broadcast System,True,True,23,1.0,9,7,5,"{'04/12/2025': {'connections': 23, 'uniq_ips': 1}}",CVE-2024-13982,37,2025-12-04 12:59:17.599816
SearchBlox,SearchBlox,True,True,23,1.0,15,19,19,"{'04/12/2025': {'connections': 23, 'uniq_ips': 1}}",CVE-2020-35580,5066,2025-12-04 12:59:17.607154
Oracle,GlassFish,True,True,22,1.0,12,11,18,"{'04/12/2025': {'connections': 22, 'uniq_ips': 1}}",CVE-2017-1000028,2160,2025-12-04 12:59:17.635141
SolarWinds,SolarWinds Orion,True,True,22,1.0,13,56,33,"{'04/12/2025': {'connections': 22, 'uniq_ips': 1}}",CVE-2020-10148,15280,2025-12-04 12:59:17.532960
Landray,Landray EKP,True,True,22,2.0,7,25,14,"{'20/11/2025': {'connections': 22, 'uniq_ips': 2}}",CVE-2024-11238,752,2025-11-20 12:54:11.807180
Guangzhou,Guangzhou 1GE ONU (GPON),True,True,22,1.0,39,45,47,"{'05/12/2025': {'connections': 22, 'uniq_ips': 1}}",CVE-2020-8958,1527,2025-12-05 12:56:12.957499
Zoho,ManageEngine OpManager,True,True,22,1.0,12,12,13,"{'04/12/2025': {'connections': 22, 'uniq_ips': 1}}",CVE-2018-17283,772,2025-12-04 12:59:17.548646
Kyocera,Kyocera Printer d-COPIA253MF plus,True,True,22,1.0,13,20,19,"{'04/12/2025': {'connections': 22, 'uniq_ips': 1}}",CVE-2020-23575,5761,2025-12-04 12:59:17.500728
Sonatype,Nexus Repository Manager,True,True,19,2.0,33,85,65,"{'02/12/2025': {'connections': 19, 'uniq_ips': 2}}",CVE-2019-7238,40782,2025-12-02 12:58:40.229940
Sonlogger,Sonlogger,True,True,17,3.0,4,110,72,"{'05/12/2025': {'connections': 17, 'uniq_ips': 3}}",CVE-2021-27964,29588,2025-12-05 12:56:12.792731
Apache,Struts,True,True,17,2.0,45,43,23,"{'01/12/2025': {'connections': 17, 'uniq_ips': 2}}",CVE-2017-5638,12017,2025-12-01 12:57:36.309617
Juniper,Junos OS (J-Web),True,True,16,4.0,19,3749,2813,"{'05/12/2025': {'connections': 16, 'uniq_ips': 4}}",CVE-2023-36845,13219,2025-12-05 12:56:12.921322
Wordpress,Wordpress Update Backup Restore & Monitoring plugin,True,True,15,5.0,15,15,15,"{'18/03/2025': {'connections': 15, 'uniq_ips': 5}}",CVE-2024-12209,15,2025-03-18 12:49:07.855121
pfSense,pfSense pfBlockerNG,True,True,14,3.0,11,9,9,"{'05/12/2025': {'connections': 14, 'uniq_ips': 3}}",CVE-2022-31814,63,2025-12-05 12:56:12.827273
Wordpress,Wordpress Visualizer plugin (by Themeisle),True,True,13,2.0,13,13,13,"{'26/10/2025': {'connections': 13, 'uniq_ips': 2}}",CVE-2019-16932,71,2025-10-26 12:48:32.001159
Tenda,Tenda G1 and G3,True,True,13,1.0,13,13,13,"{'09/06/2025': {'connections': 13, 'uniq_ips': 1}}",CVE-2021-27692,13,2025-06-09 12:53:37.709067
Fortinet,FortiWLM,True,True,13,1.0,7,305,119,"{'05/12/2025': {'connections': 13, 'uniq_ips': 1}}",CVE-2023-34993,27095,2025-12-05 12:56:12.851200
Embedthis,GoAhead,True,True,12,1.0,12,12,12,"{'13/03/2025': {'connections': 12, 'uniq_ips': 1}}",CVE-2017-17562,12,2025-03-13 12:48:14.311821
Oracle,Oracle E-Business Suite (Oracle Concurrent Processing),True,True,12,2.0,7,297,227,"{'01/12/2025': {'connections': 12, 'uniq_ips': 2}}",CVE-2025-61882,10879,2025-12-01 12:57:36.160347
LG,SuperSign CMS,True,True,12,4.0,3,203,162,"{'05/12/2025': {'connections': 12, 'uniq_ips': 4}}",CVE-2018-17173,5539,2025-12-05 12:56:12.943041
vBulletin,vBulletin,True,True,12,3.0,4,434,541,"{'05/12/2025': {'connections': 12, 'uniq_ips': 3}}",CVE-2020-17496,130603,2025-12-05 12:56:12.829262
Fortinet,Fortinet FortiWeb,True,True,12,1.0,12,65,66,"{'05/12/2025': {'connections': 12, 'uniq_ips': 1}}",CVE-2025-25257,7131,2025-12-05 12:56:12.881188
ASUSTOR,ASUSTOR ADM,True,True,12,4.0,3,3,3,"{'05/12/2025': {'connections': 12, 'uniq_ips': 4}}",CVE-2018-11511,16,2025-12-05 12:56:12.775279
D-Link,DIR-868L/DIR-817LW,True,True,12,4.0,8,69,62,"{'05/12/2025': {'connections': 12, 'uniq_ips': 4}}",CVE-2019-17506,44833,2025-12-05 12:56:12.842635
Dell,Dell EMC Avamar Server and Dell EMC Integrated Data Protection Appliance,True,True,12,4.0,3,560,661,"{'05/12/2025': {'connections': 12, 'uniq_ips': 4}}",CVE-2018-1217,66332,2025-12-05 12:56:12.934843
Zoho,ManageEngine Desktop Central (now Engine Central),True,True,12,3.0,12,61,49,"{'30/11/2025': {'connections': 12, 'uniq_ips': 3}, '01/12/2025': {'connections': 12, 'uniq_ips': 3}}",CVE-2020-10189,32314,2025-11-30 12:50:46.662669
Jolokia,Jolokia,True,True,12,4.0,7,35,43,"{'05/12/2025': {'connections': 12, 'uniq_ips': 4}}",CVE-2018-1000130,35606,2025-12-05 12:56:12.954231
D-Link,D-Link DIR-610,True,True,11,1.0,6,3,11,"{'24/11/2025': {'connections': 11, 'uniq_ips': 1}}",CVE-2020-9377,2549,2025-11-24 12:57:02.359776
Fortinet,FortiWeb,True,True,11,1.0,11,13,23,"{'05/12/2025': {'connections': 11, 'uniq_ips': 1}}",CVE-2021-22122,8935,2025-12-05 12:56:12.795862
Teltonika,Teltonika RUT9XX series,True,True,11,1.0,27,85,89,"{'15/11/2025': {'connections': 11, 'uniq_ips': 1}}",CVE-2018-17532,16678,2025-11-15 12:48:49.028653
SolarWinds,SolarWinds Security Event Manager,True,True,10,2.0,47,42,31,"{'30/11/2025': {'connections': 10, 'uniq_ips': 2}}",CVE-2024-0692,1366,2025-11-30 12:50:46.597631
Apache,OFBiz,True,True,10,4.0,7,27,40,"{'05/12/2025': {'connections': 10, 'uniq_ips': 4}}",CVE-2011-3600,36804,2025-12-05 12:56:12.870935
ownCloud,ownCloud,True,True,10,5.0,5,18,21,"{'29/11/2025': {'connections': 10, 'uniq_ips': 5}}",CVE-2023-49103,194795,2025-11-29 12:51:06.116407
SolarWinds,SolarWinds Serv-U,True,True,10,10.0,13,184,82,"{'04/12/2025': {'connections': 10, 'uniq_ips': 10}}",CVE-2024-28995,251895,2025-12-04 12:59:17.470846
Palo Alto Networks,PAN-OS,True,True,9,9.0,332,819,828,"{'05/12/2025': {'connections': 9, 'uniq_ips': 9}}",CVE-2025-0108,200360,2025-12-05 12:56:12.943544
Fortinet,FortiOS and FortiProxy,True,True,9,1.0,8,8,8,"{'12/10/2025': {'connections': 9, 'uniq_ips': 1}}",CVE-2024-21762,186,2025-10-12 12:45:43.398226
MobileIron,MobileIron Mobile Device Management (MDM),True,True,8,3.0,3,373,503,"{'05/12/2025': {'connections': 8, 'uniq_ips': 3}}",CVE-2020-15505,98744,2025-12-05 12:56:12.833338
FiberHome,FiberHome ONU GPON AN550,True,True,8,1.0,8,8,8,"{'21/12/2024': {'connections': 8, 'uniq_ips': 1}}",CVE-2021-42912,8,2024-12-21 12:39:56.527574
Tenda,Tenda AC7/AC9/AC10,True,True,8,1.0,6,4,3,"{'05/12/2025': {'connections': 8, 'uniq_ips': 1}}",CVE-2018-14558,2764,2025-12-05 12:56:12.973826
HooToo,HooToo TripMate Titan HT-TM05 and HT-05 routers,True,True,8,1.0,8,8,8,"{'05/08/2024': {'connections': 8, 'uniq_ips': 1}, '06/08/2024': {'connections': 8, 'uniq_ips': 1}}",CVE-2018-20841,8,2024-08-06 06:01:20.183289
Microsoft,.NET Framework,True,True,8,6.0,10,28,24,"{'04/12/2025': {'connections': 8, 'uniq_ips': 6}}",CVE-2024-29059,8265,2025-12-04 12:59:17.588778
PHP Foundation,PHP (PHP-CGI),True,True,8,2.0,19,35,30,"{'05/12/2025': {'connections': 8, 'uniq_ips': 2}}",CVE-2024-4577,242936,2025-12-05 12:56:12.806821
Wordpress,Wordpress Secure Copy Content Protection and Content Locking plugin,True,True,8,3.0,5,165,200,"{'05/12/2025': {'connections': 8, 'uniq_ips': 3}}",CVE-2021-24931,82736,2025-12-05 12:56:12.947879
Paessler,PRTG Network Monitor,True,True,7,3.0,3,3,3,"{'05/12/2025': {'connections': 7, 'uniq_ips': 3}}",CVE-2018-19410,11,2025-12-05 12:56:12.919622
Spring,Spring Framework,True,True,7,4.0,25,83,101,"{'29/11/2025': {'connections': 7, 'uniq_ips': 4}}",CVE-2022-22965,41124,2025-11-29 12:51:06.025098
D-Link,D-Link DIR-600M,True,True,7,3.0,7,72,55,"{'05/12/2025': {'connections': 7, 'uniq_ips': 3}}",CVE-2019-13101,3339,2025-12-05 12:56:12.886463
Totolink,Totolink Realtek SDK based routers,True,True,7,3.0,4,8,18,"{'05/12/2025': {'connections': 7, 'uniq_ips': 3}}",CVE-2019-19825,21009,2025-12-05 12:56:12.924260
Ruijie Networks,Ruijie RG-EW Series Routers,True,True,7,1.0,7,4,4,"{'11/11/2025': {'connections': 7, 'uniq_ips': 1}}",CVE-2021-43163,1092,2025-11-11 12:54:39.692450
Citrix,Citrix SD-WAN and NetScaler SD-WAN,True,True,7,3.0,3,46,42,"{'05/12/2025': {'connections': 7, 'uniq_ips': 3}}",CVE-2019-12989,1211,2025-12-05 12:56:12.777517
D-Link,D-Link multiple routers,True,True,7,3.0,3,401,528,"{'05/12/2025': {'connections': 7, 'uniq_ips': 3}}",CVE-2018-6530,78517,2025-12-05 12:56:12.879879
Letta,Letta,True,True,6,1.0,6,4,4,"{'04/11/2025': {'connections': 6, 'uniq_ips': 1}}",CVE-2025-51482,8,2025-11-04 12:57:47.235021
D-Link,D-Link DSL-2888A,True,True,6,3.0,2,32,54,"{'05/12/2025': {'connections': 6, 'uniq_ips': 3}}",CVE-2020-24581,48343,2025-12-05 12:56:12.795433
D-Link,DNS-320,True,True,5,3.0,2,404,540,"{'05/12/2025': {'connections': 5, 'uniq_ips': 3}}",CVE-2020-25506,100290,2025-12-05 12:56:12.969555
Citrix,Citrix ADC and Citrix Gateway,True,True,5,1.0,5,5,8,"{'12/11/2025': {'connections': 5, 'uniq_ips': 1}}",CVE-2023-3519,302,2025-11-12 12:56:37.501893
Apache,libapache-mod-jk,True,True,5,1.0,10,225,233,"{'05/12/2025': {'connections': 5, 'uniq_ips': 1}}",CVE-2018-11759,47511,2025-12-05 12:56:12.772687
GeoServer,GeoServer,True,True,5,1.0,30,60,78,"{'01/12/2025': {'connections': 5, 'uniq_ips': 1}}",CVE-2021-40822,18333,2025-12-01 12:57:36.323376
"Open Source Matters, Inc/Joomla community",Joomla,True,True,5,5.0,5,28,42,"{'04/12/2025': {'connections': 5, 'uniq_ips': 5}}",CVE-2023-23752,140571,2025-12-04 12:59:17.610960
Endress+Hauser,WirelessHART Fieldgate SWG70,True,True,5,1.0,3,66,46,"{'05/12/2025': {'connections': 5, 'uniq_ips': 1}}",CVE-2018-16059,26638,2025-12-05 12:56:12.864187
Ivanti,"Endpoint Manager Mobile (EPMM), formerly MobileIron Core",True,True,4,4.0,186,89,78,"{'05/12/2025': {'connections': 4, 'uniq_ips': 4}}",CVE-2023-35082,122251,2025-12-05 12:56:12.780692
Wordpress,Wordpress Backup Migration plugin,True,True,4,1.0,4,4,22,"{'04/12/2025': {'connections': 4, 'uniq_ips': 1}}",CVE-2023-6553,167,2025-12-04 12:59:17.482398
ConnectWise,ScreenConnect,True,True,4,2.0,122,148,215,"{'05/12/2025': {'connections': 4, 'uniq_ips': 2}}",CVE-2024-1709,119143,2025-12-05 12:56:12.940188
Ignite Realtime,Openfire,True,True,4,2.0,10,17,27,"{'05/12/2025': {'connections': 4, 'uniq_ips': 2}}",CVE-2019-18394,8621,2025-12-05 12:56:12.774302
Telerik,Telerik,True,True,4,2.0,3,15,25,"{'30/11/2025': {'connections': 4, 'uniq_ips': 2}}",CVE-2019-18935,16978,2025-11-30 12:50:46.587416
RedHat,JBoss,True,True,4,1.0,4,3,2,"{'27/11/2025': {'connections': 4, 'uniq_ips': 1}}",CVE-2017-12149,27,2025-11-27 12:56:01.600053
Laravel,Ignition,True,True,4,3.0,17,215,193,"{'05/12/2025': {'connections': 4, 'uniq_ips': 3}}",CVE-2021-3129,217543,2025-12-05 12:56:12.859169
QNAP,QNAP QTS,True,True,3,3.0,3,2,7,"{'27/11/2025': {'connections': 3, 'uniq_ips': 2}, '28/11/2025': {'connections': 3, 'uniq_ips': 2}}",CVE-2020-2507,1823,2025-11-25 12:56:15.397089
Ivanti,"Endpoint Manager Mobile (EPMM), formerly MobileIron Core",True,True,3,3.0,877,2071,791,"{'05/12/2025': {'connections': 3, 'uniq_ips': 3}}",CVE-2023-35078,407227,2025-12-05 12:56:12.969370
Wordpress,Wordpress LearnPress plugin,True,True,3,1.0,3,3,3,"{'09/11/2025': {'connections': 3, 'uniq_ips': 1}, '17/11/2025': {'connections': 3, 'uniq_ips': 1}}",CVE-2023-6634,7779,2025-11-09 12:48:24.429293
NETGEAR,RAX43,True,True,3,2.0,2,37,89,"{'30/11/2025': {'connections': 3, 'uniq_ips': 2}}",CVE-2021-20166,31769,2025-11-30 12:50:46.567711
Zivif,Zivif PR115-204-P-RS,True,True,3,1.0,4,5,8,"{'23/10/2025': {'connections': 3, 'uniq_ips': 1}}",CVE-2017-17106,21,2025-10-23 12:57:18.497210
WAVLINK,WAVLINK WN575A4 and WN579X3,True,True,3,2.0,2,69,53,"{'30/11/2025': {'connections': 3, 'uniq_ips': 2}}",CVE-2020-13117,32208,2025-11-30 12:50:46.471460
F5,BIG-IP,True,True,3,1.0,3,14,12,"{'28/11/2025': {'connections': 3, 'uniq_ips': 1}}",CVE-2016-5700,613,2025-11-28 12:54:30.400909
Draytek,"Vigor3900, Vigor2960, Vigor300B",True,True,3,2.0,3,65,334,"{'30/11/2025': {'connections': 3, 'uniq_ips': 2}}",CVE-2020-15415,24330,2025-11-30 12:50:46.562817
JEECG,jeecg-boot,True,True,3,2.0,29,51,30,"{'27/11/2025': {'connections': 3, 'uniq_ips': 2}}",CVE-2023-34659,10271,2025-11-27 12:56:01.508713
Zoho,ManageEngine ADSelfService Plus,True,True,3,3.0,7,155,132,"{'05/12/2025': {'connections': 3, 'uniq_ips': 3}}",CVE-2021-40539,75695,2025-12-05 12:56:12.840967
F5,F5 Big-IP,True,True,3,3.0,9,400,425,"{'05/12/2025': {'connections': 3, 'uniq_ips': 3}}",CVE-2020-5902,283973,2025-12-05 12:56:12.886239
Citrix,Citrix SD-WAN and NetScaler SD-WAN,True,True,3,2.0,18,93,66,"{'30/11/2025': {'connections': 3, 'uniq_ips': 2}}",CVE-2019-12990,75286,2025-11-30 12:50:46.545741
Pulse Secure,Pulse Secure VPN,True,True,3,1.0,286,546,392,"{'05/12/2025': {'connections': 3, 'uniq_ips': 1}}",CVE-2019-11510,255667,2025-12-05 12:56:12.846653
Apache,Flink,True,True,3,2.0,4,52,58,"{'30/11/2025': {'connections': 3, 'uniq_ips': 2}}",CVE-2020-17519,54927,2025-11-30 12:50:46.652386
Six Apart (Movable Type),Movable Type,True,True,3,2.0,2,75,98,"{'30/11/2025': {'connections': 3, 'uniq_ips': 2}}",CVE-2021-20837,36091,2025-11-30 12:50:46.455446
Wordpress,Wordpress Bestbooks plugin,True,True,3,2.0,2,50,41,"{'30/11/2025': {'connections': 3, 'uniq_ips': 2}}",CVE-2022-0827,13217,2025-11-30 12:50:46.492581
mongo-express,mongo-express,True,True,3,2.0,79,135,65,"{'30/11/2025': {'connections': 3, 'uniq_ips': 2}}",CVE-2019-10758,33871,2025-11-30 12:50:46.482231
Wordpress,Wordpress Product Table for WooCommerce (wooproducttable) plugin,True,True,3,2.0,19,56,41,"{'30/11/2025': {'connections': 3, 'uniq_ips': 2}}",CVE-2022-1020,11605,2025-11-30 12:50:46.660783
MinIO,MinIO,True,True,3,3.0,2,28,31,"{'05/12/2025': {'connections': 3, 'uniq_ips': 3}}",CVE-2023-28432,19066,2025-12-05 12:56:12.937678
Apache,Struts,True,True,3,2.0,26,77,63,"{'30/11/2025': {'connections': 3, 'uniq_ips': 2}}",CVE-2017-9805,49694,2025-11-30 12:50:46.590957
Schneider Electric,"EVlink City, Parking and Smart Wallbox",True,True,3,2.0,2,52,40,"{'30/11/2025': {'connections': 3, 'uniq_ips': 2}}",CVE-2021-22707,39917,2025-11-30 12:50:46.451197
D-Link,D-Link DIR-825,True,True,3,1.0,2,2,2,"{'29/09/2025': {'connections': 3, 'uniq_ips': 1}}",CVE-2020-29557,128,2025-09-29 12:54:23.413358
Totolink,Totolink A3700R,True,True,3,3.0,48,70,39,"{'27/11/2025': {'connections': 3, 'uniq_ips': 3}}",CVE-2023-46574,11021,2025-11-27 12:56:01.579253
Apache,Druid,True,True,3,2.0,36,86,117,"{'01/12/2025': {'connections': 3, 'uniq_ips': 2}}",CVE-2021-25646,59948,2025-12-01 12:57:36.250937
Microsoft,SharePoint,True,True,3,3.0,2,59,54,"{'05/12/2025': {'connections': 3, 'uniq_ips': 3}}",CVE-2023-29357,15101,2025-12-05 12:56:12.899705
Wordpress,BuddyPress plugin,True,True,3,3.0,2,49,94,"{'05/12/2025': {'connections': 3, 'uniq_ips': 3}}",CVE-2021-21389,35495,2025-12-05 12:56:12.909153
Wordpress,Wordpress SpeakOut! Email Petitions plugin,True,True,3,2.0,2,50,40,"{'30/11/2025': {'connections': 3, 'uniq_ips': 2}}",CVE-2022-0846,13862,2025-11-30 12:50:46.616069
Buffalo,Buffalo SR-2533DHPL2 and WSR-2533DHP3,True,True,3,2.0,2,39,45,"{'30/11/2025': {'connections': 3, 'uniq_ips': 2}}",CVE-2021-20092,13723,2025-11-30 12:50:46.563690
Apache,CouchDB,True,True,3,2.0,3,61,57,"{'30/11/2025': {'connections': 3, 'uniq_ips': 2}}",CVE-2017-12635,52405,2025-11-30 12:50:46.491524
Palo Alto Networks,PAN-OS,True,True,3,2.0,12,89,63,"{'30/11/2025': {'connections': 3, 'uniq_ips': 2}}",CVE-2017-15944,54432,2025-11-30 12:50:46.613440
Wordpress,Wordpress ProfilePress plugin,True,True,3,2.0,2,82,57,"{'30/11/2025': {'connections': 3, 'uniq_ips': 2}}",CVE-2021-34624,17551,2025-11-30 12:50:46.504754
WAVLINK,WAVLINK WL-WN533A8,True,True,3,2.0,137,75,54,"{'27/11/2025': {'connections': 3, 'uniq_ips': 2}}",CVE-2022-48164,6716,2025-11-27 12:56:01.684545
Palo Alto Networks,PAN-OS,True,True,3,3.0,17,320,490,"{'05/12/2025': {'connections': 3, 'uniq_ips': 3}}",CVE-2024-0012,83434,2025-12-05 12:56:12.944914
D-Link,D-Link DAP-1620,True,True,3,2.0,2,30,30,"{'30/11/2025': {'connections': 3, 'uniq_ips': 2}}",CVE-2021-46381,10474,2025-11-30 12:50:46.639408
Citrix,Citrix SD-WAN and NetScaler SD-WAN,True,True,3,2.0,2,78,56,"{'30/11/2025': {'connections': 3, 'uniq_ips': 2}}",CVE-2019-12985,68133,2025-11-30 12:50:46.543195
Wordpress,WordPress Fusion Builder plugin,True,True,3,2.0,2,56,42,"{'30/11/2025': {'connections': 3, 'uniq_ips': 2}}",CVE-2022-1386,13398,2025-11-30 12:50:46.464837
Nagios,Nagios XI,True,True,3,2.0,2,47,44,"{'30/11/2025': {'connections': 3, 'uniq_ips': 2}}",CVE-2018-10737,35963,2025-11-30 12:50:46.561502
Geoserver,Geoserver (JAI-EXT),True,True,3,3.0,82,816,882,"{'05/12/2025': {'connections': 3, 'uniq_ips': 3}}",CVE-2022-24816,204306,2025-12-05 12:56:12.898588
Next.js,Next.js,True,True,3,1.0,3,2,2,"{'15/10/2025': {'connections': 3, 'uniq_ips': 1}}",CVE-2025-29927,50,2025-10-15 12:54:42.452692
Oracle,Oracle Weblogic Server,True,True,3,2.0,18,96,68,"{'30/11/2025': {'connections': 3, 'uniq_ips': 2}}",CVE-2018-2894,56623,2025-11-30 12:50:46.472507
Cisco,Cisco ASA and Cisco Firepower Threat Defense,True,True,3,2.0,8,409,516,"{'05/12/2025': {'connections': 3, 'uniq_ips': 2}}",CVE-2020-3452,79465,2025-12-05 12:56:12.845069
Seagate,BlackArmor NAS,True,True,3,2.0,3,231,411,"{'30/11/2025': {'connections': 3, 'uniq_ips': 2}}",CVE-2014-3206,329547,2025-11-30 12:50:46.645570
LG,NAS N1A1,True,True,3,2.0,2,87,61,"{'30/11/2025': {'connections': 3, 'uniq_ips': 2}}",CVE-2018-14839,50461,2025-11-30 12:50:46.466579
Comodo,Comodo UTM Firewall,True,True,3,2.0,17,78,58,"{'30/11/2025': {'connections': 3, 'uniq_ips': 2}}",CVE-2018-17431,35319,2025-11-30 12:50:46.618750
Wordpress,Wordpress Nirweb support plugin,True,True,3,2.0,2,52,40,"{'30/11/2025': {'connections': 3, 'uniq_ips': 2}}",CVE-2022-0781,13888,2025-11-30 12:50:46.478067
Navidrome,Navidrome,True,True,3,1.0,3,3,4,"{'20/10/2025': {'connections': 3, 'uniq_ips': 1}, '21/10/2025': {'connections': 3, 'uniq_ips': 1}, '22/10/2025': {'connections': 3, 'uniq_ips': 1}}",CVE-2025-27112,105,2025-10-20 12:54:08.029996
Wordpress,Web To Print Shop : uDraw plugin,True,True,3,2.0,3,31,31,"{'30/11/2025': {'connections': 3, 'uniq_ips': 2}}",CVE-2022-0656,10425,2025-11-30 12:50:46.603418
OpenMRS,OpenMRS,True,True,3,2.0,2,74,50,"{'30/11/2025': {'connections': 3, 'uniq_ips': 2}}",CVE-2018-19276,4112,2025-11-30 12:50:46.556743
PuneethReddyHC,PuneethReddyHC,True,True,2,2.0,40,51,36,"{'28/11/2025': {'connections': 2, 'uniq_ips': 2}, '30/11/2025': {'connections': 2, 'uniq_ips': 2}, '01/12/2025': {'connections': 2, 'uniq_ips': 2}, '03/12/2025': {'connections': 2, 'uniq_ips': 2}, '04/12/2025': {'connections': 2, 'uniq_ips': 2}, '05/12/2025': {'connections': 2, 'uniq_ips': 2}}",CVE-2021-41649,12518,2025-11-28 12:54:30.324818
Microsoft,Open Management Infrastructure (OMI),True,True,2,2.0,15,59,86,"{'04/12/2025': {'connections': 2, 'uniq_ips': 2}, '05/12/2025': {'connections': 2, 'uniq_ips': 2}}",CVE-2021-38647,19837,2025-12-04 12:59:17.448206
VoIPmonitor,VoIPmonitor,True,True,2,2.0,51,60,40,"{'28/11/2025': {'connections': 2, 'uniq_ips': 2}, '29/11/2025': {'connections': 2, 'uniq_ips': 1}, '30/11/2025': {'connections': 2, 'uniq_ips': 2}, '01/12/2025': {'connections': 2, 'uniq_ips': 2}, '04/12/2025': {'connections': 2, 'uniq_ips': 2}, '05/12/2025': {'connections': 2, 'uniq_ips': 2}}",CVE-2022-24260,13107,2025-11-28 12:54:30.271345
Wordpress,Wordpress Block and Stop Bad Bots plugin,True,True,2,2.0,9,78,83,"{'01/12/2025': {'connections': 2, 'uniq_ips': 2}, '03/12/2025': {'connections': 2, 'uniq_ips': 2}, '04/12/2025': {'connections': 2, 'uniq_ips': 2}, '05/12/2025': {'connections': 2, 'uniq_ips': 2}}",CVE-2021-24499,33674,2025-12-01 12:57:36.233477
Totolink,EX200,True,True,2,2.0,41,163,75,"{'28/11/2025': {'connections': 2, 'uniq_ips': 2}, '04/12/2025': {'connections': 2, 'uniq_ips': 2}, '05/12/2025': {'connections': 2, 'uniq_ips': 2}}",CVE-2021-43711,20772,2025-11-28 12:54:30.313604
GitLab,GitLab CE/EE,True,True,2,1.0,3,27,15,"{'27/11/2025': {'connections': 2, 'uniq_ips': 1}, '04/12/2025': {'connections': 2, 'uniq_ips': 1}, '05/12/2025': {'connections': 2, 'uniq_ips': 1}}",CVE-2021-22214,1938,2025-11-27 12:56:01.545276
HashiCorp,Consul and Consul Enterprise,True,True,2,2.0,47,53,41,"{'28/11/2025': {'connections': 2, 'uniq_ips': 2}, '29/11/2025': {'connections': 2, 'uniq_ips': 1}, '30/11/2025': {'connections': 2, 'uniq_ips': 1}, '03/12/2025': {'connections': 2, 'uniq_ips': 2}, '04/12/2025': {'connections': 2, 'uniq_ips': 2}, '05/12/2025': {'connections': 2, 'uniq_ips': 2}}",CVE-2022-29153,11782,2025-11-28 12:54:30.356040
Wordpress,Wordpress WooCommerce Checkout Field Manager plugin,True,True,2,2.0,2,81,54,"{'04/12/2025': {'connections': 2, 'uniq_ips': 2}, '05/12/2025': {'connections': 2, 'uniq_ips': 2}}",CVE-2022-4328,16327,2025-12-04 12:59:17.454262
dotCMS,dotCMS,True,True,2,1.0,25,87,47,"{'30/11/2025': {'connections': 2, 'uniq_ips': 1}, '03/12/2025': {'connections': 2, 'uniq_ips': 2}, '04/12/2025': {'connections': 2, 'uniq_ips': 2}, '05/12/2025': {'connections': 2, 'uniq_ips': 2}}",CVE-2022-26352,17916,2025-11-30 12:50:46.572823
Wordpress,Wordpress The True Ranker plugin,True,True,2,2.0,2,28,33,"{'04/12/2025': {'connections': 2, 'uniq_ips': 2}, '05/12/2025': {'connections': 2, 'uniq_ips': 2}}",CVE-2021-39312,3142,2025-12-04 12:59:17.448643
WAVLINK,WAVLINK WN535K2 and WN535K3,True,True,2,2.0,100,275,192,"{'28/11/2025': {'connections': 2, 'uniq_ips': 2}, '29/11/2025': {'connections': 2, 'uniq_ips': 1}, '30/11/2025': {'connections': 2, 'uniq_ips': 2}, '01/12/2025': {'connections': 2, 'uniq_ips': 2}, '04/12/2025': {'connections': 2, 'uniq_ips': 2}, '05/12/2025': {'connections': 2, 'uniq_ips': 2}}",CVE-2022-2488,61334,2025-11-28 12:54:30.343052
Synacor,Zimbra Collaboration Suite,True,True,2,2.0,370,1301,2470,"{'04/12/2025': {'connections': 2, 'uniq_ips': 2}, '05/12/2025': {'connections': 2, 'uniq_ips': 2}}",CVE-2022-37042,970517,2025-12-04 12:59:17.603685
Tenda,Tenda AC11,True,True,2,2.0,2,461,588,"{'04/12/2025': {'connections': 2, 'uniq_ips': 2}, '05/12/2025': {'connections': 2, 'uniq_ips': 2}}",CVE-2021-31755,76587,2025-12-04 12:59:17.546639
Kramer,VIAware,True,True,2,2.0,2,111,121,"{'01/12/2025': {'connections': 2, 'uniq_ips': 2}, '03/12/2025': {'connections': 2, 'uniq_ips': 2}, '04/12/2025': {'connections': 2, 'uniq_ips': 2}, '05/12/2025': {'connections': 2, 'uniq_ips': 2}}",CVE-2021-36356,24748,2025-12-01 12:57:36.291026
College Management System,College Management System v1.0,True,True,2,2.0,47,34,27,"{'28/11/2025': {'connections': 2, 'uniq_ips': 2}, '29/11/2025': {'connections': 2, 'uniq_ips': 1}, '30/11/2025': {'connections': 2, 'uniq_ips': 1}, '03/12/2025': {'connections': 2, 'uniq_ips': 2}, '04/12/2025': {'connections': 2, 'uniq_ips': 2}, '05/12/2025': {'connections': 2, 'uniq_ips': 2}}",CVE-2022-28079,9630,2025-11-28 12:54:30.381758
SAP,BusinessObjects Business Intelligence Platform (Web Services),True,True,2,1.0,2,2,2,"{'15/09/2024': {'connections': 2, 'uniq_ips': 1}}",CVE-2020-6308,2,2024-09-15 12:39:34.689437
Zyxel,Zyxel NBG2105,True,True,2,2.0,3,33,33,"{'01/12/2025': {'connections': 2, 'uniq_ips': 2}, '03/12/2025': {'connections': 2, 'uniq_ips': 2}, '04/12/2025': {'connections': 2, 'uniq_ips': 2}, '05/12/2025': {'connections': 2, 'uniq_ips': 2}}",CVE-2021-3297,1637,2025-12-01 12:57:36.158530
Wordpress,Wordpress Plugin drag-and-drop-multiple-file-upload-contact-form-7,True,True,2,2.0,15,105,76,"{'01/12/2025': {'connections': 2, 'uniq_ips': 2}, '03/12/2025': {'connections': 2, 'uniq_ips': 2}, '04/12/2025': {'connections': 2, 'uniq_ips': 2}}",CVE-2020-12800,55280,2025-12-01 12:57:36.239738
Wordpress,Wordpress WooCommerce Dropshipping plugin,True,True,2,2.0,2,45,38,"{'04/12/2025': {'connections': 2, 'uniq_ips': 2}, '05/12/2025': {'connections': 2, 'uniq_ips': 2}}",CVE-2022-3481,1486,2025-12-04 12:59:17.570611
Apache,Tapestry,True,True,2,2.0,19,51,38,"{'01/12/2025': {'connections': 2, 'uniq_ips': 2}, '03/12/2025': {'connections': 2, 'uniq_ips': 2}, '04/12/2025': {'connections': 2, 'uniq_ips': 2}, '05/12/2025': {'connections': 2, 'uniq_ips': 2}}",CVE-2021-27850,31586,2025-12-01 12:57:36.237260
Wordpress,Wordpress JoomSport plugin,True,True,2,2.0,2,43,37,"{'04/12/2025': {'connections': 2, 'uniq_ips': 2}, '05/12/2025': {'connections': 2, 'uniq_ips': 2}}",CVE-2022-4050,12059,2025-12-04 12:59:17.506308
GitLab,GitLab CE/EE,True,True,2,1.0,7,45,48,"{'05/12/2025': {'connections': 2, 'uniq_ips': 1}}",CVE-2021-4191,34011,2025-12-05 12:56:12.940635
Sitecore,Sitecore XP,True,True,2,2.0,38,71,89,"{'28/11/2025': {'connections': 2, 'uniq_ips': 2}, '30/11/2025': {'connections': 2, 'uniq_ips': 2}, '01/12/2025': {'connections': 2, 'uniq_ips': 2}, '03/12/2025': {'connections': 2, 'uniq_ips': 2}, '04/12/2025': {'connections': 2, 'uniq_ips': 2}, '05/12/2025': {'connections': 2, 'uniq_ips': 2}}",CVE-2021-42237,17552,2025-11-28 12:54:30.344456
Sunhillo,Sureline,True,True,2,2.0,2,447,570,"{'04/12/2025': {'connections': 2, 'uniq_ips': 2}, '05/12/2025': {'connections': 2, 'uniq_ips': 2}}",CVE-2021-36380,70141,2025-12-04 12:59:17.589388
WAVLINK,WAVLINK WN535K2 and WN535K3,True,True,2,2.0,35,71,94,"{'28/11/2025': {'connections': 2, 'uniq_ips': 2}, '29/11/2025': {'connections': 2, 'uniq_ips': 1}, '30/11/2025': {'connections': 2, 'uniq_ips': 2}, '01/12/2025': {'connections': 2, 'uniq_ips': 2}, '04/12/2025': {'connections': 2, 'uniq_ips': 2}, '05/12/2025': {'connections': 2, 'uniq_ips': 2}}",CVE-2022-2487,16594,2025-11-28 12:54:30.438309
Wordpress,Wordpress WooCommerce Help Scout WordPress plugin,True,True,2,2.0,2,22,22,"{'04/12/2025': {'connections': 2, 'uniq_ips': 2}, '05/12/2025': {'connections': 2, 'uniq_ips': 2}}",CVE-2021-24212,277,2025-12-04 12:59:17.573489
Wordpress,Wordpress Infographic Maker plugin,True,True,2,2.0,2,47,42,"{'04/12/2025': {'connections': 2, 'uniq_ips': 2}, '05/12/2025': {'connections': 2, 'uniq_ips': 2}}",CVE-2022-0747,14462,2025-12-04 12:59:17.608857
Wordpress,Wordpress WP Video Gallery plugin,True,True,2,2.0,39,57,45,"{'28/11/2025': {'connections': 2, 'uniq_ips': 2}, '30/11/2025': {'connections': 2, 'uniq_ips': 2}, '01/12/2025': {'connections': 2, 'uniq_ips': 2}, '03/12/2025': {'connections': 2, 'uniq_ips': 2}, '04/12/2025': {'connections': 2, 'uniq_ips': 2}, '05/12/2025': {'connections': 2, 'uniq_ips': 2}}",CVE-2022-0826,14172,2025-11-28 12:54:30.311100
Wordpress,Sitemap by click5 WordPress plugin,True,True,2,2.0,2,44,51,"{'04/12/2025': {'connections': 2, 'uniq_ips': 2}, '05/12/2025': {'connections': 2, 'uniq_ips': 2}}",CVE-2022-0952,26173,2025-12-04 12:59:17.637009
AfterLogic,AfterLogic Aurora/WebMail Pro,True,True,2,2.0,2,31,29,"{'01/12/2025': {'connections': 2, 'uniq_ips': 2}, '04/12/2025': {'connections': 2, 'uniq_ips': 2}, '05/12/2025': {'connections': 2, 'uniq_ips': 2}}",CVE-2021-26294,25277,2025-12-01 12:57:36.144293
NETGEAR,NETGEAR ProSafe FVS336Gv2/FVS336Gv3,True,True,2,2.0,50,85,53,"{'28/11/2025': {'connections': 2, 'uniq_ips': 2}, '29/11/2025': {'connections': 2, 'uniq_ips': 1}, '30/11/2025': {'connections': 2, 'uniq_ips': 1}, '03/12/2025': {'connections': 2, 'uniq_ips': 2}, '04/12/2025': {'connections': 2, 'uniq_ips': 2}, '05/12/2025': {'connections': 2, 'uniq_ips': 2}}",CVE-2022-29383,20415,2025-11-28 12:54:30.438979
Open Automation Software,OAS Platform,True,True,2,1.0,2,53,34,"{'30/11/2025': {'connections': 2, 'uniq_ips': 1}, '03/12/2025': {'connections': 2, 'uniq_ips': 2}, '04/12/2025': {'connections': 2, 'uniq_ips': 2}, '05/12/2025': {'connections': 2, 'uniq_ips': 2}}",CVE-2022-26833,18900,2025-11-30 12:50:46.572171
camptocamp,Terraboard,True,True,2,1.0,2,2,2,"{'15/09/2024': {'connections': 2, 'uniq_ips': 1}}",CVE-2022-1883,3,2024-09-15 12:39:34.687628
Dairy Farm Shop Management System,Dairy Farm Shop Management System v1.0,True,True,2,2.0,53,63,44,"{'28/11/2025': {'connections': 2, 'uniq_ips': 2}, '29/11/2025': {'connections': 2, 'uniq_ips': 1}, '30/11/2025': {'connections': 2, 'uniq_ips': 1}, '03/12/2025': {'connections': 2, 'uniq_ips': 2}, '04/12/2025': {'connections': 2, 'uniq_ips': 2}, '05/12/2025': {'connections': 2, 'uniq_ips': 2}}",CVE-2022-29007,14227,2025-11-28 12:54:30.311781
Guralp,Guralp MAN-EAM-0003,True,True,2,2.0,2,32,29,"{'04/12/2025': {'connections': 2, 'uniq_ips': 2}, '05/12/2025': {'connections': 2, 'uniq_ips': 2}}",CVE-2022-38840,1175,2025-12-04 12:59:17.527880
Airspan,Airspot 5410,True,True,2,1.0,2,2,2,"{'15/09/2024': {'connections': 2, 'uniq_ips': 1}}",CVE-2022-36267,3,2024-09-15 12:39:34.721172
Wordpress,Wordpress Youzify plugin,True,True,2,1.0,2,2,27,"{'27/11/2025': {'connections': 2, 'uniq_ips': 1}}",CVE-2022-1950,1012,2025-11-27 12:56:01.562105
H3C,H3C GR3200,True,True,2,1.0,2,25,30,"{'30/11/2025': {'connections': 2, 'uniq_ips': 1}, '03/12/2025': {'connections': 2, 'uniq_ips': 2}, '04/12/2025': {'connections': 2, 'uniq_ips': 2}, '05/12/2025': {'connections': 2, 'uniq_ips': 2}}",CVE-2022-36509,12169,2025-11-30 12:50:46.504245
Wordpress,Wordpress BadgeOS plugin,True,True,2,2.0,35,53,42,"{'28/11/2025': {'connections': 2, 'uniq_ips': 2}, '29/11/2025': {'connections': 2, 'uniq_ips': 1}, '30/11/2025': {'connections': 2, 'uniq_ips': 2}, '01/12/2025': {'connections': 2, 'uniq_ips': 2}, '04/12/2025': {'connections': 2, 'uniq_ips': 2}, '05/12/2025': {'connections': 2, 'uniq_ips': 2}}",CVE-2022-2958,13516,2025-11-28 12:54:30.385880
Razer,Razer Sila,True,True,2,2.0,53,40,32,"{'28/11/2025': {'connections': 2, 'uniq_ips': 2}, '29/11/2025': {'connections': 2, 'uniq_ips': 1}, '30/11/2025': {'connections': 2, 'uniq_ips': 1}, '03/12/2025': {'connections': 2, 'uniq_ips': 2}, '04/12/2025': {'connections': 2, 'uniq_ips': 2}, '05/12/2025': {'connections': 2, 'uniq_ips': 2}}",CVE-2022-29014,10361,2025-11-28 12:54:30.421498
TP-Link,TP-Link TL-WR840N EU v5,True,True,2,2.0,16,70,106,"{'04/12/2025': {'connections': 2, 'uniq_ips': 2}, '05/12/2025': {'connections': 2, 'uniq_ips': 2}}",CVE-2021-41653,20008,2025-12-04 12:59:17.472507
ECOA,ECOA Building Automation System,True,True,2,2.0,2,28,29,"{'04/12/2025': {'connections': 2, 'uniq_ips': 2}, '05/12/2025': {'connections': 2, 'uniq_ips': 2}}",CVE-2021-41293,10862,2025-12-04 12:59:17.495205
Wordpress,Wordpress HTML2WP plugin,True,True,2,2.0,15,29,29,"{'04/12/2025': {'connections': 2, 'uniq_ips': 2}, '05/12/2025': {'connections': 2, 'uniq_ips': 2}}",CVE-2022-1574,370,2025-12-04 12:59:17.637642
Wordpress,Wordpress RSVPMaker plugin,True,True,2,2.0,2,31,32,"{'04/12/2025': {'connections': 2, 'uniq_ips': 2}, '05/12/2025': {'connections': 2, 'uniq_ips': 2}}",CVE-2022-1768,10343,2025-12-04 12:59:17.499112
Realtek,Realtek SDK,True,True,2,2.0,16,430,568,"{'04/12/2025': {'connections': 2, 'uniq_ips': 2}, '05/12/2025': {'connections': 2, 'uniq_ips': 2}}",CVE-2021-35395,69017,2025-12-04 12:59:17.441829
HPE,HPE Edgeline Infrastructure Manager,True,True,2,2.0,2,66,44,"{'01/12/2025': {'connections': 2, 'uniq_ips': 2}, '03/12/2025': {'connections': 2, 'uniq_ips': 2}, '04/12/2025': {'connections': 2, 'uniq_ips': 2}, '05/12/2025': {'connections': 2, 'uniq_ips': 2}}",CVE-2021-29203,23210,2025-12-01 12:57:36.254597
GLPI (teclib),GLPI,True,True,2,2.0,8,126,67,"{'04/12/2025': {'connections': 2, 'uniq_ips': 2}, '05/12/2025': {'connections': 2, 'uniq_ips': 2}}",CVE-2022-35914,38008,2025-12-04 12:59:17.530667
ZTE,"ZTE F460,F660",True,True,2,1.0,2,3,4,"{'04/12/2025': {'connections': 2, 'uniq_ips': 1}, '05/12/2025': {'connections': 2, 'uniq_ips': 1}}",CVE-2014-2321,1037,2025-12-04 12:59:17.443743
Schneider Electric,SpaceLogic C-Bus Home Controller (5200WHC2),True,True,2,2.0,43,36,33,"{'28/11/2025': {'connections': 2, 'uniq_ips': 2}, '29/11/2025': {'connections': 2, 'uniq_ips': 1}, '30/11/2025': {'connections': 2, 'uniq_ips': 1}, '03/12/2025': {'connections': 2, 'uniq_ips': 2}, '04/12/2025': {'connections': 2, 'uniq_ips': 2}, '05/12/2025': {'connections': 2, 'uniq_ips': 2}}",CVE-2022-34753,12910,2025-11-28 12:54:30.338657
Wordpress,Wordpress Users Ultra plugin,True,True,2,2.0,2,45,38,"{'04/12/2025': {'connections': 2, 'uniq_ips': 2}, '05/12/2025': {'connections': 2, 'uniq_ips': 2}}",CVE-2022-0769,13749,2025-12-04 12:59:17.544756
Node.js,Node.js (ejs),True,True,2,2.0,159,254,125,"{'28/11/2025': {'connections': 2, 'uniq_ips': 2}, '29/11/2025': {'connections': 2, 'uniq_ips': 1}, '30/11/2025': {'connections': 2, 'uniq_ips': 1}, '03/12/2025': {'connections': 2, 'uniq_ips': 2}, '04/12/2025': {'connections': 2, 'uniq_ips': 2}, '05/12/2025': {'connections': 2, 'uniq_ips': 2}}",CVE-2022-29078,47259,2025-11-28 12:54:30.282943
ThoughtWorks,GoCD,True,True,2,1.0,9,10,23,"{'05/12/2025': {'connections': 2, 'uniq_ips': 1}}",CVE-2021-43287,4579,2025-12-05 12:56:12.899911
Wordpress,Wordpress Title Experiments Free plugin,True,True,2,2.0,41,53,40,"{'28/11/2025': {'connections': 2, 'uniq_ips': 2}, '30/11/2025': {'connections': 2, 'uniq_ips': 2}, '01/12/2025': {'connections': 2, 'uniq_ips': 2}, '03/12/2025': {'connections': 2, 'uniq_ips': 2}, '04/12/2025': {'connections': 2, 'uniq_ips': 2}, '05/12/2025': {'connections': 2, 'uniq_ips': 2}}",CVE-2022-0784,13308,2025-11-28 12:54:30.342737
SonicWall,SonicWall Secure Remote Access,True,True,2,2.0,2,7,19,"{'01/12/2025': {'connections': 2, 'uniq_ips': 2}, '03/12/2025': {'connections': 2, 'uniq_ips': 2}, '04/12/2025': {'connections': 2, 'uniq_ips': 2}}",CVE-2021-20028,4875,2025-12-01 12:57:36.180613
Lumis,LumisXP,True,True,2,2.0,2,56,39,"{'01/12/2025': {'connections': 2, 'uniq_ips': 2}, '03/12/2025': {'connections': 2, 'uniq_ips': 2}, '04/12/2025': {'connections': 2, 'uniq_ips': 2}, '05/12/2025': {'connections': 2, 'uniq_ips': 2}}",CVE-2021-27931,25798,2025-12-01 12:57:36.326466
Roxy-WI,Roxy-WI,True,True,2,2.0,8,69,44,"{'05/12/2025': {'connections': 2, 'uniq_ips': 2}}",CVE-2022-31161,2876,2025-12-05 12:56:12.919810
F5,BIG-IP,True,True,2,2.0,17,384,508,"{'05/12/2025': {'connections': 2, 'uniq_ips': 2}}",CVE-2021-22986,122101,2025-12-05 12:56:12.814639
Array Networks,Array AG Series and vxAG,True,True,2,1.0,2,8,6,"{'27/11/2025': {'connections': 2, 'uniq_ips': 1}}",CVE-2023-28461,148,2025-11-27 12:56:01.671306
Oracle,Oracle E-Business Suite (Oracle Web Applications Desktop Integrator),True,True,2,2.0,22,146,99,"{'01/12/2025': {'connections': 2, 'uniq_ips': 2}, '03/12/2025': {'connections': 2, 'uniq_ips': 2}, '04/12/2025': {'connections': 2, 'uniq_ips': 2}, '05/12/2025': {'connections': 2, 'uniq_ips': 2}}",CVE-2022-21587,40373,2025-12-01 12:57:36.195349
Wordpress,Wordpress Paid Memberships Pro plugin,True,True,2,2.0,2,55,40,"{'01/12/2025': {'connections': 2, 'uniq_ips': 2}, '03/12/2025': {'connections': 2, 'uniq_ips': 2}, '04/12/2025': {'connections': 2, 'uniq_ips': 2}, '05/12/2025': {'connections': 2, 'uniq_ips': 2}}",CVE-2021-25114,35258,2025-12-01 12:57:36.249718
rConfig,rConfig,True,True,2,2.0,3,81,70,"{'04/12/2025': {'connections': 2, 'uniq_ips': 2}}",CVE-2020-13638,65770,2025-12-04 12:59:17.587515
SonicWall,SonicWall GMS and Analytics,True,True,2,2.0,44,64,49,"{'28/11/2025': {'connections': 2, 'uniq_ips': 2}, '29/11/2025': {'connections': 2, 'uniq_ips': 1}, '30/11/2025': {'connections': 2, 'uniq_ips': 1}, '03/12/2025': {'connections': 2, 'uniq_ips': 2}, '04/12/2025': {'connections': 2, 'uniq_ips': 2}, '05/12/2025': {'connections': 2, 'uniq_ips': 2}}",CVE-2023-34133,13916,2025-11-28 12:54:30.291080
GL.iNet,GL.iNet devices,True,True,2,2.0,18,31,22,"{'28/11/2025': {'connections': 2, 'uniq_ips': 2}, '29/11/2025': {'connections': 2, 'uniq_ips': 1}, '30/11/2025': {'connections': 2, 'uniq_ips': 1}, '03/12/2025': {'connections': 2, 'uniq_ips': 2}, '04/12/2025': {'connections': 2, 'uniq_ips': 2}, '05/12/2025': {'connections': 2, 'uniq_ips': 2}}",CVE-2023-31478,4112,2025-11-28 12:54:30.380657
Fortra,GoAnywhere MFT,True,True,2,2.0,18,54,12232,"{'04/12/2025': {'connections': 2, 'uniq_ips': 2}, '05/12/2025': {'connections': 2, 'uniq_ips': 2}}",CVE-2023-0669,6325186,2025-12-04 12:59:17.562893
FIT2CLOUD,KubePi,True,True,2,2.0,24,46,34,"{'28/11/2025': {'connections': 2, 'uniq_ips': 2}, '29/11/2025': {'connections': 2, 'uniq_ips': 1}, '30/11/2025': {'connections': 2, 'uniq_ips': 1}, '03/12/2025': {'connections': 2, 'uniq_ips': 2}, '04/12/2025': {'connections': 2, 'uniq_ips': 2}, '05/12/2025': {'connections': 2, 'uniq_ips': 2}}",CVE-2024-36111,9665,2025-11-28 12:54:30.388743
Ivanti,Avalanche,True,True,2,2.0,2,52,40,"{'05/12/2025': {'connections': 2, 'uniq_ips': 2}}",CVE-2023-32563,18095,2025-12-05 12:56:12.894711
Apache,Apache HTTP Server,True,True,2,1.0,11,35,24,"{'04/12/2025': {'connections': 2, 'uniq_ips': 1}}",CVE-2024-38475,3083,2025-12-04 12:59:17.581994
SecurEnvoy,SecurEnvoy MFA,True,True,2,1.0,2,32,32,"{'30/11/2025': {'connections': 2, 'uniq_ips': 1}}",CVE-2024-37393,219,2025-11-30 12:50:46.570880
CWP,CWP (Control Web Panel),True,True,2,1.0,2,2,2,{},CVE-2025-48703,2,2025-08-16 12:50:50.372442
Wordpress,Wordpress Oturia Smart Google Code Inserter plugin,True,True,2,2.0,3,53,50,"{'01/12/2025': {'connections': 2, 'uniq_ips': 2}, '03/12/2025': {'connections': 2, 'uniq_ips': 2}, '04/12/2025': {'connections': 2, 'uniq_ips': 2}}",CVE-2018-3810,50630,2025-12-01 12:57:36.159790
LB-LINK,LB-LINK routers (multiple),True,True,2,1.0,2,2,68,"{'27/11/2025': {'connections': 2, 'uniq_ips': 1}}",CVE-2025-45988,2,2025-11-27 12:56:01.657838
vBulletin,vBulletin,True,True,2,1.0,2,2,2,{},CVE-2025-48827,2,2025-08-02 02:11:21.528574
Oracle,Oracle Fusion Middleware (Identity Manager),True,True,2,1.0,2,2,2,"{'04/12/2025': {'connections': 2, 'uniq_ips': 1}}",CVE-2025-61757,2,2025-12-04 12:59:17.574112
Hikvision,Hikvision DS series multiple products,True,True,2,1.0,21,21,13,"{'05/12/2025': {'connections': 2, 'uniq_ips': 1}}",CVE-2017-7921,2810,2025-12-05 12:56:12.869038
Quest,Quest KACE K1000 Systems Management Appliance,True,True,2,1.0,2,2,2,"{'29/06/2024': {'connections': 2, 'uniq_ips': 1}, '30/06/2024': {'connections': 2, 'uniq_ips': 1}}",CVE-2019-20504,2,2024-06-30 06:01:20.363331
Apache,Tomcat,True,True,2,1.0,2,2,4,"{'27/11/2025': {'connections': 2, 'uniq_ips': 1}, '28/11/2025': {'connections': 2, 'uniq_ips': 1}}",CVE-2017-12615,426,2025-11-23 12:47:09.049969
Geutebruck,G-Cam/EFD-2250,True,True,2,1.0,2,2,2,"{'15/09/2024': {'connections': 2, 'uniq_ips': 1}}",CVE-2017-5173,3,2024-09-15 12:39:34.683092
metersphere,metersphere,True,True,2,2.0,23,27,27,"{'28/11/2025': {'connections': 2, 'uniq_ips': 2}, '29/11/2025': {'connections': 2, 'uniq_ips': 1}, '30/11/2025': {'connections': 2, 'uniq_ips': 1}, '03/12/2025': {'connections': 2, 'uniq_ips': 2}, '04/12/2025': {'connections': 2, 'uniq_ips': 2}, '05/12/2025': {'connections': 2, 'uniq_ips': 2}}",CVE-2023-25573,10457,2025-11-28 12:54:30.417189
QNAP,QNAP QTS and QuTS Hero,True,True,2,1.0,2,2,7,"{'29/11/2025': {'connections': 2, 'uniq_ips': 1}}",CVE-2024-21899,181270,2025-11-29 12:51:06.064497
PyTorch,PyTorch TorchServe,True,True,2,2.0,2,2,2,"{'27/11/2025': {'connections': 2, 'uniq_ips': 2}, '29/11/2025': {'connections': 2, 'uniq_ips': 1}, '30/11/2025': {'connections': 2, 'uniq_ips': 1}}",CVE-2023-43654,2,2025-11-27 12:56:01.655947
Home Assistant,Home Assistance (Supervisor),True,True,2,1.0,3,176,118,"{'30/11/2025': {'connections': 2, 'uniq_ips': 1}, '03/12/2025': {'connections': 2, 'uniq_ips': 2}, '04/12/2025': {'connections': 2, 'uniq_ips': 2}, '05/12/2025': {'connections': 2, 'uniq_ips': 2}}",CVE-2023-27482,110216,2025-11-30 12:50:46.539436
plentico,plenti,True,True,2,1.0,2,2,2,"{'30/11/2025': {'connections': 2, 'uniq_ips': 1}}",CVE-2024-49380,2,2025-11-30 12:50:46.607990
Arcserve,Arcserve Unified Data Protection (UDP),True,True,2,2.0,15,47,36,"{'04/12/2025': {'connections': 2, 'uniq_ips': 2}, '05/12/2025': {'connections': 2, 'uniq_ips': 2}}",CVE-2023-26258,1478,2025-12-04 12:59:17.536167
GruppoSCAI,RealGimm,True,True,2,1.0,5,15,13,"{'10/11/2025': {'connections': 2, 'uniq_ips': 2}, '11/11/2025': {'connections': 2, 'uniq_ips': 2}}",CVE-2023-41642,2799,2025-11-10 12:56:08.306602
JEECG,jeecg-boot,True,True,2,1.0,2,49,36,"{'30/11/2025': {'connections': 2, 'uniq_ips': 1}, '03/12/2025': {'connections': 2, 'uniq_ips': 2}, '04/12/2025': {'connections': 2, 'uniq_ips': 2}, '05/12/2025': {'connections': 2, 'uniq_ips': 2}}",CVE-2023-1454,11918,2025-11-30 12:50:46.621108
Adobe,ColdFusion,True,True,2,1.0,2,2,2,"{'31/12/2024': {'connections': 2, 'uniq_ips': 1}}",CVE-2023-26360,2,2024-12-31 12:42:05.570163
Atlassian,Confluence,True,True,2,2.0,34,309,189,"{'28/11/2025': {'connections': 2, 'uniq_ips': 2}, '29/11/2025': {'connections': 2, 'uniq_ips': 1}, '30/11/2025': {'connections': 2, 'uniq_ips': 1}}",CVE-2023-22518,71917,2025-11-28 12:54:30.402607
Progress,MOVEit Transfer,True,True,2,1.0,2,2,2,"{'01/07/2024': {'connections': 2, 'uniq_ips': 1}, '02/07/2024': {'connections': 2, 'uniq_ips': 1}, '07/07/2024': {'connections': 2, 'uniq_ips': 1}, '08/07/2024': {'connections': 2, 'uniq_ips': 1}, '15/07/2024': {'connections': 2, 'uniq_ips': 1}, '16/07/2024': {'connections': 2, 'uniq_ips': 1}, '21/12/2024': {'connections': 2, 'uniq_ips': 1}, '22/12/2024': {'connections': 2, 'uniq_ips': 1}, '28/07/2025': {'connections': 2, 'uniq_ips': 1}, '29/07/2025': {'connections': 2, 'uniq_ips': 1}}",CVE-2023-34362,10,2024-07-02 12:01:13.979426
Wordpress,Wordpress Extensive VC Addons for WPBakery page builder plugin,True,True,2,2.0,2,33,36,"{'04/12/2025': {'connections': 2, 'uniq_ips': 2}, '05/12/2025': {'connections': 2, 'uniq_ips': 2}}",CVE-2023-0159,1292,2025-12-04 12:59:17.634744
Anyscale,Ray,True,True,2,1.0,194,37,31,"{'02/12/2025': {'connections': 2, 'uniq_ips': 1}}",CVE-2023-48022,3033,2025-12-02 12:58:40.100696
Ivanti,Ivanti CSA,True,True,2,2.0,230,403,275,"{'05/12/2025': {'connections': 2, 'uniq_ips': 2}}",CVE-2024-8963,144965,2025-12-05 12:56:12.944175
SecurePoint,SecurePoint UTM,True,True,2,2.0,2,25,27,"{'04/12/2025': {'connections': 2, 'uniq_ips': 2}, '05/12/2025': {'connections': 2, 'uniq_ips': 2}}",CVE-2023-22620,9905,2025-12-04 12:59:17.528794
QNAP,QNAP VioStor NVR,True,True,2,1.0,2,2,2,"{'08/10/2025': {'connections': 2, 'uniq_ips': 1}, '09/10/2025': {'connections': 2, 'uniq_ips': 1}, '10/10/2025': {'connections': 2, 'uniq_ips': 1}, '11/10/2025': {'connections': 2, 'uniq_ips': 1}, '12/10/2025': {'connections': 2, 'uniq_ips': 1}}",CVE-2023-47565,16,2025-10-08 12:53:12.698831
CONTEC,SolarView Compact,True,True,2,2.0,21,51,35,"{'28/11/2025': {'connections': 2, 'uniq_ips': 2}, '29/11/2025': {'connections': 2, 'uniq_ips': 1}, '30/11/2025': {'connections': 2, 'uniq_ips': 1}, '03/12/2025': {'connections': 2, 'uniq_ips': 2}, '04/12/2025': {'connections': 2, 'uniq_ips': 2}, '05/12/2025': {'connections': 2, 'uniq_ips': 2}}",CVE-2023-29919,10079,2025-11-28 12:54:30.363586
Wordpress,Wordpress Steveas WP Live Chat Shoutbox plugin,True,True,2,2.0,50,53,38,"{'28/11/2025': {'connections': 2, 'uniq_ips': 2}, '29/11/2025': {'connections': 2, 'uniq_ips': 1}, '30/11/2025': {'connections': 2, 'uniq_ips': 1}, '03/12/2025': {'connections': 2, 'uniq_ips': 2}, '04/12/2025': {'connections': 2, 'uniq_ips': 2}, '05/12/2025': {'connections': 2, 'uniq_ips': 2}}",CVE-2023-1020,12260,2025-11-28 12:54:30.324631
Chamilo,Chamilo,True,True,2,1.0,2,59,39,"{'30/11/2025': {'connections': 2, 'uniq_ips': 1}, '03/12/2025': {'connections': 2, 'uniq_ips': 2}, '04/12/2025': {'connections': 2, 'uniq_ips': 2}, '05/12/2025': {'connections': 2, 'uniq_ips': 2}}",CVE-2023-34960,11453,2025-11-30 12:50:46.461361
Elastic,Kibana,True,True,2,1.0,8,9,20,"{'05/12/2025': {'connections': 2, 'uniq_ips': 1}}",CVE-2018-17246,7199,2025-12-05 12:56:12.960101
Landray,Landray EIS,True,True,2,1.0,2,2,2,"{'29/11/2025': {'connections': 2, 'uniq_ips': 1}}",CVE-2025-22214,2,2025-11-29 12:51:06.030802
D-Link,"DIR-810L, DIR-820L/LW, DIR-826L, DIR-830L, DIR-836L",True,True,2,2.0,2,440,577,"{'04/12/2025': {'connections': 2, 'uniq_ips': 2}, '05/12/2025': {'connections': 2, 'uniq_ips': 2}}",CVE-2021-45382,68972,2025-12-04 12:59:17.598341
Micro Focus,Operations Bridge Reporter (OBR),True,True,2,2.0,7,490,600,"{'04/12/2025': {'connections': 2, 'uniq_ips': 2}, '05/12/2025': {'connections': 2, 'uniq_ips': 2}}",CVE-2021-22502,86515,2025-12-04 12:59:17.461427
TerraMaster,TOS,True,True,2,1.0,18,222,165,"{'30/11/2025': {'connections': 2, 'uniq_ips': 2}, '01/12/2025': {'connections': 2, 'uniq_ips': 2}, '04/12/2025': {'connections': 2, 'uniq_ips': 2}, '05/12/2025': {'connections': 2, 'uniq_ips': 2}}",CVE-2020-35665,152136,2025-11-30 12:50:46.560398
Void Sistemas,Aurall REC Monitor,True,True,2,2.0,2,32,29,"{'01/12/2025': {'connections': 2, 'uniq_ips': 2}, '03/12/2025': {'connections': 2, 'uniq_ips': 2}, '04/12/2025': {'connections': 2, 'uniq_ips': 2}, '05/12/2025': {'connections': 2, 'uniq_ips': 2}}",CVE-2021-25899,24035,2025-12-01 12:57:36.289963
MiniIO,MiniIO Console,True,True,2,2.0,41,49,37,"{'28/11/2025': {'connections': 2, 'uniq_ips': 2}, '30/11/2025': {'connections': 2, 'uniq_ips': 2}, '01/12/2025': {'connections': 2, 'uniq_ips': 2}, '03/12/2025': {'connections': 2, 'uniq_ips': 2}, '04/12/2025': {'connections': 2, 'uniq_ips': 2}, '05/12/2025': {'connections': 2, 'uniq_ips': 2}}",CVE-2021-41266,19469,2025-11-28 12:54:30.436631
Zimbra,Zimbra Collaboration Suite,True,True,2,1.0,2,512,5095,"{'30/11/2025': {'connections': 2, 'uniq_ips': 2}, '01/12/2025': {'connections': 2, 'uniq_ips': 2}, '03/12/2025': {'connections': 2, 'uniq_ips': 2}, '04/12/2025': {'connections': 2, 'uniq_ips': 2}, '05/12/2025': {'connections': 2, 'uniq_ips': 2}}",CVE-2020-7796,794614,2025-11-30 12:50:46.509121
Wordpress,Wordpress Plugin File Manager,True,True,2,1.0,2,3,7,"{'29/11/2025': {'connections': 2, 'uniq_ips': 1}}",CVE-2020-25213,1055,2025-11-29 12:51:05.935684
Apache,Solr,True,True,2,1.0,2,4,3,"{'04/12/2025': {'connections': 2, 'uniq_ips': 1}}",CVE-2019-0193,132,2025-12-04 12:59:17.602860
Draytek,"Draytek Vigor2960, Vigor3900, Vigor300B",True,True,2,1.0,18,65,104,"{'30/11/2025': {'connections': 2, 'uniq_ips': 2}, '01/12/2025': {'connections': 2, 'uniq_ips': 2}}",CVE-2020-8515,55404,2025-11-30 12:50:46.567925
Hongdian,H8922,True,True,2,2.0,2,39,118,"{'01/12/2025': {'connections': 2, 'uniq_ips': 2}, '03/12/2025': {'connections': 2, 'uniq_ips': 2}, '04/12/2025': {'connections': 2, 'uniq_ips': 2}, '05/12/2025': {'connections': 2, 'uniq_ips': 2}}",CVE-2021-28151,43226,2025-12-01 12:57:36.184553
Oracle,BI Publisher (Oracle Fusion Middleware),True,True,2,1.0,16,15,18,"{'27/11/2025': {'connections': 2, 'uniq_ips': 1}}",CVE-2019-2588,2830,2025-11-27 12:56:01.674353
vBulletin,vBulletin,True,True,2,2.0,2,54,43,"{'01/12/2025': {'connections': 2, 'uniq_ips': 2}, '03/12/2025': {'connections': 2, 'uniq_ips': 2}, '04/12/2025': {'connections': 2, 'uniq_ips': 2}}",CVE-2020-12720,30841,2025-12-01 12:57:36.257796
Apache,Unomi,True,True,2,2.0,3,127,87,"{'01/12/2025': {'connections': 2, 'uniq_ips': 2}, '03/12/2025': {'connections': 2, 'uniq_ips': 2}, '04/12/2025': {'connections': 2, 'uniq_ips': 2}}",CVE-2020-13942,40213,2025-12-01 12:57:36.191660
RosarioSIS,RosarioSIS,True,True,2,2.0,42,54,36,"{'28/11/2025': {'connections': 2, 'uniq_ips': 2}, '30/11/2025': {'connections': 2, 'uniq_ips': 2}, '01/12/2025': {'connections': 2, 'uniq_ips': 2}, '03/12/2025': {'connections': 2, 'uniq_ips': 2}, '04/12/2025': {'connections': 2, 'uniq_ips': 2}, '05/12/2025': {'connections': 2, 'uniq_ips': 2}}",CVE-2021-44427,10556,2025-11-28 12:54:30.346395
Oracle,Oracle Weblogic Server,True,True,2,2.0,15,67,46,"{'01/12/2025': {'connections': 2, 'uniq_ips': 2}, '03/12/2025': {'connections': 2, 'uniq_ips': 2}, '04/12/2025': {'connections': 2, 'uniq_ips': 2}}",CVE-2020-14882,42917,2025-12-01 12:57:36.314699
SonarQube,SonarQube,True,True,2,1.0,9,8,21,"{'05/12/2025': {'connections': 2, 'uniq_ips': 1}}",CVE-2020-27986,12258,2025-12-05 12:56:12.909387
FatPipe,FatPipe WARP/IPVPN/MPVPN,True,True,2,2.0,2,55,34,"{'01/12/2025': {'connections': 2, 'uniq_ips': 2}, '03/12/2025': {'connections': 2, 'uniq_ips': 2}, '04/12/2025': {'connections': 2, 'uniq_ips': 2}, '05/12/2025': {'connections': 2, 'uniq_ips': 2}}",CVE-2021-27855,8813,2025-12-01 12:57:36.248694
Motorola,Binatone Hubble Camera,True,True,2,2.0,18,120,171,"{'01/12/2025': {'connections': 2, 'uniq_ips': 2}, '03/12/2025': {'connections': 2, 'uniq_ips': 2}, '04/12/2025': {'connections': 2, 'uniq_ips': 2}, '05/12/2025': {'connections': 2, 'uniq_ips': 2}}",CVE-2021-3577,64996,2025-12-01 12:57:36.330348
Emerson Dixell,XWEB-500,True,True,2,2.0,15,73,44,"{'04/12/2025': {'connections': 2, 'uniq_ips': 2}, '05/12/2025': {'connections': 2, 'uniq_ips': 2}}",CVE-2021-45420,12578,2025-12-04 12:59:17.537623
Kaseya,VSA,True,True,2,2.0,2,89,69,"{'04/12/2025': {'connections': 2, 'uniq_ips': 2}, '05/12/2025': {'connections': 2, 'uniq_ips': 2}}",CVE-2021-30118,2070,2025-12-04 12:59:17.578727
Wordpress,Wordpress Car Seller - Auto Classifieds Script plugin,True,True,1,1.0,2,50,39,"{'02/12/2025': {'connections': 1, 'uniq_ips': 1}}",CVE-2021-24285,23618,2025-12-02 12:58:40.197512
FSMLabs,TimeKeeper,True,True,1,1.0,2,160,94,"{'01/12/2025': {'connections': 1, 'uniq_ips': 1}, '02/12/2025': {'connections': 1, 'uniq_ips': 1}}",CVE-2023-31465,35894,2025-12-01 12:57:36.164373
Sangfor,Sangfor Behavior Management System (DC Management System),True,True,1,1.0,1,1,1,"{'23/10/2025': {'connections': 1, 'uniq_ips': 1}}",CVE-2023-7307,1,2025-10-23 12:57:18.624541
Request Baskets,Request Baskets,True,True,1,1.0,1,24,26,"{'02/12/2025': {'connections': 1, 'uniq_ips': 1}}",CVE-2023-27163,479,2025-12-02 12:58:40.091013
VMware,VMware View Planner 4.x,True,True,1,1.0,14,66,106,"{'02/12/2025': {'connections': 1, 'uniq_ips': 1}}",CVE-2021-21978,36332,2025-12-02 12:58:40.190912
Wordpress,Wordpress Easy Digital Downloads plugin,True,True,1,1.0,2,47,37,"{'01/12/2025': {'connections': 1, 'uniq_ips': 1}, '02/12/2025': {'connections': 1, 'uniq_ips': 1}}",CVE-2023-23489,12643,2025-12-01 12:57:36.182418
Sitecore,"Experience Manager, Experience Platform, and Experience Commerce",True,True,1,1.0,20,68,43,"{'02/12/2025': {'connections': 1, 'uniq_ips': 1}, '03/12/2025': {'connections': 1, 'uniq_ips': 1}, '04/12/2025': {'connections': 1, 'uniq_ips': 1}, '05/12/2025': {'connections': 1, 'uniq_ips': 1}}",CVE-2023-35813,13138,2025-12-02 12:58:40.172603
TRENDnet,TRENDnet TEW-411BRPplus,True,True,1,1.0,1,1,1,"{'11/11/2025': {'connections': 1, 'uniq_ips': 1}}",CVE-2023-51833,214,2025-11-11 12:54:39.676545
KevinLAB,Building Energy Management System,True,True,1,1.0,46,40,27,"{'26/11/2025': {'connections': 1, 'uniq_ips': 1}, '28/11/2025': {'connections': 1, 'uniq_ips': 1}, '29/11/2025': {'connections': 1, 'uniq_ips': 1}, '01/12/2025': {'connections': 1, 'uniq_ips': 1}, '02/12/2025': {'connections': 1, 'uniq_ips': 1}}",CVE-2021-37291,9561,2025-11-26 12:57:21.211558
Adobe,ColdFusion,True,True,1,1.0,2,53,35,"{'02/12/2025': {'connections': 1, 'uniq_ips': 1}}",CVE-2023-29300,14614,2025-12-02 12:58:40.154102
Citrix,Citrix StoreFront,True,True,1,1.0,1,25,25,"{'02/12/2025': {'connections': 1, 'uniq_ips': 1}}",CVE-2023-5914,21122,2025-12-02 12:58:40.187311
FIT2CLOUD,KubePi,True,True,1,1.0,2,29,29,"{'01/12/2025': {'connections': 1, 'uniq_ips': 1}, '02/12/2025': {'connections': 1, 'uniq_ips': 1}}",CVE-2023-22478,16680,2025-12-01 12:57:36.322302
Technicolor,Technicolor TC7200,True,True,1,1.0,1,1,1,"{'11/11/2025': {'connections': 1, 'uniq_ips': 1}}",CVE-2014-1677,213,2025-11-11 12:54:39.728649
CONTEC,SolarView Compact,True,True,1,1.0,18,60,42,"{'02/12/2025': {'connections': 1, 'uniq_ips': 1}}",CVE-2023-23333,14440,2025-12-02 12:58:40.145413
Sophos,Sophos Web Appliance,True,True,1,1.0,2,67,39,"{'02/12/2025': {'connections': 1, 'uniq_ips': 1}}",CVE-2023-1671,13689,2025-12-02 12:58:40.133780
APsystems,Altenergy Power Control Software,True,True,1,1.0,2,39,32,"{'29/11/2025': {'connections': 1, 'uniq_ips': 1}, '30/11/2025': {'connections': 1, 'uniq_ips': 1}, '01/12/2025': {'connections': 1, 'uniq_ips': 1}, '02/12/2025': {'connections': 1, 'uniq_ips': 1}}",CVE-2023-28343,10890,2025-11-29 12:51:06.097740
Totolink,Totolink N600R,True,True,1,1.0,1,1,1,"{'20/04/2025': {'connections': 1, 'uniq_ips': 1}, '28/06/2025': {'connections': 1, 'uniq_ips': 1}, '29/06/2025': {'connections': 1, 'uniq_ips': 1}}",CVE-2022-28912,1,2025-04-20 12:43:37.112621
Adobe,ColdFusion,True,True,1,1.0,2,37,36,"{'02/12/2025': {'connections': 1, 'uniq_ips': 1}}",CVE-2023-29298,15818,2025-12-02 12:58:40.210232
Open Source SRS Community,SNS,True,True,1,1.0,2,18,22,"{'01/12/2025': {'connections': 1, 'uniq_ips': 1}, '02/12/2025': {'connections': 1, 'uniq_ips': 1}}",CVE-2023-34105,1163,2025-12-01 12:57:36.199934
Totolink,Totolink A3700R,True,True,1,1.0,2,64,43,"{'01/12/2025': {'connections': 1, 'uniq_ips': 1}, '02/12/2025': {'connections': 1, 'uniq_ips': 1}}",CVE-2023-52028,13544,2025-12-01 12:57:36.238221
SolarWinds,Serv-U,True,True,1,1.0,2,30,30,"{'02/12/2025': {'connections': 1, 'uniq_ips': 1}}",CVE-2021-35250,13938,2025-12-02 12:58:40.165508
CuppaCMS,CuppaCMS,True,True,1,1.0,19,33,34,"{'01/12/2025': {'connections': 1, 'uniq_ips': 1}, '02/12/2025': {'connections': 1, 'uniq_ips': 1}}",CVE-2022-34121,10367,2025-12-01 12:57:36.251528
SecurePoint,SecurePoint UTM,True,True,1,1.0,1,28,25,"{'02/12/2025': {'connections': 1, 'uniq_ips': 1}}",CVE-2023-22897,6821,2025-12-02 12:58:40.178691
F5,BIG-IP,True,True,1,1.0,1,1,1,"{'05/03/2025': {'connections': 1, 'uniq_ips': 1}}",CVE-2022-41800,1,2025-03-05 12:46:38.280641
Cassia,Cassia Gateway,True,True,1,1.0,2,156,87,"{'01/12/2025': {'connections': 1, 'uniq_ips': 1}, '02/12/2025': {'connections': 1, 'uniq_ips': 1}}",CVE-2023-31446,24376,2025-12-01 12:57:36.247480
CONTEC,SolarView Compact,True,True,1,1.0,2,63,42,"{'01/12/2025': {'connections': 1, 'uniq_ips': 1}, '02/12/2025': {'connections': 1, 'uniq_ips': 1}}",CVE-2022-40881,14718,2025-12-01 12:57:36.183307
Viessmann,Vitogate 300 BN/MB,True,True,1,1.0,2,52,33,"{'02/12/2025': {'connections': 1, 'uniq_ips': 1}, '03/12/2025': {'connections': 1, 'uniq_ips': 1}, '04/12/2025': {'connections': 1, 'uniq_ips': 1}}",CVE-2023-45852,10873,2025-12-02 12:58:40.097074
Fortinet,FortiNAC,True,True,1,1.0,2,78,50,"{'01/12/2025': {'connections': 1, 'uniq_ips': 1}, '02/12/2025': {'connections': 1, 'uniq_ips': 1}}",CVE-2022-39952,19752,2025-12-01 12:57:36.333616
DCN (Digital China Networks),DCBI-Netlog-LAB,True,True,1,1.0,2,60,37,"{'02/12/2025': {'connections': 1, 'uniq_ips': 1}}",CVE-2023-26802,3079,2025-12-02 12:58:40.089524
Wordpress,Wordpress IWS - Geo Form Fields plugin,True,True,1,1.0,2,53,40,"{'29/11/2025': {'connections': 1, 'uniq_ips': 1}, '30/11/2025': {'connections': 1, 'uniq_ips': 1}, '01/12/2025': {'connections': 1, 'uniq_ips': 1}, '02/12/2025': {'connections': 1, 'uniq_ips': 1}}",CVE-2022-4117,12442,2025-11-29 12:51:06.038945
Wordpress,Wordpress Kaswara Modern VC Addons plugin,True,True,1,1.0,14,83,112,"{'02/12/2025': {'connections': 1, 'uniq_ips': 1}}",CVE-2021-24284,36946,2025-12-02 12:58:40.087322
Weaver,Weaver E-Office,True,True,1,1.0,2,78,52,"{'02/12/2025': {'connections': 1, 'uniq_ips': 1}}",CVE-2023-2648,18002,2025-12-02 12:58:40.100551
Bonitasoft,Bonitasoft,True,True,1,1.0,1,64,22,"{'05/12/2025': {'connections': 1, 'uniq_ips': 1}}",CVE-2022-25237,1164,2025-12-05 12:56:12.816080
MLflow,MLflow,True,True,1,1.0,2,86,59,"{'02/12/2025': {'connections': 1, 'uniq_ips': 1}}",CVE-2023-1177,27908,2025-12-02 12:58:40.174836
Wordpress,Wordpress WPCargo Track & Trace plugin,True,True,1,1.0,17,142,158,"{'02/12/2025': {'connections': 1, 'uniq_ips': 1}}",CVE-2021-25003,101233,2025-12-02 12:58:40.115022
vBulletin,vBulletin,True,True,1,1.0,2,57,42,"{'01/12/2025': {'connections': 1, 'uniq_ips': 1}, '02/12/2025': {'connections': 1, 'uniq_ips': 1}}",CVE-2023-25135,13423,2025-12-01 12:57:36.170807
NSFOCUS,NSFOCUS SecGate3600 Firewall,True,True,1,1.0,1,1,1,"{'25/10/2025': {'connections': 1, 'uniq_ips': 1}}",CVE-2023-7308,1,2025-10-25 12:47:59.001063
PaperCut,PaperCut MF/NG,True,True,1,1.0,2,70,44,"{'02/12/2025': {'connections': 1, 'uniq_ips': 1}}",CVE-2023-27350,34962,2025-12-02 12:58:40.194860
Ruby Dragonfly,Ruby Dragonfly,True,True,1,1.0,30,84,36,"{'05/12/2025': {'connections': 1, 'uniq_ips': 1}}",CVE-2021-33564,8006,2025-12-05 12:56:12.955609
Microchip Technology (Microsemi),SyncServer,True,True,1,1.0,2,64,42,"{'01/12/2025': {'connections': 1, 'uniq_ips': 1}, '02/12/2025': {'connections': 1, 'uniq_ips': 1}}",CVE-2022-40022,14387,2025-12-01 12:57:36.216208
PrestaShop,NDK Design for PrestaShop,True,True,1,1.0,2,41,31,"{'02/12/2025': {'connections': 1, 'uniq_ips': 1}, '03/12/2025': {'connections': 1, 'uniq_ips': 1}, '04/12/2025': {'connections': 1, 'uniq_ips': 1}}",CVE-2023-46347,9089,2025-12-02 12:58:40.129983
Kyocera,Kyocera Multifunction Printers,True,True,1,1.0,52,40,26,"{'26/11/2025': {'connections': 1, 'uniq_ips': 1}, '27/11/2025': {'connections': 1, 'uniq_ips': 1}, '28/11/2025': {'connections': 1, 'uniq_ips': 1}, '29/11/2025': {'connections': 1, 'uniq_ips': 1}, '01/12/2025': {'connections': 1, 'uniq_ips': 1}, '02/12/2025': {'connections': 1, 'uniq_ips': 1}}",CVE-2022-1026,3093,2025-11-26 12:57:21.209373
VMware,vCenter,True,True,1,1.0,15,69,86,"{'02/12/2025': {'connections': 1, 'uniq_ips': 1}}",CVE-2021-21985,37780,2025-12-02 12:58:40.185638
Commvault,CommCell,True,True,1,1.0,2,31,46,"{'02/12/2025': {'connections': 1, 'uniq_ips': 1}}",CVE-2021-34993,20544,2025-12-02 12:58:40.149721
Citrix,Citrix ADC and Citrix Gateway,True,True,1,1.0,5973,5690,4535,"{'05/12/2025': {'connections': 1, 'uniq_ips': 1}}",CVE-2023-24488,1051670,2025-12-05 12:56:12.872281
Lexmark,Lexmark,True,True,1,1.0,2,23,24,"{'01/12/2025': {'connections': 1, 'uniq_ips': 1}, '02/12/2025': {'connections': 1, 'uniq_ips': 1}}",CVE-2023-26067,8901,2025-12-01 12:57:36.274432
Geoserver,Geoserver,True,True,1,1.0,157,539,456,"{'05/12/2025': {'connections': 1, 'uniq_ips': 1}}",CVE-2025-27505,11027,2025-12-05 12:56:12.891615
Progress,Chef Automate,True,True,1,1.0,51,31,31,"{'27/11/2025': {'connections': 1, 'uniq_ips': 1}}",CVE-2025-8868,183,2025-11-27 12:56:01.517911
Citrix,Citrix SD-WAN and NetScaler SD-WAN,True,True,1,1.0,2,177,116,"{'02/12/2025': {'connections': 1, 'uniq_ips': 1}}",CVE-2019-12987,248376,2025-12-02 12:58:40.118259
Apache,Axis2,True,True,1,1.0,26,92,117,"{'02/12/2025': {'connections': 1, 'uniq_ips': 1}}",CVE-2010-0219,67129,2025-12-02 12:58:40.192014
nostromo,nhttpd,True,True,1,1.0,15,71,54,"{'02/12/2025': {'connections': 1, 'uniq_ips': 1}}",CVE-2019-16278,40558,2025-12-02 12:58:40.210867
TopThink,ThinkPHP3,True,True,1,1.0,1,1,1,"{'15/07/2024': {'connections': 1, 'uniq_ips': 1}, '16/07/2024': {'connections': 1, 'uniq_ips': 1}, '02/11/2024': {'connections': 1, 'uniq_ips': 1}, '03/11/2024': {'connections': 1, 'uniq_ips': 1}, '22/05/2025': {'connections': 1, 'uniq_ips': 1}, '23/05/2025': {'connections': 1, 'uniq_ips': 1}, '24/07/2025': {'connections': 1, 'uniq_ips': 1}, '25/07/2025': {'connections': 1, 'uniq_ips': 1}, '11/08/2025': {'connections': 1, 'uniq_ips': 1}, '12/08/2025': {'connections': 1, 'uniq_ips': 1}, '27/08/2025': {'connections': 1, 'uniq_ips': 1}}",CVE-2021-44892,1,2024-07-16 06:01:18.743265
JFrog,Artifactory,True,True,1,1.0,2,59,50,"{'02/12/2025': {'connections': 1, 'uniq_ips': 1}}",CVE-2019-9733,32271,2025-12-02 12:58:40.193692
SAP,NetWeaver Development Infrastructure,True,True,1,1.0,2,50,38,"{'02/12/2025': {'connections': 1, 'uniq_ips': 1}}",CVE-2021-33690,15438,2025-12-02 12:58:40.226702
Cisco,HyperFlex HX,True,True,1,1.0,2,65,92,"{'02/12/2025': {'connections': 1, 'uniq_ips': 1}}",CVE-2021-1497,38675,2025-12-02 12:58:40.238212
Linear,eMerge E3-Series,True,True,1,1.0,15,138,93,"{'02/12/2025': {'connections': 1, 'uniq_ips': 1}}",CVE-2019-7256,60608,2025-12-02 12:58:40.189167
Kentico,Kentico,True,True,1,1.0,1,63,22,"{'05/12/2025': {'connections': 1, 'uniq_ips': 1}}",CVE-2019-10068,1156,2025-12-05 12:56:12.798815
InfluxData,InfluxDB,True,True,1,1.0,2,28,19,"{'05/12/2025': {'connections': 1, 'uniq_ips': 1}}",CVE-2019-20933,11229,2025-12-05 12:56:12.933179
Oracle,BI Publisher (Oracle Fusion Middleware),True,True,1,1.0,2,34,37,"{'02/12/2025': {'connections': 1, 'uniq_ips': 1}}",CVE-2019-2616,29339,2025-12-02 12:58:40.231209
YouPHPTube,YouPHPTube Encoder,True,True,1,1.0,15,181,129,"{'02/12/2025': {'connections': 1, 'uniq_ips': 1}}",CVE-2019-5129,79369,2025-12-02 12:58:40.154932
Atlassian,Crowd/Crowd Data Center,True,True,1,1.0,14,78,134,"{'02/12/2025': {'connections': 1, 'uniq_ips': 1}}",CVE-2019-11580,60175,2025-12-02 12:58:40.233837
Webmin,Webmin,True,True,1,1.0,2,74,64,"{'02/12/2025': {'connections': 1, 'uniq_ips': 1}}",CVE-2019-15107,43968,2025-12-02 12:58:40.215170
node-red-contrib-huemagic,node-red-contrib-huemagic (for Philips HUE,True,True,1,1.0,1,11,14,"{'04/12/2025': {'connections': 1, 'uniq_ips': 1}}",CVE-2021-25864,4549,2025-12-04 12:59:17.630018
Atlassian,JIRA,True,True,1,1.0,26,53,52,"{'02/12/2025': {'connections': 1, 'uniq_ips': 1}}",CVE-2019-8451,22515,2025-12-02 12:58:40.089664
Citrix,Citrix SD-WAN and NetScaler SD-WAN,True,True,1,1.0,2,73,56,"{'02/12/2025': {'connections': 1, 'uniq_ips': 1}}",CVE-2019-12986,68428,2025-12-02 12:58:40.112732
Webmin,Webmin,True,True,1,1.0,2,31,41,"{'02/12/2025': {'connections': 1, 'uniq_ips': 1}}",CVE-2019-15642,49354,2025-12-02 12:58:40.084995
Atlassian,Confluence,True,True,1,1.0,13,125,143,"{'02/12/2025': {'connections': 1, 'uniq_ips': 1}}",CVE-2019-3396,118229,2025-12-02 12:58:40.107256
YouPHPTube,YouPHPTube Encoder,True,True,1,1.0,15,100,81,"{'02/12/2025': {'connections': 1, 'uniq_ips': 1}}",CVE-2019-5127,69700,2025-12-02 12:58:40.090848
D-Link,D-Link Central WiFi Manager CWM(100),True,True,1,1.0,2,59,36,"{'02/12/2025': {'connections': 1, 'uniq_ips': 1}}",CVE-2019-13372,2444,2025-12-02 12:58:40.218616
UDP Technology,video camera firmware for multiple vendors,True,True,1,1.0,2,110,166,"{'02/12/2025': {'connections': 1, 'uniq_ips': 1}}",CVE-2021-33544,62648,2025-12-02 12:58:40.128651
Parse Community,Parse Server,True,True,1,1.0,1,1,1,"{'02/12/2025': {'connections': 1, 'uniq_ips': 1}}",CVE-2025-53364,1,2025-12-02 12:58:40.118718
GrandNode,GrandNode,True,True,1,1.0,26,25,18,"{'05/12/2025': {'connections': 1, 'uniq_ips': 1}}",CVE-2019-12276,7725,2025-12-05 12:56:12.881931
VMware,vCenter,True,True,1,1.0,2,51,43,"{'02/12/2025': {'connections': 1, 'uniq_ips': 1}}",CVE-2021-22005,41682,2025-12-02 12:58:40.214519
Traccar,Traccar,True,True,1,1.0,65,43,43,"{'27/11/2025': {'connections': 1, 'uniq_ips': 1}}",CVE-2025-61666,217,2025-11-27 12:56:01.576065
Monitorr,Monitorr,True,True,1,1.0,15,104,89,"{'02/12/2025': {'connections': 1, 'uniq_ips': 1}}",CVE-2023-26775,65410,2025-12-02 12:58:40.198846
Zoho,ManageEngine OpManager,True,True,1,1.0,1,1,1,"{'13/09/2024': {'connections': 1, 'uniq_ips': 1}, '14/09/2024': {'connections': 1, 'uniq_ips': 1}}",CVE-2021-3287,1,2024-09-13 12:40:59.449443
strapi,strapi,True,True,1,1.0,2,47,46,"{'02/12/2025': {'connections': 1, 'uniq_ips': 1}}",CVE-2019-18818,33915,2025-12-02 12:58:40.224564
Apereo,CAS,True,True,1,1.0,1,47,35,"{'02/12/2025': {'connections': 1, 'uniq_ips': 1}}",CVE-2021-42567,8985,2025-12-02 12:58:40.115185
WAGO,WAGO products (multiple),True,True,1,1.0,2,65,42,"{'01/12/2025': {'connections': 1, 'uniq_ips': 1}, '02/12/2025': {'connections': 1, 'uniq_ips': 1}}",CVE-2023-1698,15425,2025-12-01 12:57:36.220896
Dahua,Dahua (multiple products),True,True,1,1.0,2,53,35,"{'02/12/2025': {'connections': 1, 'uniq_ips': 1}}",CVE-2021-33044,15892,2025-12-02 12:58:40.237108
QNAP,QTS and QuTS Hero,True,False,1,,1,1,1,,CVE-2023-39296,1,2024-03-25 12:01:19.197225
Wordpress,"Wordpress Poll, Survey, Questionnaire and Voting system plugin",True,True,1,1.0,2,57,41,"{'02/12/2025': {'connections': 1, 'uniq_ips': 1}}",CVE-2021-24442,4153,2025-12-02 12:58:40.227322
Lucee,Lucee Server,True,True,1,1.0,14,101,120,"{'02/12/2025': {'connections': 1, 'uniq_ips': 1}}",CVE-2021-21307,54135,2025-12-02 12:58:40.117700
RudderStack,Rudder Server,True,True,1,1.0,2,20,22,"{'29/11/2025': {'connections': 1, 'uniq_ips': 1}, '30/11/2025': {'connections': 1, 'uniq_ips': 1}, '01/12/2025': {'connections': 1, 'uniq_ips': 1}, '02/12/2025': {'connections': 1, 'uniq_ips': 1}}",CVE-2023-30625,8201,2025-11-29 12:51:06.080301
ABUS,ABUS TVIP 20000-21150,True,True,1,1.0,1,1,1,{},CVE-2023-26609,3,2025-02-15 12:39:22.937327
D-Link/TRENDnet,D-Link/TRENDnet multiple devices,True,True,1,1.0,1,1,1,"{'24/09/2024': {'connections': 1, 'uniq_ips': 1}, '27/11/2024': {'connections': 1, 'uniq_ips': 1}, '28/11/2024': {'connections': 1, 'uniq_ips': 1}, '23/06/2025': {'connections': 1, 'uniq_ips': 1}}",CVE-2015-1187,1,2024-09-24 12:45:04.005089
Elastic,Elasticsearch,True,True,1,1.0,2,39,104,"{'02/12/2025': {'connections': 1, 'uniq_ips': 1}}",CVE-2015-1427,66088,2025-12-02 12:58:40.143474
Apache,ShenYu,True,True,1,1.0,3,43,38,"{'02/12/2025': {'connections': 1, 'uniq_ips': 1}}",CVE-2021-37580,16723,2025-12-02 12:58:40.133271
NETGEAR/NUUO,"NETGEAR ReadyNAS Surveillance, NUUO NVRmini, NUUO NVRsolo",True,True,1,1.0,2,133,105,"{'02/12/2025': {'connections': 1, 'uniq_ips': 1}}",CVE-2016-5674,102577,2025-12-02 12:58:40.151415
Apache,ActiveMQ,True,True,1,1.0,17,70,65,"{'02/12/2025': {'connections': 1, 'uniq_ips': 1}}",CVE-2016-3088,68080,2025-12-02 12:58:40.191691
Western Digital,MyCloud NAS,True,True,1,1.0,2,62,51,"{'02/12/2025': {'connections': 1, 'uniq_ips': 1}}",CVE-2016-10108,34974,2025-12-02 12:58:40.152046
Wordpress,Wordpress Ditty plugin,True,True,1,1.0,54,22,22,"{'27/11/2025': {'connections': 1, 'uniq_ips': 1}}",CVE-2025-8085,108,2025-11-27 12:56:01.561917
Aviatrix,Aviatrix Controller,True,True,1,1.0,2,67,92,"{'02/12/2025': {'connections': 1, 'uniq_ips': 1}}",CVE-2021-40870,22079,2025-12-02 12:58:40.176629
Stirling Tools,Stirling-PDF,True,True,1,1.0,56,54,33,"{'27/11/2025': {'connections': 1, 'uniq_ips': 1}}",CVE-2025-55161,801,2025-11-27 12:56:01.556891
FlowiseAI,Flowise,True,True,1,1.0,50,34,34,"{'27/11/2025': {'connections': 1, 'uniq_ips': 1}}",CVE-2025-55346,101,2025-11-27 12:56:01.673328
JSONPath-Plus,JSONPath-plus,True,True,1,1.0,1,21,21,"{'01/12/2025': {'connections': 1, 'uniq_ips': 1}}",CVE-2025-1302,104,2025-12-01 12:57:36.153862
Adobe,Adobe Commerce (Magento),True,True,1,1.0,56,23,19,"{'27/11/2025': {'connections': 1, 'uniq_ips': 1}}",CVE-2025-54236,112,2025-11-27 12:56:01.622286
Cisco,Cisco Prime Infrastructure (PI) and Cisco Evolved Programmable Network (EPN),True,True,1,1.0,2,78,63,"{'02/12/2025': {'connections': 1, 'uniq_ips': 1}}",CVE-2019-1821,45025,2025-12-02 12:58:40.144386
Progress,Kemp LoadMaster,True,True,1,1.0,1,64,30,"{'05/12/2025': {'connections': 1, 'uniq_ips': 1}}",CVE-2024-1212,16223,2025-12-05 12:56:12.941515
Wordpress,Wordpress ARPrice Lite plugin,True,True,1,1.0,51,61,42,"{'26/11/2025': {'connections': 1, 'uniq_ips': 1}, '27/11/2025': {'connections': 1, 'uniq_ips': 1}, '28/11/2025': {'connections': 1, 'uniq_ips': 1}, '29/11/2025': {'connections': 1, 'uniq_ips': 1}, '30/11/2025': {'connections': 1, 'uniq_ips': 1}, '01/12/2025': {'connections': 1, 'uniq_ips': 1}, '02/12/2025': {'connections': 1, 'uniq_ips': 1}}",CVE-2022-0867,13468,2025-11-26 12:57:21.238748
Mirko Ber Software Development,SuperWebMailer,True,True,1,1.0,13,69,53,"{'02/12/2025': {'connections': 1, 'uniq_ips': 1}}",CVE-2020-11546,35696,2025-12-02 12:58:40.151108
Ruckus,Ruckus vRioT,True,True,1,1.0,2,60,49,"{'02/12/2025': {'connections': 1, 'uniq_ips': 1}}",CVE-2020-26879,3220,2025-12-02 12:58:40.123733
Cisco,Cisco ASA and Cisco Firepower Threat Defense,True,True,1,1.0,1,995,352,"{'02/12/2025': {'connections': 1, 'uniq_ips': 1}}",CVE-2020-3580,44573,2025-12-02 12:58:40.140828
Apache,Cocoon,True,True,1,1.0,14,36,37,"{'02/12/2025': {'connections': 1, 'uniq_ips': 1}}",CVE-2020-11991,30665,2025-12-02 12:58:40.135763
CSE Bookstore,CSE Bookstore,True,True,1,1.0,2,47,46,"{'02/12/2025': {'connections': 1, 'uniq_ips': 1}}",CVE-2020-36112,33401,2025-12-02 12:58:40.187909
PHPGurukul,Hospital Management System,True,True,1,1.0,2,51,34,"{'01/12/2025': {'connections': 1, 'uniq_ips': 1}, '02/12/2025': {'connections': 1, 'uniq_ips': 1}}",CVE-2020-22165,12120,2025-12-01 12:57:36.241630
Seowon Intech,"Seowon SLC-130, SLR-120S",True,True,1,1.0,16,79,65,"{'02/12/2025': {'connections': 1, 'uniq_ips': 1}}",CVE-2020-17456,51422,2025-12-02 12:58:40.184652
Roundcube,Roundcube Webmail,True,True,1,1.0,2,88,67,"{'02/12/2025': {'connections': 1, 'uniq_ips': 1}}",CVE-2020-12641,5572,2025-12-02 12:58:40.202637
WSO2,"WSO2 API Manager, API Microgateway",True,True,1,1.0,2,53,55,"{'02/12/2025': {'connections': 1, 'uniq_ips': 1}}",CVE-2020-24589,36931,2025-12-02 12:58:40.128820
Oracle,Oracle Weblogic Server,True,True,1,1.0,1,5,6,"{'20/11/2025': {'connections': 1, 'uniq_ips': 1}, '21/11/2025': {'connections': 1, 'uniq_ips': 1}, '22/11/2025': {'connections': 1, 'uniq_ips': 1}}",CVE-2020-14883,2268,2025-11-20 12:54:11.905393
Wordpress,Wordpress Chop Slider plugin,True,True,1,1.0,2,53,46,"{'02/12/2025': {'connections': 1, 'uniq_ips': 1}}",CVE-2020-11530,30931,2025-12-02 12:58:40.138749
HPE,HPE Smart Update Manager (SUM),True,True,1,1.0,2,50,52,"{'02/12/2025': {'connections': 1, 'uniq_ips': 1}}",CVE-2020-7136,2783,2025-12-02 12:58:40.242588
Citrix,"Citrix ADC, Citrix Gateway, Citrix SDWAN WAN-OP",True,True,1,1.0,7,424,431,"{'05/12/2025': {'connections': 1, 'uniq_ips': 1}}",CVE-2020-8191,87032,2025-12-05 12:56:12.796340
Magento,Magento Mass Import (MAGMI) plugin,True,True,1,1.0,2,32,43,"{'02/12/2025': {'connections': 1, 'uniq_ips': 1}}",CVE-2020-5776,49898,2025-12-02 12:58:40.097531
Citrix,"Citrix ADC, Citrix Gateway, Citrix SDWAN WAN-OP",True,True,1,1.0,7,648,285,"{'05/12/2025': {'connections': 1, 'uniq_ips': 1}}",CVE-2020-8193,463048,2025-12-05 12:56:12.828829
Apache,Flink,True,True,1,1.0,2,42,51,"{'02/12/2025': {'connections': 1, 'uniq_ips': 1}}",CVE-2020-17518,46473,2025-12-02 12:58:40.087809
Netsweeper,Netsweeper,True,True,1,1.0,14,77,59,"{'02/12/2025': {'connections': 1, 'uniq_ips': 1}}",CVE-2020-13167,45553,2025-12-02 12:58:40.115637
Wordpress,Wordpress Adning Advertising plugin,True,True,1,1.0,1,86,86,"{'02/12/2025': {'connections': 1, 'uniq_ips': 1}}",CVE-2020-36728,259,2025-12-02 12:58:40.218960
Apache,Airflow,True,True,1,1.0,3,40,48,"{'02/12/2025': {'connections': 1, 'uniq_ips': 1}}",CVE-2020-11978,61545,2025-12-02 12:58:40.200748
Cockpit,Cockpit,True,True,1,1.0,3,206,145,"{'02/12/2025': {'connections': 1, 'uniq_ips': 1}}",CVE-2020-35131,121705,2025-12-02 12:58:40.101517
IncomCMS,IncomCMS,True,True,1,1.0,16,64,61,"{'02/12/2025': {'connections': 1, 'uniq_ips': 1}}",CVE-2020-29597,48969,2025-12-02 12:58:40.107559
Linksys,RE6500 Series,True,True,1,1.0,2,67,59,"{'02/12/2025': {'connections': 1, 'uniq_ips': 1}}",CVE-2020-35713,37053,2025-12-02 12:58:40.242916
Juniper,Junos OS (J-Web),True,True,1,1.0,27,22,23,"{'26/11/2025': {'connections': 1, 'uniq_ips': 1}}",CVE-2022-22242,7838,2025-11-26 12:57:21.233887
Roxy-WI,Roxy-WI,True,True,1,1.0,21,76,46,"{'01/12/2025': {'connections': 1, 'uniq_ips': 1}, '02/12/2025': {'connections': 1, 'uniq_ips': 1}}",CVE-2022-31137,3098,2025-12-01 12:57:36.312631
Wordpress,Wordpress BackupBuddy plugin,True,True,1,1.0,1,11,7,"{'26/11/2025': {'connections': 1, 'uniq_ips': 1}}",CVE-2022-31474,217,2025-11-26 12:57:21.279132
Sophos,Sophos Mobile,True,True,1,1.0,2,57,41,"{'29/11/2025': {'connections': 1, 'uniq_ips': 1}, '30/11/2025': {'connections': 1, 'uniq_ips': 1}, '01/12/2025': {'connections': 1, 'uniq_ips': 1}, '02/12/2025': {'connections': 1, 'uniq_ips': 1}}",CVE-2022-3980,12835,2025-11-29 12:51:05.984308
Razer,Razer Sila,True,True,1,1.0,1,10,7,"{'26/11/2025': {'connections': 1, 'uniq_ips': 1}}",CVE-2022-29013,176,2025-11-26 12:57:21.211985
Wordpress,Wordpress VR Calendar plugin,True,True,1,1.0,16,85,103,"{'02/12/2025': {'connections': 1, 'uniq_ips': 1}}",CVE-2022-2314,21723,2025-12-02 12:58:40.187145
IBAX,go-ibax,True,True,1,1.0,2,33,30,"{'29/11/2025': {'connections': 1, 'uniq_ips': 1}, '30/11/2025': {'connections': 1, 'uniq_ips': 1}, '01/12/2025': {'connections': 1, 'uniq_ips': 1}, '02/12/2025': {'connections': 1, 'uniq_ips': 1}}",CVE-2022-3801,9909,2025-11-29 12:51:05.978619
Wordpress,Wordpress MapSVG plugin,True,True,1,1.0,46,64,36,"{'26/11/2025': {'connections': 1, 'uniq_ips': 1}, '28/11/2025': {'connections': 1, 'uniq_ips': 1}, '29/11/2025': {'connections': 1, 'uniq_ips': 1}, '01/12/2025': {'connections': 1, 'uniq_ips': 1}, '02/12/2025': {'connections': 1, 'uniq_ips': 1}}",CVE-2022-0592,3710,2025-11-26 12:57:21.231591
WSO2,WSO2 Management Console,True,True,1,1.0,1,34,24,"{'05/12/2025': {'connections': 1, 'uniq_ips': 1}}",CVE-2020-17453,7495,2025-12-05 12:56:12.843961
IBM,Maximo Asset Management,True,True,1,1.0,2,48,65,"{'02/12/2025': {'connections': 1, 'uniq_ips': 1}}",CVE-2020-4463,89835,2025-12-02 12:58:40.233369
PrestaShop,PrestaShop ApolloTheme AP PageBuilder module,True,True,1,1.0,2,179,113,"{'02/12/2025': {'connections': 1, 'uniq_ips': 1}}",CVE-2022-22897,129111,2025-12-02 12:58:40.178216
Artica,Artica Web Proxy,True,True,1,1.0,16,41,53,"{'02/12/2025': {'connections': 1, 'uniq_ips': 1}}",CVE-2020-17505,50421,2025-12-02 12:58:40.150793
JetBrains,TeamCity,True,True,1,1.0,1,626,470,"{'05/12/2025': {'connections': 1, 'uniq_ips': 1}}",CVE-2024-27199,101388,2025-12-05 12:56:12.890940
JetBrains,TeamCity,True,True,1,1.0,1,365,322,"{'05/12/2025': {'connections': 1, 'uniq_ips': 1}}",CVE-2024-27198,610900,2025-12-05 12:56:12.937033
Wordpress,Wordpress Time Clock plugin and Time Clock Pro plugin,True,True,1,1.0,1,1,1,"{'09/09/2025': {'connections': 1, 'uniq_ips': 1}, '10/09/2025': {'connections': 1, 'uniq_ips': 1}}",CVE-2024-9593,1,2025-09-09 12:53:41.609131
Check Point,Check Point Security Gateway,True,True,1,1.0,2229,2352,1925,"{'05/12/2025': {'connections': 1, 'uniq_ips': 1}}",CVE-2024-24919,623441,2025-12-05 12:56:12.822939
HuangDou,HuangDou UTCMS,True,True,1,1.0,1,1,1,"{'19/02/2025': {'connections': 1, 'uniq_ips': 1}}",CVE-2024-9916,1,2025-02-19 12:41:53.439110
Fujian Apex Software,LiveBOS,True,True,1,1.0,1,1,1,"{'23/10/2025': {'connections': 1, 'uniq_ips': 1}}",CVE-2024-13981,1,2025-10-23 12:57:18.654171
Progress,Telerik Report Server,True,True,1,1.0,2,71,34,"{'05/12/2025': {'connections': 1, 'uniq_ips': 1}}",CVE-2024-4358,13654,2025-12-05 12:56:12.904987
WyreStorm,WyreStorm Apollo VX20,True,True,1,1.0,6,13,16,"{'26/11/2025': {'connections': 1, 'uniq_ips': 1}}",CVE-2024-25735,17216,2025-11-26 12:57:21.272486
Wordpress,Wordpress Hunk Companion plugin,True,True,1,1.0,1,25,25,"{'30/11/2025': {'connections': 1, 'uniq_ips': 1}}",CVE-2024-9707,172,2025-11-30 12:50:46.620721
Palo Alto Networks,Palo Alto Networks Expedition,True,True,1,1.0,1,1,1,"{'04/04/2025': {'connections': 1, 'uniq_ips': 1}}",CVE-2024-5910,13,2025-04-04 12:48:48.532340
Cisco,Cisco Smart Licensing Utility,True,True,1,1.0,1,30,30,"{'30/11/2025': {'connections': 1, 'uniq_ips': 1}}",CVE-2024-20440,152,2025-11-30 12:50:46.635684
Rebuild,Rebuild,True,True,1,1.0,8,8,8,"{'11/11/2025': {'connections': 1, 'uniq_ips': 1}}",CVE-2024-1021,425,2025-11-11 12:54:39.710598
Homebrew Computer Company,Jan,True,True,1,1.0,21,28,23,"{'27/11/2025': {'connections': 1, 'uniq_ips': 1}, '29/11/2025': {'connections': 1, 'uniq_ips': 1}, '30/11/2025': {'connections': 1, 'uniq_ips': 1}}",CVE-2024-36858,7930,2025-11-27 12:56:01.612559
Thruk,Thruk,True,True,1,1.0,15,27,22,"{'27/11/2025': {'connections': 1, 'uniq_ips': 1}, '29/11/2025': {'connections': 1, 'uniq_ips': 1}, '30/11/2025': {'connections': 1, 'uniq_ips': 1}}",CVE-2022-23961,15419,2025-11-27 12:56:01.573829
jQueryFileTree,jQueryFileTree,True,True,1,1.0,2,32,48,"{'02/12/2025': {'connections': 1, 'uniq_ips': 1}}",CVE-2017-1000170,30758,2025-12-02 12:58:40.184042
Spring,Spring Data REST,True,True,1,1.0,1,1,3,"{'04/12/2025': {'connections': 1, 'uniq_ips': 1}}",CVE-2017-8046,56,2025-12-04 12:59:17.568225
PrimeFaces,PrimeTek,True,True,1,1.0,16,72,58,"{'02/12/2025': {'connections': 1, 'uniq_ips': 1}}",CVE-2017-1000486,46745,2025-12-02 12:58:40.195178
phpCollab,phpCollab,True,True,1,1.0,14,47,53,"{'02/12/2025': {'connections': 1, 'uniq_ips': 1}}",CVE-2017-6090,51131,2025-12-02 12:58:40.094102
Symantec,Symantec Web Gateway 5.0.2.8,True,True,1,1.0,1,1,1,"{'01/09/2025': {'connections': 1, 'uniq_ips': 1}, '04/09/2025': {'connections': 1, 'uniq_ips': 1}, '05/09/2025': {'connections': 1, 'uniq_ips': 1}, '09/09/2025': {'connections': 1, 'uniq_ips': 1}, '10/09/2025': {'connections': 1, 'uniq_ips': 1}, '11/09/2025': {'connections': 1, 'uniq_ips': 1}, '07/11/2025': {'connections': 1, 'uniq_ips': 1}, '08/11/2025': {'connections': 1, 'uniq_ips': 1}, '17/11/2025': {'connections': 1, 'uniq_ips': 1}}",CVE-2012-0297,10,2025-09-01 12:53:18.090574
Wordpress,Wordpress Gift Voucher plugin,True,True,1,1.0,2,52,46,"{'02/12/2025': {'connections': 1, 'uniq_ips': 1}}",CVE-2018-16159,33548,2025-12-02 12:58:40.124368
Spring,Spring Data Commons,True,True,1,1.0,16,95,66,"{'02/12/2025': {'connections': 1, 'uniq_ips': 1}}",CVE-2018-1273,77049,2025-12-02 12:58:40.098885
Ruby on Rails,Sprockets,True,True,1,1.0,2,34,47,"{'02/12/2025': {'connections': 1, 'uniq_ips': 1}}",CVE-2018-3760,36726,2025-12-02 12:58:40.085153
Apache,Tika,True,True,1,1.0,3,31,40,"{'02/12/2025': {'connections': 1, 'uniq_ips': 1}}",CVE-2018-1335,39610,2025-12-02 12:58:40.125143
PrestaShop,Attribute Wizard addon for PrestaShop,True,True,1,1.0,2,64,56,"{'02/12/2025': {'connections': 1, 'uniq_ips': 1}}",CVE-2018-10942,42149,2025-12-02 12:58:40.138587
Seagate,Seagate NAS OS,True,True,1,1.0,2,33,38,"{'02/12/2025': {'connections': 1, 'uniq_ips': 1}}",CVE-2018-12296,43359,2025-12-02 12:58:40.194155
FlexPaper (Flowpaper),FlexPaper (Flowpaper),True,True,1,1.0,17,117,78,"{'02/12/2025': {'connections': 1, 'uniq_ips': 1}}",CVE-2018-11686,14747,2025-12-02 12:58:40.172757
VMware,VMware NSX SD-WAN Edge,True,True,1,1.0,1,1,1,"{'29/08/2025': {'connections': 1, 'uniq_ips': 1}, '03/09/2025': {'connections': 1, 'uniq_ips': 1}, '04/09/2025': {'connections': 1, 'uniq_ips': 1}}",CVE-2018-6961,1,2025-08-29 12:50:43.383748
SAP,NetWeaver AS JAVA (LM Configuration Wizard),True,True,1,1.0,2,53,39,"{'02/12/2025': {'connections': 1, 'uniq_ips': 1}}",CVE-2020-6287,34841,2025-12-02 12:58:40.227179
Artica,Artica Web Proxy,True,True,1,1.0,16,42,58,"{'02/12/2025': {'connections': 1, 'uniq_ips': 1}}",CVE-2020-17506,54492,2025-12-02 12:58:40.140390
Wordpress,"Wordpress Free Booking Plugin for Hotels, Restaurant and Car Rental (eaSYNC)",True,True,1,1.0,15,67,49,"{'02/12/2025': {'connections': 1, 'uniq_ips': 1}}",CVE-2022-1952,15620,2025-12-02 12:58:40.098001
Tenda,Tenda AC1200 V-W15Ev2,True,True,1,1.0,1,65,38,"{'02/12/2025': {'connections': 1, 'uniq_ips': 1}}",CVE-2022-40843,1551,2025-12-02 12:58:40.179169
Wordpress,Wordpress Core,True,True,1,1.0,1,1,1,"{'20/08/2025': {'connections': 1, 'uniq_ips': 1}, '22/10/2025': {'connections': 1, 'uniq_ips': 1}, '23/10/2025': {'connections': 1, 'uniq_ips': 1}}",CVE-2022-21661,117,2025-08-20 12:53:31.109648
Dogtag,Dogtag - Certificate System,True,True,1,1.0,44,47,31,"{'26/11/2025': {'connections': 1, 'uniq_ips': 1}, '28/11/2025': {'connections': 1, 'uniq_ips': 1}, '29/11/2025': {'connections': 1, 'uniq_ips': 1}, '01/12/2025': {'connections': 1, 'uniq_ips': 1}, '02/12/2025': {'connections': 1, 'uniq_ips': 1}}",CVE-2022-2414,10497,2025-11-26 12:57:21.244456
Wordpress,Wordpress PhonePe Payment Solutions plugin,True,True,1,1.0,2,128,104,"{'29/11/2025': {'connections': 1, 'uniq_ips': 1}, '30/11/2025': {'connections': 1, 'uniq_ips': 1}, '01/12/2025': {'connections': 1, 'uniq_ips': 1}, '02/12/2025': {'connections': 1, 'uniq_ips': 1}}",CVE-2022-45835,31924,2025-11-29 12:51:06.036743
Arris,"Arris NVG443, NVG599, NVG589, NVG510 devices and Arris-derived BGW210, BGW320 devices",True,True,1,1.0,1,9,6,"{'26/11/2025': {'connections': 1, 'uniq_ips': 1}}",CVE-2022-31793,2737,2025-11-26 12:57:21.260117
SAP,"NetWeaver Application Server ABAP, SAP NetWeaver Application Server Java, ABAP Platform, SAP Content Server 7.53 and SAP Web Dispatcher",True,True,1,1.0,1,13,7,"{'02/12/2025': {'connections': 1, 'uniq_ips': 1}}",CVE-2022-22536,514,2025-12-02 12:58:40.169064
RaspAP,RaspAP,True,True,1,1.0,30,65,42,"{'01/12/2025': {'connections': 1, 'uniq_ips': 1}, '02/12/2025': {'connections': 1, 'uniq_ips': 1}}",CVE-2022-39986,15837,2025-12-01 12:57:36.251723
Wordpress,Wordpress Booking Calendar plugin,True,True,1,1.0,1,38,38,"{'23/10/2025': {'connections': 1, 'uniq_ips': 1}}",CVE-2022-3982,141,2025-10-23 12:57:18.477593
Wordpress,Wordpress Simple Link Directory plugin,True,True,1,1.0,38,64,41,"{'26/11/2025': {'connections': 1, 'uniq_ips': 1}, '28/11/2025': {'connections': 1, 'uniq_ips': 1}, '29/11/2025': {'connections': 1, 'uniq_ips': 1}, '01/12/2025': {'connections': 1, 'uniq_ips': 1}, '02/12/2025': {'connections': 1, 'uniq_ips': 1}}",CVE-2022-0760,14682,2025-11-26 12:57:21.136754
Wordpress,Wordpress Visual Form Builder plugin,True,True,1,1.0,1,1,1,"{'02/12/2025': {'connections': 1, 'uniq_ips': 1}}",CVE-2022-0142,1,2025-12-02 12:58:40.130146
Wordpress,Wordpress KiviCare plugin,True,True,1,1.0,46,60,41,"{'26/11/2025': {'connections': 1, 'uniq_ips': 1}, '01/12/2025': {'connections': 1, 'uniq_ips': 1}, '02/12/2025': {'connections': 1, 'uniq_ips': 1}}",CVE-2022-0786,14739,2025-11-26 12:57:21.249918
Wordpress,Wordpress Fontsy plugin,True,True,1,1.0,2,48,38,"{'01/12/2025': {'connections': 1, 'uniq_ips': 1}, '02/12/2025': {'connections': 1, 'uniq_ips': 1}}",CVE-2022-4447,11848,2025-12-01 12:57:36.290184
WAVLINK,WAVLINK WN535K2 and WN535K3,True,True,1,1.0,534,472,184,"{'26/11/2025': {'connections': 1, 'uniq_ips': 1}, '01/12/2025': {'connections': 1, 'uniq_ips': 1}, '02/12/2025': {'connections': 1, 'uniq_ips': 1}}",CVE-2022-2486,54473,2025-11-26 12:57:21.193420
Wordpress,Wordpress Narnoo Distributor plugin,True,True,1,1.0,24,71,105,"{'29/11/2025': {'connections': 1, 'uniq_ips': 1}, '01/12/2025': {'connections': 1, 'uniq_ips': 1}, '02/12/2025': {'connections': 1, 'uniq_ips': 1}}",CVE-2022-0679,18458,2025-11-29 12:51:05.988788
UniSharp,Laravel Filemanager,True,True,1,1.0,1,10,10,"{'26/11/2025': {'connections': 1, 'uniq_ips': 1}}",CVE-2022-40734,137,2025-11-26 12:57:21.291490
Zoho,ManageEngine (multiple products),True,True,1,1.0,19,78,38,"{'02/12/2025': {'connections': 1, 'uniq_ips': 1}}",CVE-2022-47966,13523,2025-12-02 12:58:40.125296
Cellinx,Cellinx NVT Camera,True,True,0,0.0,0,0,84,{},CVE-2023-23063,401,2025-09-07 12:44:00.550528
Fujitsu,"Fujitsu Real-time Video Transmission Gear \""IP series\""",True,True,0,0.0,51,43,27,{},CVE-2023-38433,1235,2025-11-26 12:57:21.166559
Palo Alto Networks,Palo Alto Networks Expedition,True,True,0,0.0,2,32,22,{},CVE-2024-9465,7485,2025-12-04 12:59:17.591408
Wordpress,Wordpress News & Blog Designer Pack plugin,True,True,0,0.0,130,94,58,{},CVE-2023-5815,1594,2025-11-23 12:47:09.197135
Parsec Automation,TrackSYS,True,True,0,0.0,105,24,18,{},CVE-2024-6188,5128,2025-11-26 12:57:21.226043
Hot-World GmbH,Repetier Server,True,True,0,0.0,1,18,19,{},CVE-2023-31059,2514,2025-12-02 12:58:40.187462
Adobe,Adobe Commerce and Magento Open Source,True,True,0,0.0,0,0,7,{},CVE-2024-34102,60,2025-10-20 02:05:45.047798
Ollama,Ollama,True,True,0,0.0,2,119,53,{},CVE-2024-37032,19424,2025-12-01 12:57:36.189186
Progress,WhatsUp Gold,True,True,0,0.0,46,74,30,{},CVE-2024-6670,4083,2025-11-28 12:54:30.407062
CrushFTP,CrushFTP,True,True,0,0.0,18,165,130,{},CVE-2024-4040,16562,2025-11-25 12:56:15.493667
GeoVision,GeoVision multiple EOL products,True,True,0,0.0,431,431,153,{},CVE-2024-11120,1779,2025-10-21 12:56:32.009325
Intelbras,Intelbras Switch SG 2404 MR,True,True,0,0.0,20,27,21,{},CVE-2023-36144,1496,2025-11-26 12:57:21.276994
Netis,Netis routers multiple models,True,True,0,0.0,2,154,103,{},CVE-2024-48455,13680,2025-12-05 12:56:12.776161
IBM,IBM Operational Decision Manager,True,True,0,0.0,39,18,14,{},CVE-2024-22320,6387,2025-11-07 12:53:37.064938
Totolink,Totolink N200RE,True,True,0,0.0,0,0,200,{},CVE-2024-0297,585,2025-10-12 12:45:43.455852
Totolink,Totolink LR1200GB,True,True,0,0.0,0,0,102,{},CVE-2024-0292,297,2025-10-12 12:45:43.469889
Zyxel,nan,True,True,0,0.0,412,244,638,{},CVE-2023-28771,423841,2025-12-04 12:59:17.574281
ZoneMinder,ZoneMinder,True,True,0,0.0,64,62,34,{},CVE-2024-43360,2498,2025-11-25 12:56:15.361815
Viessmann,Vitogate 300 BN/MB,True,True,0,0.0,2,56,35,{},CVE-2023-5222,10644,2025-12-01 12:57:36.169368
D-Link,D-Link DAR-7000 and DAR-8000,True,True,0,0.0,144,75,42,{},CVE-2023-5148,9876,2025-11-23 12:47:09.152785
Advantech,R-SeeNet,True,True,0,0.0,116,47,24,{},CVE-2021-21805,5415,2025-11-23 12:47:09.055201
Ruijie,Ruijie RG-EW1200G,True,True,0,0.0,2,32,29,{},CVE-2023-4169,8534,2025-12-01 12:57:36.235675
Citrix,Citrix NetScaler ADC and NetScaler Gateway,True,True,0,0.0,0,0,353,{},CVE-2023-6549,3861,2025-10-01 12:55:46.317996
CyberPanel,CyberPanel,True,True,0,0.0,65,37,21,{},CVE-2024-51567,4372,2025-09-01 12:53:18.138049
VMware,Aria Operations for Networks,True,True,0,0.0,91,86,47,{},CVE-2023-20887,17974,2025-11-24 12:57:02.437185
ABB,"ABB ASPECT-Enterprise on Linux, ABB NEXUS Series on Linux, ABB MATRIX Series on Linux",True,True,0,0.0,0,0,43,{},CVE-2024-6298,95,2025-05-04 12:46:29.885961
TVT/Provision-ISR,Multiple DVR models,True,True,0,0.0,171,151,111,{},CVE-2024-7339,12414,2025-11-23 12:47:09.158493
Citrix,Citrix Virtual Apps and Desktops,True,True,0,0.0,0,0,3,{},CVE-2024-8069,4618,2025-08-23 12:48:09.360640
Journeyx,Journeyx,True,True,0,0.0,2,32,23,{},CVE-2024-6893,5611,2025-12-02 12:58:40.238834
AimStack,Aim,True,True,0,0.0,33,110,50,{},CVE-2024-6396,15801,2025-12-02 12:58:40.139423
CyberPanel,CyberPanel,True,True,0,0.0,32,23,22,{},CVE-2024-32738,2262,2025-11-25 12:56:15.476223
Ivanti,Ivanti EPM,True,True,0,0.0,1,51,30,{},CVE-2024-13160,8964,2025-12-02 12:58:40.229169
Ericsson,CodeChecker,True,True,0,0.0,1,54,31,{},CVE-2024-10081,10014,2025-12-01 12:57:36.247709
Control iD,Control iD iDSecure,True,True,0,0.0,2,24,24,{},CVE-2023-6329,276,2025-12-04 12:59:17.434180
QNAP,QNAP QTS and QuTS Hero,True,True,0,0.0,1,35,87,{},CVE-2023-47218,29609,2025-12-04 12:59:17.467846
Terramaster,TOS,True,True,0,0.0,14,205,195,{},CVE-2022-24990,20087,2025-12-05 12:56:12.786509
Cleo,"Cleo Harmony, VLTrader and LexiCom",True,True,0,0.0,0,0,29,{},CVE-2024-50623,495,2025-11-01 12:48:51.554462
pyLoad,pyLoad,True,True,0,0.0,0,1,39,{},CVE-2023-0297,876,2025-11-18 12:55:38.631576
Appwrite,Appwrite,True,True,0,0.0,28,12,26,{},CVE-2023-27159,14671,2025-11-26 12:57:21.228152
Wordpress,Wordpress PayPlus Payment Gateway plugin,True,True,0,0.0,47,64,36,{},CVE-2024-6205,5904,2025-11-28 12:54:30.333411
CloudPanel,CloudPanel,True,True,0,0.0,2,71,49,{},CVE-2023-35885,20504,2025-12-05 12:56:12.910696
Ignite Realtime,Openfire,True,True,0,0.0,0,0,396,{},CVE-2023-32315,2414,2025-09-04 12:48:59.716304
Zyxel,Zyxel DX5401-B0,True,True,0,0.0,23,35,26,{},CVE-2023-28770,5740,2025-11-26 12:57:21.218946
Totolink,Totolink X18,True,True,0,0.0,227,116,80,{},CVE-2024-2353,1947,2025-11-21 12:53:31.616158
NetAlertX,NetAlertX,True,True,0,0.0,2,66,37,{},CVE-2024-48766,3507,2025-12-01 12:57:36.265614
Wordpress,Wordpress EventON plugin,True,True,0,0.0,11,18,19,{},CVE-2023-2796,5251,2025-11-26 12:57:21.258930
D-Link,"D-Link DNS-320L, DNS-325, DNS-327L and DNS-340L",True,True,0,0.0,10,15,13,{},CVE-2024-3273,20575,2025-11-24 12:57:02.274012
Adones Pitogo,angular-base64-upload,True,True,0,0.0,19,117,51,{},CVE-2024-42640,14346,2025-12-04 12:59:17.447582
FileMage,FileMage Gateway,True,True,0,0.0,35,28,22,{},CVE-2023-39026,4684,2025-11-25 12:56:15.502429
Apache,OFBiz,True,True,0,0.0,1,1,1,{},CVE-2024-32113,2981,2025-04-15 12:50:19.614429
Wordpress,Wordpress NotificationX plugin,True,True,0,0.0,1,63,41,{},CVE-2024-1698,10309,2025-12-01 12:57:36.157953
Wordpress,Wordpress Advanced Booking Calendar plugin,True,True,0,0.0,14,50,40,{},CVE-2022-1006,1079,2025-11-23 12:47:09.198238
APsystems,Altenergy Power Control Software,True,True,0,0.0,104,24,23,{},CVE-2024-11305,11587,2025-11-25 12:56:15.530523
David Strutz,bootstrap-multiselect,True,True,0,0.0,76,39,23,{},CVE-2025-47204,546,2025-11-26 12:57:21.260735
Invision Power Services,Invision Community,True,True,0,0.0,84,118,109,{},CVE-2025-47916,6003,2025-12-01 12:57:36.224993
becon,DATAGERRY,True,True,0,0.0,10,13,16,{},CVE-2024-50967,990,2025-11-26 12:57:21.307158
Wordpress,Wordpress Kubio AI Page Builder plugin,True,True,0,0.0,1,94,40,{},CVE-2025-2294,2855,2025-12-01 12:57:36.203261
Gladinet,Gladinet CentreStack & Triofox,True,True,0,0.0,2,1,1,{},CVE-2025-12480,3,2025-12-04 12:59:17.537016
Totolink,Totolink A950RG,True,True,0,0.0,0,0,106,{},CVE-2025-28036,303,2025-10-12 12:45:43.494336
Cisco,Cisco ISE and ISE-PIC,True,True,0,0.0,1,25,104,{},CVE-2025-20281,1595,2025-10-27 12:56:36.381506
pgAdmin,pgAdmin 4,True,True,0,0.0,46,84,49,{},CVE-2024-9014,14463,2025-11-28 12:54:30.360583
FlowiseAI,Flowise,True,True,0,0.0,1,37,23,{},CVE-2024-8181,10747,2025-11-29 12:51:05.979278
White Star Software,White Star Software Potop,True,True,0,0.0,87,60,28,{},CVE-2025-44177,1081,2025-11-25 12:56:15.436220
WSO2,"WSO2 API Manager, WSO2 Identity Server, WSO2 Identity Server as Key Manager",True,True,0,0.0,120,33,26,{},CVE-2024-7097,7730,2025-11-25 12:56:15.398170
Adobe,Adobe Experience Manager,True,True,0,0.0,0,0,6,{},CVE-2025-54254,42,2025-11-26 12:57:21.312431
SysAid,SysAid On-Premise,True,True,0,0.0,26,47,20,{},CVE-2025-2775,2176,2025-11-23 12:47:09.173895
Cacti,Cacti,True,True,0,0.0,766,153,66,{},CVE-2024-29895,13788,2025-11-21 12:53:31.584446
Wordpress,Wordpress Likes and Dislikes plugin,True,True,0,0.0,77,52,32,{},CVE-2025-5287,1025,2025-11-25 12:56:15.508676
Commvault,Commvault Command Center,True,True,0,0.0,82,71,52,{},CVE-2025-34028,3326,2025-12-01 12:57:36.317784
Atlassian,Confluence,True,True,0,0.0,0,19,30,{},CVE-2024-21683,881,2025-10-22 12:56:39.631386
Apache,Tomcat,True,True,0,0.0,3,171,111,{},CVE-2025-24813,8507,2025-12-04 12:59:17.538245
ETQ,ETQ Reliance,True,True,0,0.0,85,117,35,{},CVE-2025-34143,2289,2025-12-02 12:58:40.229637
Grafana,Grafana,True,True,0,0.0,82,198,84,{},CVE-2025-4123,4185,2025-11-28 12:54:30.315139
Palo Alto Networks,Palo Alto Expedition,True,True,0,0.0,1,43,23,{},CVE-2024-9463,5657,2025-12-01 12:57:36.296179
Versa,Versa Concerto,True,True,0,0.0,114,114,36,{},CVE-2025-34027,1857,2025-11-25 12:56:15.528773
Ivanti,Avalanche,True,True,0,0.0,2,29,27,{},CVE-2024-38653,7210,2025-12-02 12:58:40.236608
ServiceNow,"Now Platform (Washington DC, Vancouver, and earlier releases)",True,True,0,0.0,0,2,2,{},CVE-2024-5217,1559,2025-11-06 12:55:51.621121
R-HUB,TurboMeeting,True,True,0,0.0,2,80,46,{},CVE-2024-38289,12885,2025-12-01 12:57:36.161809
Adobe,ColdFusion,True,True,0,0.0,40,44,23,{},CVE-2024-20767,8914,2025-11-26 12:57:21.260342
Citrix,Citrix NetScaler ADC and NetScaler Gateway,True,True,0,0.0,2,2,2,{},CVE-2025-6543,16,2025-10-29 12:58:20.254638
Kaseya,VSA,True,True,0,0.0,34,25,23,{},CVE-2015-2863,6543,2025-11-23 12:47:09.158916
Grafana,Grafana,True,True,0,0.0,108,43,21,{},CVE-2025-3415,443,2025-11-26 12:57:21.256437
"Open Source Matters, Inc/Joomla community",Joomla,False,False,0,,0,6,3,,CVE-2015-8562,0,2024-03-12 10:43:50.926597
Netentsec,NS-ASG Application Security Gateway,True,True,0,0.0,101,24,20,{},CVE-2024-2330,3247,2025-11-25 12:56:15.475773
Aviatrix,Aviatrix Network Controller,True,True,0,0.0,103,61,29,{},CVE-2024-50603,6273,2025-11-25 12:56:15.485498
Progress,WhatsUp Gold,True,True,0,0.0,2,77,36,{},CVE-2024-4885,7647,2025-12-02 12:58:40.099359
TP-Link,TP-Link Archer C20,True,True,0,0.0,78,74,33,{},CVE-2024-57049,3676,2025-11-25 12:56:15.531471
Wordpress,Wordpress WHMpress - WHMCS WordPress Integration Plugin plugin,True,True,0,0.0,2,69,47,{},CVE-2024-9193,1675,2025-12-04 12:59:17.464225
D-Link,DCS-930L,True,True,0,0.0,0,1,1,{},CVE-2016-11021,695,2025-11-20 12:54:11.867372
SimpleHelp,SimpleHelp,True,True,0,0.0,0,0,9,{},CVE-2024-57727,39,2025-05-06 12:52:58.628769
Oracle,Oracle E-Business Suite,True,True,0,0.0,3,59,44,{},CVE-2016-0457,22072,2025-12-04 12:59:17.614086
Apache,OFBiz,True,True,0,0.0,49,61,32,{},CVE-2024-45507,7317,2025-12-02 12:58:40.162841
DataEase,DataEase,True,True,0,0.0,53,25,22,{},CVE-2024-30269,582,2025-11-26 12:57:21.306757
Wordpress,Wordpress WP Query Console plugin,True,True,0,0.0,50,95,48,{},CVE-2024-50498,4033,2025-12-01 12:57:36.210761
Qualitor,Qualitor ITSM,True,True,0,0.0,2,138,58,{},CVE-2024-44849,13377,2025-12-01 12:57:36.334218
Zeroshell,Zeroshell Linux Router,True,True,0,0.0,87,65,30,{},CVE-2009-0545,10706,2025-12-01 12:57:36.182638
i7MEDIA,mojoPortal,True,True,0,0.0,0,14,18,{},CVE-2025-28367,380,2025-11-29 12:51:05.987309
GLPI,GLPI,True,True,0,0.0,32,85,22,{},CVE-2025-24799,1993,2025-11-26 12:57:21.247913
Geoserver,Geoserver,True,True,0,0.0,17,155,144,{},CVE-2025-30220,15030,2025-12-02 12:58:40.179892
VMware,"Workspace ONE Access, Identity Manager and vRealize Automation",True,True,0,0.0,13,18,18,{},CVE-2022-31656,9949,2025-11-21 12:53:31.508997
NAKIVO,NAKIVO Backup & Replication,True,True,0,0.0,2,42,34,{},CVE-2024-48248,5619,2025-12-02 12:58:40.182408
Wazuh,Wazuh,True,True,0,0.0,26,26,260,{},CVE-2025-24016,5364,2025-11-03 12:56:11.379914
Netis,Netis MW5360,True,True,0,0.0,0,0,1297,{},CVE-2024-22729,7617,2024-09-26 12:45:15.493387
Dahua,Dahua EIMS,True,True,0,0.0,1,302,122,{},CVE-2024-13985,2684,2025-12-04 12:59:17.487313
Ivanti,"Ivanti Connect Secure, Policy Secure and ZTA",True,True,0,0.0,48,39,28,{},CVE-2024-22024,27087,2025-12-04 12:59:17.456149
Ivanti,Ivanti EPM,True,True,0,0.0,48,79,39,{},CVE-2024-29824,145785,2025-12-01 12:57:36.243039
Ivanti,Ivanti Virtual Traffic Manager (vTM),True,True,0,0.0,2,65,31,{},CVE-2024-7593,19208,2025-12-01 12:57:36.335669
Chamilo,Chamilo,True,True,0,0.0,32,30,27,{},CVE-2023-4220,3899,2025-12-04 12:59:17.575682
SonicWall,SonicOS,True,True,0,0.0,480,468,272,{},CVE-2024-53704,68409,2025-12-01 12:57:36.161605
Wordpress,Wordpress Media Library Assistant plugin,True,True,0,0.0,20,220,137,{},CVE-2023-4634,36170,2025-12-05 12:56:12.819995
Linksys,Linksys RE7000,True,True,0,0.0,48,43,27,{},CVE-2024-25852,5444,2025-11-26 12:57:21.286810
SPIP,SPIP,True,True,0,0.0,2,64,35,{},CVE-2024-7954,6134,2025-12-02 12:58:40.239902
ColumbiaSoft,Document Locator,True,True,0,0.0,2,48,37,{},CVE-2023-5830,9718,2025-12-04 12:59:17.444756
Zyxel,"USG FLEX 100, 100W, 200, 500, 700, USG20-VPN, USG20W-VPN, ATP 100, 200, 500, 700, 800",True,True,0,0.0,102,84,46,{},CVE-2022-30525,19321,2025-11-24 12:57:02.445653
Rejetto,Rejetto HTTP File Server,True,True,0,0.0,775,196,64,{},CVE-2024-23692,24181,2025-11-24 12:57:02.411620
Atlassian,JIRA STAGIL Navigation for Jira - Menu & Themes plugin,True,True,0,0.0,18,171,169,{},CVE-2023-26255,15306,2025-11-23 12:47:09.050656
Wordpress,Wordpress Duplicator/Duplicator Pro plugin,True,True,0,0.0,41,45,33,{},CVE-2023-6114,26204,2025-11-26 12:57:21.121239
Linksys,Linksys E2000,True,True,0,0.0,27,18,16,{},CVE-2024-27497,3930,2025-11-26 12:57:21.158741
MASA CMS,MASA CMS,True,True,0,0.0,2,65,34,{},CVE-2024-32640,9084,2025-12-01 12:57:36.208225
Wordpress,Wordpress Registration Forms plugin,True,True,0,0.0,16,16,18,{},CVE-2023-0552,4832,2025-11-26 12:57:21.282114
Homebrew Computer Company,Jan,True,True,0,0.0,1,27,24,{},CVE-2024-36857,7756,2025-12-02 12:58:40.116938
ReadtoMyShoe,ReadtoMyShoe,True,True,0,0.0,1,43,29,{},CVE-2023-27587,4207,2025-12-04 12:59:17.432203
FastAdmin,FastAdmin,True,True,0,0.0,1,36,27,{},CVE-2024-7928,4462,2025-11-29 12:51:05.996358
Apache,nan,True,True,0,0.0,19,13,7,{},CVE-2023-33246,4527,2025-10-29 12:58:20.083597
Reprise,Reprise License Manager,True,True,0,0.0,46,20,21,{},CVE-2022-28363,797,2025-11-26 12:57:21.247516
Reprise,Reprise License Manager,True,True,0,0.0,42,17,18,{},CVE-2022-28365,842,2025-11-26 12:57:21.187907
NextChat (ChatGPT-Next-Web),NextChat (ChatGPT-Next-Web),True,True,0,0.0,2,103,93,{},CVE-2023-49785,47345,2025-12-05 12:56:12.963012
Odoo,Odoo,True,True,0,0.0,18,36,27,{},CVE-2023-1434,8194,2025-11-26 12:57:21.300756
JetBrains,TeamCity,True,True,0,0.0,3546,8072,6503,{},CVE-2023-42793,5112429,2025-12-05 12:56:12.810402
Apache,HugeGraph,True,True,0,0.0,19,31,28,{},CVE-2024-27348,7534,2025-12-04 12:59:17.561873
Totolink,Totolink A3300R,True,True,0,0.0,0,0,59,{},CVE-2024-24328,353,2025-05-14 12:52:06.399727
Honeywell,Honeywell PM43,True,True,0,0.0,2,55,33,{},CVE-2023-3710,10184,2025-12-01 12:57:36.234859
Rocket.Chat,Rocket.Chat,True,True,0,0.0,2,27,30,{},CVE-2024-39713,5470,2025-12-02 12:58:40.167395
Wordpress,Wordpress File Upload plugin,True,True,0,0.0,1,65,36,{},CVE-2024-9047,3260,2025-11-28 12:54:30.392139
Qlik,Qlik Sense,True,True,0,0.0,2,10,12,{},CVE-2023-41265,1654,2025-12-01 12:57:36.272163
Citrix,Citrix Session Recording,True,True,0,0.0,0,0,7,{},CVE-2023-6184,64,2025-10-20 02:05:45.118293
Dahua,Dahua Smart Park Integrated Management Platform,True,True,0,0.0,2,100,59,{},CVE-2023-7309,1818,2025-12-04 12:59:17.522592
SugarCRM,SugarCRM,True,True,0,0.0,0,0,1,{},CVE-2023-22952,699,2025-11-29 12:51:05.941428
h20.ai,h20.ai Dashboard,True,True,0,0.0,48,46,31,{},CVE-2023-6038,10190,2025-11-26 12:57:21.129291
Progress,WS_FTP Server,True,True,0,0.0,0,0,14,{},CVE-2023-40044,19,2024-12-27 12:42:08.498898
CyberPanel,CyberPanel,True,True,0,0.0,0,23,20,{},CVE-2024-32739,2108,2025-11-30 12:50:46.654866
F-Logic,DataCube3,True,True,0,0.0,37,37,23,{},CVE-2024-31750,6741,2025-11-26 12:57:21.194034
JEECG,jeecg-boot,True,True,0,0.0,20,44,33,{},CVE-2023-4450,7784,2025-12-05 12:56:12.850779
Likeshop,Likeshop,True,True,0,0.0,9,17,17,{},CVE-2024-0352,3364,2025-11-27 12:56:01.538598
Ivanti,Ivanti Secure Connect and Policy Secure,True,True,0,0.0,3,108,144,{},CVE-2023-46805,34091,2025-12-05 12:56:12.903554
Cisco,Cisco Smart Licensing Utility (CSLU),True,True,0,0.0,1,64,33,{},CVE-2024-20439,1702,2025-12-02 12:58:40.232335
QNAP,"QNAP QTS, QuTSCloud, QuTS Hero",True,True,0,0.0,0,8,8,{},CVE-2024-27130,12,2024-09-01 12:01:11.467420
MasterSAM,MasterSAM Star Gate,True,True,0,0.0,0,18,19,{},CVE-2024-55457,737,2025-11-29 12:51:06.020911
PrestaShop,PrestaShop jmsblog,True,True,0,0.0,0,2,2,{},CVE-2023-27034,2063,2025-03-26 12:49:20.263192
F5,BIG-IP,True,True,0,0.0,25,123,64,{},CVE-2023-46747,48584,2025-12-05 12:56:12.798604
LiteLLM,LiteLLM,True,True,0,0.0,43,27,20,{},CVE-2024-6587,4561,2025-11-28 12:54:30.273286
Alkacon,OpenCms,True,True,0,0.0,40,45,28,{},CVE-2023-42344,10068,2025-11-26 12:57:21.151909
Atlassian,JIRA,True,True,0,0.0,10,55,33,{},CVE-2022-39960,7466,2025-12-05 12:56:12.960333
Unit4,Unit4 Financials by Coda,True,True,0,0.0,81,28,29,{},CVE-2024-28734,7924,2025-11-24 12:57:02.400051
Apache,OFBiz,True,True,0,0.0,2,41,31,{},CVE-2023-49070,11384,2025-12-05 12:56:12.782909
Juniper,Junos OS (J-Web),True,True,0,0.0,1,1051,633,{},CVE-2023-36844,44711,2025-12-04 12:59:17.584081
D-Link,D-Link DAR-8000-10,True,True,0,0.0,2,41,28,{},CVE-2023-4542,6941,2025-11-29 12:51:06.101133
Mirko Ber Software Development,SuperWebMailer,True,True,0,0.0,1,29,25,{},CVE-2023-38192,7383,2025-12-04 12:59:17.641097
Lightdash,Lightdash,True,True,0,0.0,1,16,17,{},CVE-2023-35844,4810,2025-11-30 12:50:46.606688
Wordpress,Wordpress Jordy Meow AI Engine: ChatGPT Chatbot plugin,True,True,0,0.0,2,37,32,{},CVE-2023-51409,1742,2025-12-04 12:59:17.434621
Riello UPS,Netman 2024,True,True,0,0.0,24,16,17,{},CVE-2024-8877,2925,2025-11-26 12:57:21.252236
Uniview,Uniview ISC 2500-S,True,True,0,0.0,26,24,29,{},CVE-2024-0778,3093,2025-07-30 12:59:56.420884
Ivanti,Ivanti EPM,True,True,0,0.0,38,59,28,{},CVE-2024-13159,10271,2025-11-26 12:57:21.284898
OpenMetadata,OpenMetadata,True,True,0,0.0,673,259,117,{},CVE-2024-28255,36611,2025-11-23 12:47:09.222693
Wordpress,Wordpress Automatic plugin,True,True,0,0.0,12,14,17,{},CVE-2024-27954,13884,2025-11-26 12:57:21.221375
Sitecore,"Sitecore Experience Manager (XM), Experience Platform (XP), Experience",True,True,0,0.0,0,28,29,{},CVE-2024-46938,774,2025-11-26 12:57:21.121029
Ivanti,Ivanti EPM,True,True,0,0.0,1,47,32,{},CVE-2024-13161,7565,2025-12-02 12:58:40.188226
VertaAI,ModelDB,True,True,0,0.0,11,11,16,{},CVE-2023-6023,8036,2025-11-26 12:57:21.299124
MagnusSolution,magnusbilling,True,True,0,0.0,779,224,87,{},CVE-2023-30258,19992,2025-11-24 12:57:02.390182
Vanna,Vanna,True,True,0,0.0,2,85,40,{},CVE-2024-5827,13106,2025-12-01 12:57:36.158764
NextGen Healthcare,Mirth Connect,True,True,0,0.0,925,2779,2324,{},CVE-2023-37679,1298136,2025-12-05 12:56:12.883310
Juniper,Junos OS (J-Web),True,True,0,0.0,30,18,22,{},CVE-2024-21620,472,2025-11-26 12:57:21.180418
Atlassian,JIRA STAGIL Navigation for Jira - Menu & Themes plugin,True,True,0,0.0,18,774,377,{},CVE-2023-26256,22416,2025-11-29 12:51:06.091299
OS4ED,openSIS-Classic Version,True,True,0,0.0,0,0,80,{},CVE-2024-51211,376,2025-09-07 12:44:00.591865
Splunk,Splunk Enterprise on Windows,True,True,0,0.0,0,6,10,{},CVE-2024-36991,159,2025-10-10 12:51:58.451692
Apache,OFBiz,True,True,0,0.0,2,48,34,{},CVE-2023-51467,12897,2025-12-01 12:57:36.306297
Adobe,ColdFusion,True,True,0,0.0,24,21,17,{},CVE-2023-38205,9002,2025-11-26 12:57:21.300348
Citrix,Citrix ShareFile StorageZones (aka storage zones) Controller,True,True,0,0.0,0,0,308,{},CVE-2023-24489,308,2024-11-22 12:46:11.288355
Gradio,Gradio,True,True,0,0.0,1,46,35,{},CVE-2024-1561,34446,2025-12-01 12:57:36.341088
SpectoLabs,HoverFly,True,True,0,0.0,39,29,25,{},CVE-2024-45388,4862,2025-11-28 12:54:30.320765
Oracle,Oracle E-Business Suite,True,True,0,0.0,3,31,24,{},CVE-2022-21500,12089,2025-11-30 12:50:46.602038
D-Link,D-Link D-View 8,True,True,0,0.0,2,37,31,{},CVE-2023-5074,9779,2025-12-04 12:59:17.635577
Apache,Arrow,True,True,0,0.0,2,43,32,{},CVE-2023-47248,4411,2025-12-05 12:56:12.885621
Palo Alto Networks,GlobalProtect,True,True,0,0.0,186,559,520,{},CVE-2024-3400,71296,2025-11-23 12:47:09.128434
Citrix,Citrix NetScaler Console,True,True,0,0.0,2,68,51,{},CVE-2024-6235,1125,2025-12-04 12:59:17.552459
Cacti,Cacti,True,True,0,0.0,6,6,82,{},CVE-2022-46169,36224,2025-12-04 12:59:17.472320
Draytek,Draytek Vigor2960 and Vigor300B,True,True,0,0.0,0,2,11,{},CVE-2024-12987,110,2025-07-28 12:59:31.826016
Totolink,Totolink A3300R,True,True,0,0.0,0,0,59,{},CVE-2024-24329,354,2025-05-14 12:52:06.374541
Ivanti,Ivanti Secure Connect and Policy Secure,True,True,0,0.0,354,1692,1184,{},CVE-2024-21887,660630,2025-12-02 12:58:40.228434
GeoServer,GeoServer,True,True,0,0.0,92,74,97,{},CVE-2023-43795,36885,2025-12-05 12:56:12.810168
Ruckus,Ruckus Wireless Admin,True,True,0,0.0,1,1,28,{},CVE-2023-25717,390,2025-06-24 12:54:48.744665
CyberPanel,CyberPanel,True,True,0,0.0,0,19,18,{},CVE-2024-32736,2221,2025-12-01 12:57:36.165824
JEECG,jeecg-boot,True,True,0,0.0,73,82,49,{},CVE-2024-48307,15635,2025-11-23 12:47:09.049075
AVTECH,AVTECH IP camera,True,True,0,0.0,34,33,32,{},CVE-2024-7029,10574,2025-12-02 12:58:40.219925
Apache,OFBiz,True,True,0,0.0,3,38,40,{},CVE-2023-50968,25757,2025-12-01 12:57:36.177889
Wordpress,Wordpress EventON plugin,True,True,0,0.0,71,23,21,{},CVE-2024-0235,636,2025-11-25 12:56:15.515624
Wordpress,Wordpress WP Job Portal plugin,True,True,0,0.0,2,27,29,{},CVE-2023-4490,1636,2025-12-05 12:56:12.942843
CrushFTP,CrushFTP,True,True,0,0.0,15,28,98,{},CVE-2023-43177,3113,2025-11-23 12:47:09.117479
GFI,Kerio Control,True,True,0,0.0,46,31,21,{},CVE-2024-52875,13369,2025-11-26 12:57:21.121850
Zyxel,Zyxel NAS326/NAS540/NAS542,True,True,0,0.0,0,0,6,{},CVE-2023-27992,58,2025-04-08 12:50:16.207163
Ruijie Networks,Ruijie BCR810W,True,True,0,0.0,0,13,67,{},CVE-2023-3608,80731,2025-10-30 12:56:29.294381
Gibbon,Gibbon,True,True,0,0.0,2,75,39,{},CVE-2023-45878,6796,2025-12-05 12:56:12.793209
Guangzhou Yingke Electronic Technology,Ncast,True,True,0,0.0,27,42,32,{},CVE-2024-0305,17822,2025-11-21 12:53:31.551200
Progress,MOVEit Transfer,True,True,0,0.0,2,60,37,{},CVE-2023-36934,12069,2025-11-29 12:51:06.109324
Dahua,Smart Park Management,True,True,0,0.0,2,58,36,{},CVE-2023-3836,11061,2025-12-01 12:57:36.200135
PTZOptics,PTZOptics PT30X-SDI/NDI-xx,True,True,0,0.0,2,2,2,{},CVE-2024-8957,17,2025-11-21 12:53:31.622076
ipTIME,ipTIME A2004,True,True,0,0.0,26,16,19,{},CVE-2024-54763,520,2025-11-26 12:57:21.249738
PrestaShop,PrestaShop tshirtecommerce,True,True,0,0.0,26,23,19,{},CVE-2023-27640,4366,2025-11-21 12:53:31.508166
Ghost,Ghost,True,True,0,0.0,35,21,19,{},CVE-2023-32235,9073,2025-11-25 12:56:15.439515
Patton,SmartNode SN200,True,True,0,0.0,2,31,29,{},CVE-2023-41109,8933,2025-12-05 12:56:12.898153
IBM,IBM Operational Decision Manager,True,True,0,0.0,35,178,88,{},CVE-2024-22319,18471,2025-12-04 12:59:17.469624
Mitel,MiCollab,True,True,0,0.0,114,146,54,{},CVE-2024-41713,25325,2025-11-27 12:56:01.587622
WBCE,WBCE CMS,True,True,0,0.0,2,39,30,{},CVE-2023-39796,10332,2025-12-01 12:57:36.194167
Totolink,Totolink T10,True,True,0,0.0,0,0,103,{},CVE-2024-9001,297,2025-10-12 12:45:43.395552
Totolink,Totolink EX1800T,True,True,0,0.0,2,38,31,{},CVE-2024-34257,7402,2025-12-01 12:57:36.153041
Zyxel,Zyxel NAS326/NAS542,True,True,0,0.0,0,0,317,{},CVE-2023-4473,708,2024-07-28 06:01:26.179100
Korenix,"Jetwave 4200, Jetwave 3000 Series",True,True,0,0.0,0,0,83,{},CVE-2023-23295,611,2025-10-30 12:56:29.146812
SysAid,SysAid On-Premise,True,True,0,0.0,2,86,42,{},CVE-2023-47246,18609,2025-11-29 12:51:06.121900
CyberPanel,CyberPanel,True,True,0,0.0,11,20,19,{},CVE-2024-32737,2016,2025-11-26 12:57:21.278798
F-Logic,DataCube3,True,True,0,0.0,0,0,80,{},CVE-2024-34854,376,2025-09-07 12:44:00.484046
Zyxel,Zyxel NAS326,True,True,0,0.0,2,81,37,{},CVE-2024-29973,17177,2025-12-02 12:58:40.092437
Wordpress,Wordpress Themewinter Eventin plugin,True,True,0,0.0,70,94,48,{},CVE-2025-47539,2168,2025-11-25 12:56:15.341498
Cisco,Cisco ASA and Cisco Firepower Threat Defense,True,True,0,0.0,0,0,7,{},CVE-2020-3259,50,2025-10-15 12:54:42.417472
Lime Technology,Unraid,True,True,0,0.0,30,491,509,{},CVE-2020-5847,54602,2025-12-04 12:59:17.566775
ThinkAdmin,ThinkAdmin,True,True,0,0.0,0,111,197,{},CVE-2020-25540,1066,2024-11-09 12:39:16.843345
HPE,LinuxKI,True,True,0,0.0,49,156,98,{},CVE-2020-7209,12355,2025-12-05 12:56:12.893600
Nette,Nette,True,True,0,0.0,2,2,3,{},CVE-2020-15227,1267,2025-12-01 12:57:36.231947
Seiko,Seiko Skybridge MB-A200 series,True,True,0,0.0,0,0,81,{},CVE-2022-36559,379,2025-09-07 12:44:00.467021
WAVLINK,WAVLINK WN530H4,True,True,0,0.0,142,44,25,{},CVE-2020-12124,8260,2025-11-25 12:56:15.419005
Draytek,VigorConnect,True,True,0,0.0,15,39,32,{},CVE-2021-20124,8847,2025-11-21 12:53:31.584665
VMware,VMware NSX Manager XStream,True,True,0,0.0,100,56,24,{},CVE-2021-39144,10985,2025-12-02 12:58:40.226238
Gurock (Sembi),TestRail,True,True,0,0.0,41,28,27,{},CVE-2021-40875,755,2025-11-24 12:57:02.358052
FLIR,AX8 thermal sensor cameras,True,True,0,0.0,0,0,283,{},CVE-2022-37061,444,2025-10-31 12:54:23.966161
D-Link,D-Link DIR850,True,True,0,0.0,52,17,19,{},CVE-2021-46379,5123,2025-11-26 12:57:21.257739
TerraMaster,TOS,True,True,0,0.0,75,128,112,{},CVE-2020-28188,135569,2025-10-29 12:58:20.228884
Nexxt,Amp300 ARN02304U8,True,True,0,0.0,0,0,209,{},CVE-2022-44149,3466,2025-11-18 12:55:38.715191
Microweber,Microweber,True,True,0,0.0,29,20,23,{},CVE-2022-1439,16029,2025-11-26 12:57:21.208566
Oracle,Oracle Access Manager (Oracle Fusion Middleware),True,True,0,0.0,36,287,255,{},CVE-2021-35587,36578,2025-12-02 12:58:40.147307
Wordpress,Wordpress Active Products Tables for WooCommerce,True,True,0,0.0,11,13,18,{},CVE-2022-1916,6459,2025-11-26 12:57:21.275329
Artica,Artica Proxy,True,True,0,0.0,24,21,17,{},CVE-2020-13158,4917,2025-11-26 12:57:21.242302
ZyXEL,ZyXEL NAS,True,True,0,0.0,97,498,479,{},CVE-2020-9054,48856,2025-12-02 12:58:40.182246
Myucms,Myucms,True,True,0,0.0,49,65,40,{},CVE-2020-21650,15364,2025-11-28 12:54:30.297210
Nacos,Nacos,True,True,0,0.0,1,12,16,{},CVE-2021-29442,13129,2025-11-29 12:51:06.073061
Ivanti,Avalanche,True,True,0,0.0,97,18,18,{},CVE-2021-30497,8011,2025-12-05 12:56:12.844644
Cisco,SD-WAN vManage,True,True,0,0.0,24,16,15,{},CVE-2020-26073,4794,2025-11-26 12:57:21.202362
Mitel,MiCollab AWV,True,True,0,0.0,17,12,16,{},CVE-2020-11798,3536,2025-11-26 12:57:21.187429
SAS Institute,SAS/IntrNet,True,True,0,0.0,32,17,19,{},CVE-2021-41569,4258,2025-11-25 12:56:15.501143
Wordpress,Wordpress Simple File List plugin,True,True,0,0.0,94,226,132,{},CVE-2020-12832,23432,2025-12-01 12:57:36.191885
OpenTSDB,OpenTSDB,True,True,0,0.0,44,272,88,{},CVE-2020-35476,26432,2025-12-02 12:58:40.220216
IceWarp,IceWarp Mail Server,True,True,0,0.0,19,16,21,{},CVE-2019-12593,12391,2025-11-26 12:57:21.250354
Grafana,Grafana,True,True,0,0.0,28,30,20,{},CVE-2021-39226,10930,2025-11-24 12:57:02.295860
Tenda,AC15/AC1900,True,True,0,0.0,0,0,51,{},CVE-2020-15916,62,2024-11-27 12:48:49.171041
GNU,GNU Bash,True,True,0,0.0,0,0,39,{},CVE-2014-6271,479,2025-10-12 12:45:43.458541
TopThink,ThinkPHP5,True,True,0,0.0,0,0,1,{},CVE-2019-9082,9,2025-08-20 12:53:31.141040
AVM,Fritz!Box,True,True,0,0.0,0,15,15,{},CVE-2014-9727,235,2025-11-01 12:48:51.444004
ASUS,ASUS RT series routers,True,True,0,0.0,0,0,1,{},CVE-2013-5948,52,2024-11-15 12:45:30.393265
Synacor,Zimbra Collaboration Suite,True,True,0,0.0,14,24,72,{},CVE-2013-7091,68450,2025-12-05 12:56:12.811514
Comtrend,Comtrend VR-3033,True,True,0,0.0,0,0,26,{},CVE-2020-10173,1347,2025-06-24 12:54:48.634631
D-Link,D-Link IP Cameras,True,True,0,0.0,361,361,361,{},CVE-2013-1599,1637,2025-08-13 12:56:18.695577
perfSONAR,perfSONAR,True,True,0,0.0,10,12,15,{},CVE-2022-41412,1116,2025-11-26 12:57:21.221768
RaspAP,RaspAP,True,True,0,0.0,98,274,107,{},CVE-2021-33357,18679,2025-12-02 12:58:40.202020
D-Link,D-Link DIR-825,True,True,0,0.0,0,0,41,{},CVE-2020-10215,41,2024-11-27 12:48:49.075130
oria,gridx,True,True,0,0.0,100,64,31,{},CVE-2020-19625,7070,2025-12-02 12:58:40.146217
Spring Boot Actuator Logview,Spring Boot Actuator Logview,True,True,0,0.0,3,30,32,{},CVE-2021-21234,33435,2025-12-01 12:57:36.159977
Oracle,Oracle Business Intelligence (Oracle Fusion Middleware,True,True,0,0.0,3,11,16,{},CVE-2020-14864,6847,2025-12-01 12:57:36.179198
Keycloak,Keycloak,True,True,0,0.0,29,12,33,{},CVE-2020-10770,11744,2025-11-25 12:56:15.460962
ZTE,ZTE MF971R,True,True,0,0.0,1,71,48,{},CVE-2021-21745,23730,2025-12-04 12:59:17.471071
LimeSurvey,LimeSurvey,True,True,0,0.0,33,18,17,{},CVE-2020-11455,5233,2025-12-05 12:56:12.815858
Arcadyan,Arcadyan manufactured devices (multiple vendors),True,True,0,0.0,0,0,1,{},CVE-2021-20090,4,2024-10-10 12:43:46.578831
Reprise,Reprise License Manager,True,True,0,0.0,26,15,20,{},CVE-2021-45422,679,2025-11-26 12:57:21.214993
VMWare,vCenter Server,True,True,0,0.0,3,25,15,{},CVE-2021-21972,2635,2025-11-28 12:54:30.388239
Alibaba,Nacos,True,True,0,0.0,26,46,40,{},CVE-2021-29441,38184,2025-11-28 12:54:30.320245
Gerapy,Gerapy,False,False,0,,0,1,1,,CVE-2021-32849,0,2024-03-12 10:43:50.922692
VoIPmonitor,VoIPmonitor,True,True,0,0.0,13,13,15,{},CVE-2021-30461,1260,2025-12-05 12:56:12.884415
Wordpress,Wordpress Zoomsounds plugin,True,True,0,0.0,85,26,27,{},CVE-2021-39316,5526,2025-12-02 12:58:40.201328
SAP,SCIMono,True,True,0,0.0,91,55,28,{},CVE-2021-21479,6531,2025-12-05 12:56:12.890455
Citrix,XenMobile Server,True,True,0,0.0,27,30,21,{},CVE-2020-8209,21698,2025-11-28 12:54:30.409081
PHP-Fusion,PHP-Fusion,True,True,0,0.0,2,706,706,{},CVE-2020-24949,7760,2025-12-04 12:59:17.604943
Atlassian,JIRA,True,True,0,0.0,0,41,15,{},CVE-2021-26086,18371,2025-11-05 12:56:18.002190
i3Geo,i3Geo,True,True,0,0.0,0,0,51,{},CVE-2022-32409,244,2025-09-07 12:44:00.478137
Moodle,Moodle,True,True,0,0.0,1,78,39,{},CVE-2022-35653,8730,2025-12-04 12:59:17.602240
benc-uk,KubeView,True,True,0,0.0,1,16,17,{},CVE-2022-45933,9446,2025-11-29 12:51:06.015097
Wordpress,Wordpress Google XML Sitemap Generator plugin,True,True,0,0.0,42,52,37,{},CVE-2022-0346,11591,2025-11-30 12:50:46.577626
Zoho,"ManageEngine Access Manager Plus, Password Manager Pro, PAM360",True,True,0,0.0,1,4,8,{},CVE-2022-29081,724,2025-11-24 12:57:02.390937
Wordpress,Wordpress Directorist plugin,True,True,0,0.0,22,13,16,{},CVE-2022-2376,4997,2025-11-25 12:56:15.536405
D-Link,D-Link DSL-2750U,True,True,0,0.0,1,30,25,{},CVE-2021-3708,7358,2025-12-01 12:57:36.313898
Smart Office Payroll,Smart Office Web,True,True,0,0.0,11,20,19,{},CVE-2022-47075,1247,2025-11-26 12:57:21.224243
Easy!Appointments,Easy!Appointments,True,True,0,0.0,0,5,5,{},CVE-2022-0482,263,2025-11-24 12:57:02.349806
Icinga,Icinga Web 2,True,True,0,0.0,22,17,20,{},CVE-2022-24716,5440,2025-11-23 12:47:09.047489
Wordpress,Wordpress Woocommerce plugin,True,True,0,0.0,0,0,5,{},CVE-2021-32790,163,2025-11-25 12:56:15.481499
Adobe,ColdFusion,True,True,0,0.0,11,19,26,{},CVE-2021-21087,66394,2025-12-05 12:56:12.820213
Chamilo,LMS,True,True,0,0.0,2,81,49,{},CVE-2021-34187,20064,2025-11-29 12:51:06.099689
Wordpress,Patreon Wordpress plugin,True,True,0,0.0,21,15,21,{},CVE-2021-24227,4748,2025-11-25 12:56:15.434618
Spring,Spring Cloud Netflix,True,True,0,0.0,108,58,48,{},CVE-2021-22053,38776,2025-12-02 12:58:40.241099
Totolink,A720R,True,True,0,0.0,200,141,56,{},CVE-2021-35327,2402,2024-08-08 06:01:09.766686
ZEROF,ZEROF Web Server,True,True,0,0.0,2,16,20,{},CVE-2022-25322,18833,2025-10-29 12:58:20.254414
Adobe,Adobe Commerce (Magento),False,True,0,,0,2,15,,CVE-2022-24086,0,2024-03-12 10:43:50.942002
Totolink,Totolink N600R,True,True,0,0.0,0,0,103,{},CVE-2022-28907,296,2025-10-12 12:45:43.494961
Wordpress,Wordpress Admin Word Count Column plugin,True,True,0,0.0,1,12,19,{},CVE-2022-1390,4453,2025-12-04 12:59:17.587981
Atlassian,JIRA Seraph,True,True,0,0.0,14,19,147,{},CVE-2022-0540,21144,2025-12-05 12:56:12.971778
Node.js,Node.js,True,True,0,0.0,15,21,29,{},CVE-2021-21315,18192,2025-11-26 12:57:21.305272
Grafana,Grafana,True,True,0,0.0,91,42,39,{},CVE-2021-43798,14574,2025-11-11 12:54:39.761356
SolarWinds,SolarWinds Web Help Desk,True,True,0,0.0,0,0,7,{},CVE-2021-35232,33,2025-11-12 12:56:37.435318
Apache,Apache HTTP Server,True,True,0,0.0,120,511,349,{},CVE-2021-40438,45994,2025-11-27 12:56:01.671016
QNAP,QNAP NAS devices running Photo Station,True,True,0,0.0,10,31,23,{},CVE-2022-27593,7082,2025-12-05 12:56:12.884625
Hitachi Vantara,Pentaho Business Analytics Server,True,True,0,0.0,94,139,78,{},CVE-2022-43939,51248,2025-12-02 12:58:40.180351
Totolink,"A3100R, A810R, A830R, A860R, A950RG, A3100R, T6, and T10 routers",True,False,0,,0,0,1,,CVE-2022-25075,0,2024-03-12 10:43:50.953618
acmailer,acmailer,True,True,0,0.0,0,0,148,{},CVE-2021-20617,694,2025-09-07 12:44:00.497451
Citrix,Citrix ShareFile StorageZones (aka storage zones) Controller,True,True,0,0.0,23,13,122,{},CVE-2020-8982,18104,2025-11-25 12:56:15.422008
Dynamicweb Software,Dynamicweb,True,True,0,0.0,13,247,94,{},CVE-2022-25369,17743,2025-12-05 12:56:12.895820
Linear,eMerge E3-Series,True,True,0,0.0,30,30,29,{},CVE-2022-46381,12817,2025-11-26 12:57:21.149450
Hytec Inter,Hytec Inter HWL-2511-SS,True,True,0,0.0,0,0,4,{},CVE-2022-36553,52,2025-04-11 12:49:10.500618
Jellyfin,Jellyfin,True,True,0,0.0,1,26,21,{},CVE-2021-21402,5922,2025-11-30 12:50:46.510315
Pascom,Pascom Cloud Phone System,True,True,0,0.0,1,18,32,{},CVE-2021-45967,14640,2025-11-21 12:53:31.547926
CHIYU Technology,"CHIYU BF-430, BF-431 and BF-450M",True,True,0,0.0,47,20,21,{},CVE-2021-31250,7176,2025-11-26 12:57:21.296704
Terramaster,TOS,True,True,0,0.0,1,81,66,{},CVE-2020-28185,46619,2025-12-04 12:59:17.594796
Draytek,VigorConnect,True,True,0,0.0,20,17,24,{},CVE-2021-20123,9110,2025-11-26 12:57:21.255253
Revive,Revive Adserver,True,True,0,0.0,18,21,24,{},CVE-2020-8115,6317,2025-11-26 12:57:21.180897
Wordpress,Wordpress Duplicator plugin,True,True,0,0.0,43,134,96,{},CVE-2020-11738,19679,2025-11-28 12:54:30.353317
Apache,OFBiz,True,True,0,0.0,3,18,21,{},CVE-2020-1943,6929,2025-12-02 12:58:40.127923
Yealink,Yealink Device Management (DM),True,True,0,0.0,126,39,21,{},CVE-2021-27561,5465,2025-11-25 12:56:15.522983
Micro Focus,Operation Bridge Manager UCMDB,True,True,0,0.0,1,61,30,{},CVE-2020-11854,5740,2025-11-29 12:51:06.051966
QCubed,QCubed,True,True,0,0.0,1,132,112,{},CVE-2020-24914,95952,2025-12-04 12:59:17.478279
rConfig,rConfig,True,True,0,0.0,11,14,18,{},CVE-2020-10546,5472,2025-11-26 12:57:21.203657
Squirrelly,Squirrelly,True,True,0,0.0,0,0,62,{},CVE-2021-32819,323,2025-09-07 12:44:00.625575
3CX,3CX Phone System Management Console,True,True,0,0.0,33,30,23,{},CVE-2022-28005,8627,2025-11-26 12:57:21.169402
TopThink,ThinkPHP,True,True,0,0.0,44,21,18,{},CVE-2022-47945,5679,2025-12-05 12:56:12.931858
Hongdian,Hongdian H8922,True,True,0,0.0,1,73,39,{},CVE-2021-28149,21766,2025-12-04 12:59:17.516131
Ctek,SkyRouter,True,False,0,,0,0,2,,CVE-2011-5010,0,2024-03-12 10:43:50.936757
Wordpress,Wordpress InPost Gallery plugin,True,True,0,0.0,17,18,20,{},CVE-2022-4063,3954,2025-11-21 12:53:31.602884
Grandstream,UCM6200 series,True,True,0,0.0,4,5,5,{},CVE-2020-5722,40,2025-06-09 12:53:37.632769
Kubernetes,Kubernetes (Kubelet),True,True,0,0.0,1,12,18,{},CVE-2019-11248,12649,2025-11-30 12:50:46.515838
Apache,OFBiz,True,True,0,0.0,34,36,26,{},CVE-2024-45195,6208,2025-12-02 12:58:40.216812
wftpserver.com,Wing FTP Server,True,True,0,0.0,44,121,108,{},CVE-2025-47812,11067,2025-12-01 12:57:36.328386
Dassualt Systems,DELMIA Apriso,True,True,0,0.0,45,63,63,{},CVE-2025-6205,543,2025-12-04 12:59:17.449676
Akamai,Akamai CloudTest,True,True,0,0.0,36,45,51,{},CVE-2025-49493,2489,2025-11-21 12:53:31.516248
Gladinet,Gladinet CentreStack,True,True,0,0.0,29,93,74,{},CVE-2025-30406,3054,2025-12-01 12:57:36.218851
WebIQ,WebIQ,True,True,0,0.0,2,35,29,{},CVE-2024-8752,5221,2025-12-02 12:58:40.108017
Erudika,Scoold,True,True,0,0.0,103,26,24,{},CVE-2024-50334,763,2025-11-25 12:56:15.507172
Jenkins,Jenkins,True,True,0,0.0,4,7,5,{},CVE-2024-23897,2063,2025-10-17 12:53:02.095674
SysAid,SysAid On-Premise,True,True,0,0.0,25,50,21,{},CVE-2025-2777,1769,2025-11-23 12:47:09.068634
FreePBX,FreePBX,True,True,0,0.0,23,149,95,{},CVE-2025-57819,2594,2025-12-04 12:59:17.466988
Wordpress,Wordpress WP01 plugin,True,True,0,0.0,107,100,38,{},CVE-2025-30567,1089,2025-11-25 12:56:15.535942
ZKTeco,"ZKTeco ZEM500-510-560-760, ZEM600-800, ZEM720, ZMM",True,True,0,0.0,2,3,15,{},CVE-2022-42953,1119,2025-11-30 12:50:46.450806
Totolink,Totolink A720R,True,True,0,0.0,0,25,19,{},CVE-2025-4270,453,2025-10-30 12:56:29.291757
Adobe,Adobe Experience Manager,True,True,0,0.0,0,0,5,{},CVE-2025-54253,48,2025-11-27 12:56:01.620777
Nest,Nest,True,True,0,0.0,97,48,37,{},CVE-2025-54782,1658,2025-11-24 12:57:02.391602
Elber,Elber (multiple products),True,True,0,0.0,36,64,27,{},CVE-2025-0674,1573,2025-11-28 12:54:30.394813
Dasan,Dasan GPON ONT WiFi Router H640X,True,True,0,0.0,0,0,46,{},CVE-2017-18046,198,2025-09-18 12:52:11.737042
Kirona,Kirona Dynamic Resource Scheduling (DRS),True,True,0,0.0,69,26,22,{},CVE-2019-17503,11714,2025-11-26 12:57:21.253038
PHPSHE,PHPSHE,True,True,0,0.0,13,14,30,{},CVE-2019-9762,10435,2025-12-05 12:56:12.961146
Yaws,Yaws,True,True,0,0.0,155,60,37,{},CVE-2017-10974,5288,2025-11-25 12:56:15.396428
Linear,eMerge E3-series,True,True,0,0.0,1,12,16,{},CVE-2022-38627,640,2025-12-04 12:59:17.566579
Supervisor,XML-RPC Server,True,True,0,0.0,122,28,16,{},CVE-2017-11610,4228,2025-11-07 12:53:37.019350
HPE,HPE intelligent Management Center (iMC) PLAT,True,True,0,0.0,1,47,33,{},CVE-2017-8961,9526,2025-12-01 12:57:36.258022
Western Digital,MyCloud PR4100,True,True,0,0.0,1,1,58,{},CVE-2017-17560,405,2025-09-07 12:44:00.615793
NETGEAR,NETGEAR DGN2200,True,True,0,0.0,0,0,324,{},CVE-2017-6334,365,2025-09-10 12:50:16.012330
Carel,Carel pCOWeb,True,True,0,0.0,1,77,43,{},CVE-2019-11370,39445,2025-12-04 12:59:17.452549
Hirsch,Hirsch Enterphone MESH,True,True,0,0.0,2,196,45,{},CVE-2025-26793,2462,2025-11-28 12:54:30.387636
Revolution PI,Revolution PI webstatus and others,True,True,0,0.0,50,85,34,{},CVE-2025-41646,2339,2025-11-21 12:53:31.561496
Cisco,Cisco Unified IP Conference Station 7937G,True,True,0,0.0,1,1,5,{},CVE-2020-16139,540,2025-12-02 12:58:40.089379
Dassualt Systems,DELMIA Apriso,True,True,0,0.0,84,107,68,{},CVE-2025-5086,3374,2025-12-01 12:57:36.340458
Edimax,Edimax IC-7100,True,True,0,0.0,0,0,64,{},CVE-2025-1316,83,2025-06-22 02:21:08.739931
Wordpress,Wordpress Debug Tool plugin,True,True,0,0.0,0,0,7,{},CVE-2024-10586,87,2025-10-24 12:54:46.719501
dirk1983,chatgpt,True,True,0,0.0,19,22,22,{},CVE-2024-27564,4999,2025-11-26 12:57:21.213348
Adobe,Adobe Experience Manager,True,True,0,0.0,0,0,5,{},CVE-2025-49533,30,2025-11-26 12:57:21.123300
Hongdian,Hongdian H8922,True,True,0,0.0,1,85,44,{},CVE-2021-28150,1338,2025-12-04 12:59:17.505893
NextChat (ChatGPT-Next-Web),NextChat (ChatGPT-Next-Web),True,True,0,0.0,2,96,95,{},CVE-2024-38514,11367,2025-12-01 12:57:36.306922
Ivanti,"Ivanti Connect Secure, Policy Secure and Ivanti Neurons for ZTA",True,True,0,0.0,1,28,131,{},CVE-2024-21893,47083,2025-12-01 12:57:36.329591
Versa,Versa Concerto,True,True,0,0.0,45,90,34,{},CVE-2025-34026,1719,2025-11-21 12:53:31.588852
Argo Project,Argo CD,True,True,0,0.0,1,14,14,{},CVE-2025-55190,56,2025-12-04 12:59:17.502289
Wordpress,Wordpress SureTriggers: All-in-One Automation Platform plugin,True,True,0,0.0,79,50,24,{},CVE-2025-3102,787,2025-11-28 12:54:30.368340
LB-LINK,LB-LINK BL-AC2100,True,True,0,0.0,63,53,54,{},CVE-2025-29063,6092,2025-11-21 12:53:31.517975
CyberPanel,CyberPanel,True,True,0,0.0,22,27,18,{},CVE-2024-32735,5095,2025-11-11 12:54:39.650128
SysAid,SysAid On-Premise,True,True,0,0.0,44,59,19,{},CVE-2025-2776,1740,2025-11-28 12:54:30.348623
WAVLINK,WAVLINK WL-WN531P3,True,True,0,0.0,0,0,84,{},CVE-2022-23900,395,2025-09-07 12:44:00.535002
Wordpress,Wordpress Backup and Staging by WP Time Capsule plugin,True,True,0,0.0,19,93,48,{},CVE-2024-8856,6569,2025-12-04 12:59:17.584909
DNN Corp,DNN (DotNetNuke),True,True,0,0.0,106,59,25,{},CVE-2025-52488,926,2025-11-26 12:57:21.221954
OpenAPI Tools,OpenAPI Generator,True,True,0,0.0,2,37,34,{},CVE-2024-35219,6700,2025-12-02 12:58:40.179566
Wordpress,Wordpress HTML5 Video Player plugin,True,True,0,0.0,2,57,36,{},CVE-2024-1061,10942,2025-12-01 12:57:36.232559
Wordpress,Wordpress Automatic plugin,True,True,0,0.0,2,63,38,{},CVE-2024-27956,6955,2025-12-01 12:57:36.243445
Progress,Flowmon,True,True,0,0.0,795,185,71,{},CVE-2024-2389,22711,2025-11-24 12:57:02.316445
Arc53,DocsGPT,True,True,0,0.0,2,42,56,{},CVE-2025-0868,3912,2025-12-01 12:57:36.308214
FOG Project,FOG,True,True,0,0.0,261,88,47,{},CVE-2024-39914,13287,2025-11-25 12:56:15.431382
Evertz,Evertz SDVN 3080ipx-10G and others,True,True,0,0.0,86,151,104,{},CVE-2025-4009,7112,2025-12-01 12:57:36.315069
Gradio,Gradio,True,True,0,0.0,43,40,32,{},CVE-2024-4325,6560,2025-12-02 12:58:40.100248
Oracle,Oracle Weblogic Server,True,True,0,0.0,0,0,80,{},CVE-2019-2618,394,2025-09-07 12:44:00.604000
Lansweeper,Lansweeper,True,True,0,0.0,16,14,15,{},CVE-2019-13462,2575,2025-11-28 12:54:30.401447
Crestron,Crestron HD-MD4X2-4K-E,True,True,0,0.0,12,11,17,{},CVE-2022-23178,9375,2025-11-29 12:51:06.037101
Drupal,Drupal avatar_uploader,True,True,0,0.0,26,15,15,{},CVE-2018-9205,4792,2025-11-26 12:57:21.300953
PHP,PHP-FPM (FastCGI Process Manager),False,True,0,,0,0,182,,CVE-2019-11043,0,2024-03-12 10:43:50.969240
D-Link,D-Link DWR series,True,True,0,0.0,21,21,15,{},CVE-2018-10823,6887,2025-11-23 12:47:09.070794
Totolink,A3002RU,True,True,0,0.0,0,0,229,{},CVE-2018-13307,262,2025-11-11 12:54:39.696476
rConfig,rConfig,True,True,0,0.0,32,44,37,{},CVE-2019-16662,16677,2025-12-05 12:56:12.911626
Splunk,Splunk,True,True,0,0.0,68,21,17,{},CVE-2018-11409,13202,2025-11-26 12:57:21.301358
Xiaomi,Xiaomi Mi WiFi R3G,True,True,0,0.0,1,21,19,{},CVE-2019-18371,3133,2025-12-01 12:57:36.233122
LOYTEC,LOYTEC LGATE-902,True,True,0,0.0,11,13,15,{},CVE-2018-14918,7308,2025-11-26 12:57:21.143733
Master,Master IP CAM 01,True,True,0,0.0,0,0,2,{},CVE-2019-8387,67,2025-09-28 12:47:36.802117
Drupal,Drupal,True,True,0,0.0,0,0,17,{},CVE-2019-6340,36,2025-09-08 12:53:24.635639
Cisco,Cisco ASA and Cisco Firepower Threat Defense,True,True,0,0.0,23,26,16,{},CVE-2018-0296,6781,2025-11-26 12:57:21.228394
Telos Alliance,Omnia MPX Node,True,True,0,0.0,25,23,20,{},CVE-2022-36642,10642,2025-11-26 12:57:21.120396
Elastic,Elasticsearch,True,True,0,0.0,0,0,1,{},CVE-2014-3120,25,2025-08-28 12:51:48.544577
Luracast,Luracast Restler,True,True,0,0.0,26,18,17,{},CVE-2017-15363,4887,2025-11-26 12:57:21.133438
CGit,CGit,True,True,0,0.0,25,13,12,{},CVE-2018-14912,5017,2025-11-26 12:57:21.184753
Zhone,zNID GPON 2426A,True,True,0,0.0,0,7,7,{},CVE-2014-9118,892,2025-11-05 12:56:18.035584
Alfresco,Alfresco Community Edition (Alfresco Share),True,True,0,0.0,1,72,48,{},CVE-2019-14223,26790,2025-12-04 12:59:17.640258
Yachtcontrol,Yachtcontrol,True,True,0,0.0,14,50,29,{},CVE-2019-17270,8536,2025-12-05 12:56:12.823603
Sahi Pro,Sahi Pro,True,True,0,0.0,20,15,16,{},CVE-2018-20470,4370,2025-11-26 12:57:21.233682
Linear,eMerge E3-Series,True,True,0,0.0,40,21,20,{},CVE-2019-7254,6234,2025-12-05 12:56:12.784242
Totolink,A3002RU,True,True,0,0.0,7,9,19,{},CVE-2018-13315,19979,2025-12-04 12:59:17.516383
Jenkins,Jenkins,True,True,0,0.0,0,18,7,{},CVE-2018-1000861,64,2025-07-29 13:00:07.024231
CERIO,CERIO DT-300N,True,True,0,0.0,94,68,36,{},CVE-2018-18852,8891,2025-11-24 12:57:02.331892
Atlassian,JIRA,True,True,0,0.0,1,32,19,{},CVE-2019-8442,2740,2025-11-29 12:51:06.051783
Bitrix,Bitrix24 Web Application Firewall,False,False,0,,0,2,133,,CVE-2020-13483,0,2024-03-12 10:43:50.933870
Oracle,BI Publisher (Oracle Fusion Middleware),True,True,0,0.0,2,32,24,{},CVE-2019-2768,5553,2025-12-02 12:58:40.117956
OpenNetAdmin,OpenNetAdmin,False,False,0,,0,0,2,,CVE-2019-25065,0,2024-03-12 10:43:50.953187
Totolink,Totolink N600R,True,True,0,0.0,0,0,49,{},CVE-2022-26186,99,2025-09-27 12:45:53.890420
Atlassian,Bitbucket,True,True,0,0.0,2,4,18,{},CVE-2022-36804,801,2025-11-29 12:51:06.003582
Netis,Netis DL4323,True,True,0,0.0,1,32,22,{},CVE-2019-20074,1509,2025-11-29 12:51:05.950034
Zoho,ManageEngine ADAudit Plus,True,True,0,0.0,96,146,69,{},CVE-2022-28219,16199,2025-11-24 12:57:02.408494
Schneider Electric,Pelco Endura NET55XX Encoder,True,False,0,,0,0,2,,CVE-2019-6814,0,2024-03-12 10:43:50.939218
TP-Link,TP-Link multiple devices,True,True,0,0.0,0,0,3,{},CVE-2017-16959,153,2024-12-28 12:40:35.661898
Alibaba,Fastjson,True,True,0,0.0,32,52,29,{},CVE-2017-18349,11222,2025-12-01 12:57:36.289757
NETGEAR,NETGEAR ReadyNAS Surveillance,True,True,0,0.0,30,58,40,{},CVE-2017-18378,7758,2025-12-05 12:56:12.967908
Ericsson-LG,iPECS NMS 30M,True,True,0,0.0,17,18,21,{},CVE-2018-15138,11089,2025-11-26 12:57:21.238164
Totolink,Totolink N600R,True,True,0,0.0,0,0,103,{},CVE-2022-28906,296,2025-10-12 12:45:43.451539
Temenos,Temenos T24,True,True,0,0.0,19,15,18,{},CVE-2019-14251,11041,2025-11-26 12:57:21.268742
Wordpress,Wordpress Social Warfare plugin,True,True,0,0.0,92,437,305,{},CVE-2019-9978,31342,2025-12-02 12:58:40.243675
netis,netis WF2419,True,True,0,,0,0,1,,CVE-2019-19356,0,2024-03-12 10:43:50.941712
TopThink,ThinkPHP5,True,True,0,0.0,0,0,1,{},CVE-2018-20062,14,2025-08-21 12:52:46.370782
Atlassian,JIRA,True,True,0,0.0,50,55,94,{},CVE-2019-11581,20751,2025-12-02 12:58:40.129825
D-Link,D-Link Central WiFiManager CWM-100,True,True,0,0.0,29,19,31,{},CVE-2018-15517,16019,2025-11-23 12:47:09.062334
Eaton,Intelligent Power Manager,True,True,0,0.0,138,114,68,{},CVE-2018-12031,15812,2025-11-25 12:56:15.371223
Cisco,Cisco RV132W/RV134W,True,True,0,0.0,14,9,19,{},CVE-2018-0127,12334,2025-12-05 12:56:12.887978
Apache,ActiveMQ,True,True,0,0.0,67,17,23,{},CVE-2018-8006,6551,2025-11-26 12:57:21.185366
Apache,Airflow,True,True,0,0.0,0,0,49,{},CVE-2022-24288,233,2025-09-07 12:44:00.604389
Verizon,Verizon Fios Quantum Gateway (G1100),True,True,0,0.0,0,0,51,{},CVE-2019-3914,51,2024-11-27 12:48:49.092770
IBM,BigFix,True,True,0,0.0,712,871,839,{},CVE-2019-4061,18186,2024-10-28 12:46:31.680485
Atlassian,JIRA,True,True,0,0.0,1,78,51,{},CVE-2019-8446,25310,2025-12-04 12:59:17.612395
Wowza Media Systems,Wowza Streaming Engine,True,True,0,0.0,18,15,16,{},CVE-2018-19365,5220,2025-11-26 12:57:21.313643
SonicWall,SonicWall Global Management System,True,True,0,0.0,2,1,1,{},CVE-2018-9866,18,2025-01-16 01:42:44.113883
Cisco,Cisco IOS,True,True,0,0.0,27,199,132,{},CVE-2001-0537,68799,2025-12-04 12:59:17.457283
